{
  "entity_type": "Organism",
  "camouflage_presence": "Camouflage",
  "object_category": "Fish",
  "object_name": "Pipefish",
  "background_description": "The background consists of a vibrant blue water column, a large, mottled brown and orange rock structure in the foreground, and various types of marine flora. On the left, there is a tall, dense clump of bright yellow, finely branched coral or algae. On the right, a bushier, reddish-brown, more broadly branched plant is present. The rock shows textural variations and lighter patches.",
  "color_similarity": "high",
  "texture_similarity": "high",
  "contrast_difference": "low",
  "camouflage_score": "0.9",
  "confidence": "1.0",
  "camouflage_type": "Mimicry",
  "explanation": "The Pipefish exhibits exceptional camouflage through mimicry. Its body coloration is a pale yellowish-green, almost perfectly matching the bright yellow, finely branched marine plant it is intertwined with on the left side of the image. Furthermore, the Pipefish's body shape and numerous leafy, frond-like appendages intricately mimic the texture and branching pattern of this plant, effectively breaking up its outline and making it extremely difficult to distinguish from the surrounding flora. This combination of color blending and detailed structural mimicry creates a very high degree of concealment, allowing the organism to blend seamlessly with its immediate environment."
}