{
  "entity_type": "Organism",
  "camouflage_presence": "Camouflage",
  "object_category": "Fish",
  "object_name": "Pipefish",
  "background_description": "The background consists of a dense arrangement of elongated, ribbon-like aquatic plant leaves or sea grasses. These plants display a range of colors from vibrant green to yellowish-green and brownish-orange, with some darker, almost black, sections. There is also a textured, mottled light brown/tan object (possibly a shell or rock) partially visible in the mid-background, creating further visual complexity. The environment is clearly aquatic, likely an aquarium or shallow marine habitat.",
  "color_similarity": "high",
  "texture_similarity": "high",
  "contrast_difference": "low",
  "camouflage_score": 0.88,
  "confidence": 1.0,
  "camouflage_type": "Mimicry",
  "explanation": "The Pipefish exhibits highly effective camouflage through mimicry of its aquatic plant environment. Its body is remarkably slender, elongated, and dark, closely matching the linear shape and somber coloration (dark green, brown, blackish) of the surrounding plant stems. The fish are positioned vertically, blending seamlessly with the dense vegetation, making it challenging to distinguish their bodies from the plant material. The low contrast and high similarity in both color and texture between the Pipefish and the plant stalks contribute significantly to its successful concealment, causing its outline to be disrupted and blend into the background."
}