{
  "entity_type": "Organism",
  "camouflage_presence": "Camouflage",
  "object_category": "Insect",
  "object_name": "StickInsect",
  "background_description": "The background consists of a dense mix of vibrant green grass blades, interspersed with dry, straw-colored grass and leaf litter. There's also a larger, light brown and slightly gray woody stem or branch visible on the right side of the image, and small green plant buds with a white flower at the bottom left.",
  "color_similarity": "high",
  "texture_similarity": "high",
  "contrast_difference": "low",
  "camouflage_score": "0.85",
  "confidence": "1.0",
  "camouflage_type": "Mimicry",
  "explanation": "The StickInsect in this image exhibits excellent camouflage primarily through mimicry. Its elongated, slender body and thin legs are almost perfectly camouflaged as a dry blade of grass or a small twig. Its light brown, straw-like coloration blends seamlessly with the surrounding dry grass and leaf litter, making it very difficult to distinguish from the natural debris. The subtle stripes on its body further enhance its resemblance to dried plant material. While there are green elements in the background, the insect positions itself among the brown elements, demonstrating effective habitat selection for its camouflage. Both its color and texture are highly similar to its immediate surroundings, resulting in low contrast difference against the dried vegetation."
}