{
  "entity_type": "Organism",
  "camouflage_presence": "Camouflage",
  "object_category": "Bird",
  "object_name": "Bittern",
  "background_description": "The background consists of a dense, tall stand of dried reeds or cattails, primarily in shades of brown, beige, and dark amber. The reeds are highly vertical with feathery, darker tops. Behind the reeds, there is a lighter, muted blue-grey area, likely water or sky, visible through gaps in the vegetation.",
  "color_similarity": "high",
  "texture_similarity": "high",
  "contrast_difference": "low",
  "camouflage_score": 0.88,
  "confidence": 1.0,
  "camouflage_type": "Pattern matching",
  "explanation": "The Bittern exhibits excellent camouflage in this image. Its plumage is a mottled pattern of browns, beiges, and darker streaks that perfectly match the colors and vertical textures of the dried reeds surrounding it. The strong vertical streaking on the bird's body and neck effectively mimics the individual stalks of the reeds, disrupting its outline and making it blend seamlessly into the dense vegetation. The overall color palette of the bird is nearly identical to the environment, resulting in high color similarity and low contrast difference against the reeds. The Bittern's posture, standing upright and still, further enhances its ability to disappear within the reed bed."
}