{
  "entity_type": "Organism",
  "camouflage_presence": "Camouflage",
  "object_category": "Fish",
  "object_name": "ScorpionFish",
  "background_description": "The background consists of a complex and textured coral reef environment. Prominent features include a large, pale brain coral with intricate, winding patterns on the left, various encrusting corals and algae in shades of muted green, brown, and yellow across the rocky substrate, and striking dark reddish-brown sponge-like coral formations towards the upper center. The overall texture is rough, irregular, and diverse, with deeper blue water visible in the background.",
  "color_similarity": "high",
  "texture_similarity": "high",
  "contrast_difference": "low",
  "camouflage_score": 0.9,
  "confidence": 1.0,
  "camouflage_type": "Color blending / Pattern matching / Shape disruption",
  "explanation": "The ScorpionFish exhibits excellent camouflage in this image. Its mottled body coloration, featuring shades of reddish-brown, white, and dark patches, perfectly mimics the diverse colors of the surrounding coral and rocky substrate, particularly blending with the reddish-brown sponge-like coral and the encrusting green and brown algae. The fish's highly textured and irregular body shape, with its spines, flaps, and rough surface, further disrupts its outline, making it almost indistinguishable from the bumpy, porous, and complex textures of the coral reef. There is very low contrast between the fish and its immediate environment, and its patterns merge seamlessly with the chaotic patterns of the reef, effectively hiding its presence."
}