{
  "entity_type": "Organism",
  "camouflage_presence": "Camouflage",
  "object_category": "Reptile",
  "object_name": "Chameleon",
  "background_description": "The background consists of numerous interwoven brown and reddish-brown tree branches with rough, textured bark. Scattered among these branches are some sparse green pine needles. The overall scene is set against a very bright, almost blown-out white sky, suggesting an overcast day or backlighting.",
  "color_similarity": "high",
  "texture_similarity": "medium",
  "contrast_difference": "medium",
  "camouflage_score": 0.75,
  "confidence": 0.9,
  "camouflage_type": "Color blending",
  "explanation": "The chameleon exhibits effective camouflage through color blending. Its mottled green and brownish-grey coloration closely matches the tones of the surrounding tree branches and the sparse green pine needles, making it difficult to discern at first glance. The scaly texture of its skin also provides a medium level of texture similarity to the rough bark. While the chameleon's lighter ventral side and open mouth provide some contrast, especially against the bright sky, its overall form is integrated with the complex network of branches, and its dorsal side blends very well. The dense arrangement of branches also contributes to shape disruption, breaking up the chameleon's outline. However, the high contrast with the bright sky makes it more noticeable than it would be against a more complex or darker background."
}