{
  "entity_type": "Organism",
  "camouflage_presence": "Camouflage",
  "object_category": "Fish",
  "object_name": "GhostPipefish",
  "background_description": "The background consists of an underwater environment dominated by dark purple and brownish hues. On the right, there is a large, intricate crinoid or feather star with numerous branching arms and feathery textures, exhibiting shades of reddish-brown and pale white. Towards the center and left, there are less distinct dark, textured structures, likely corals or sponges, with some lighter patches of white or pale rock/coral visible. The overall scene is complex and somewhat cluttered with biological textures.",
  "color_similarity": "medium",
  "texture_similarity": "high",
  "contrast_difference": "medium",
  "camouflage_score": 0.9,
  "confidence": 0.95,
  "camouflage_type": "Mimicry / Shape disruption / Pattern matching",
  "explanation": "The GhostPipefish exhibits excellent camouflage primarily through structural mimicry and shape disruption. Its body is adorned with numerous spiky, frilly protrusions and a highly irregular outline that closely mimics the branching, feathery textures of the crinoid or feather star in the immediate background. While the fish has bright white/yellowish spots against its dark body, which might seem high contrast, these spots, along with its fragmented shape, serve to break up its silhouette, making it difficult to discern as a single entity. The overall dark base color blends with the darker areas of the background, and the reddish-brown elements of the fish's fins and spikes also match the crinoid's coloration. The combination of intricate texture, disrupted shape, and patterned coloration makes the organism blend almost seamlessly with its complex environment."
}