{
  "entity_type": "Organism",
  "camouflage_presence": "Camouflage",
  "object_category": "Fish",
  "object_name": "Pipefish",
  "background_description": "The pipefish is situated on a complex underwater substrate composed of various corals, rocks, and thick patches of greenish-brown algae and detritus. The environment is highly textured with irregular surfaces, crevices, and areas of light and shadow, creating a very heterogeneous visual field. There are lighter greyish-white coral structures interspersed with darker, algal-covered areas.",
  "color_similarity": "high",
  "texture_similarity": "high",
  "contrast_difference": "low",
  "camouflage_score": 0.8,
  "confidence": 0.9,
  "camouflage_type": "Pattern matching",
  "explanation": "The Pipefish exhibits effective camouflage through a combination of pattern matching and color blending. Its body features a mottled pattern of light grey/white patches interspersed with irregular black spots and bands. This disruptive coloration effectively breaks up the pipefish's outline, making it difficult to distinguish from the highly textured and varied background of corals, rocks, and algae. The light and dark colors on its body directly mimic the light and shadow play, as well as the diverse color palette (lighter corals, darker algae/crevices) present in its immediate environment. The rough, irregular texture of its skin, combined with its elongated, slender body shape, further allows it to blend seamlessly with the bumpy, encrusted surfaces of the coral and rock. The internal high contrast of its pattern reduces its overall external contrast against the complex background, aiding in its concealment."
}