{
  "entity_type": "Organism",
  "camouflage_presence": "Camouflage",
  "object_category": "Insect",
  "object_name": "Grasshopper",
  "background_description": "The background consists predominantly of dried, curled brown leaves, varying in shades from light tan to dark reddish-brown. These leaves form a dense, textured layer of natural litter. Some parts of the background are out of focus, showing blurry brown and dark areas, suggesting more leaf litter and possibly soil or darker vegetation beneath.",
  "color_similarity": "high",
  "texture_similarity": "high",
  "contrast_difference": "low",
  "camouflage_score": 0.9,
  "confidence": 1.0,
  "camouflage_type": "Mimicry",
  "explanation": "The Grasshopper demonstrates exceptional camouflage, expertly mimicking a dried brown leaf. Its body color, a mottled brown with lighter and darker patches, perfectly matches the varying hues of the dead leaves it rests upon and that compose its surroundings. The texture of its exoskeleton, especially its wings, displays patterns and veins that are remarkably similar to the venation and surface irregularities found on the dried foliage. Furthermore, the overall shape of the grasshopper, particularly its broad, flattened form, enhances its resemblance to a fallen leaf. This combination of color blending, pattern matching, and shape mimicry results in an extremely low contrast difference between the organism and its environment, making it very difficult to detect visually."
}