{
  "entity_type": "Organism",
  "camouflage_presence": "Camouflage",
  "object_category": "Fish",
  "object_name": "GhostPipefish",
  "background_description": "The background consists of a complex underwater environment, primarily dominated by rough, irregular coral or rock formations covered in various types of marine growth, including green and brown algae, and white encrustations or detritus. There are shadows and dark crevices, along with some reddish-brown and whitish elements, creating a highly textured and varied substrate.",
  "color_similarity": "high",
  "texture_similarity": "high",
  "contrast_difference": "low",
  "camouflage_score": "0.9",
  "confidence": "1.0",
  "camouflage_type": "Mimicry",
  "explanation": "The GhostPipefish exhibits exceptional camouflage in this image. Its body coloration, predominantly olive-green with patches of white, closely matches the green algae and white encrustations present on the surrounding coral and rock formations. Furthermore, its elongated, segmented body and numerous frilly, rough appendages perfectly mimic the texture and irregular forms of the marine growth and detritus in its environment. This specific form of mimicry, where the organism appears to be part of the inanimate or plant-like background, makes its outline extremely difficult to discern, effectively disrupting its shape and allowing it to blend seamlessly into the complex underwater textures with very low contrast against the background."
}