{
  "entity_type": "Organism",
  "camouflage_presence": "Camouflage",
  "object_category": "Fish",
  "object_name": "Pipefish",
  "background_description": "The background is an underwater environment, likely a shallow seagrass bed or similar aquatic habitat. It features multiple long, slender blades of aquatic vegetation, some vibrant green and some covered in brownish detritus or decaying plant matter. The seabed visible beneath the vegetation is a mix of bluish-gray sandy or silty substrate with scattered brownish debris. The water contains noticeable particulate matter.",
  "color_similarity": "high",
  "texture_similarity": "medium",
  "contrast_difference": "low",
  "camouflage_score": 0.9,
  "confidence": 1.0,
  "camouflage_type": "Color blending / Shape disruption / Mimicry",
  "explanation": "The Pipefish demonstrates excellent camouflage through a combination of color blending, shape disruption, and mimicry. Its elongated, slender body closely mimics the shape and form of the surrounding aquatic plant stalks and blades, particularly the detritus-covered brownish ones. Its yellowish-brown coloration provides high color similarity with these decaying plant elements and the general brownish tones of the seabed debris, making it incredibly difficult to distinguish from its environment. This combination results in a very low contrast difference against the background, allowing the organism to blend seamlessly and effectively conceal itself."
}