{
  "entity_type": "Organism",
  "camouflage_presence": "Camouflage",
  "object_category": "Insect",
  "object_name": "Hoverfly",
  "background_description": "A vibrant orange flower with textured petals occupies the majority of the background, showing some depth and variation in hue. Behind the flower, there is a blurred area of green and dark red, suggesting foliage and other parts of the plant.",
  "color_similarity": "medium",
  "texture_similarity": "low",
  "contrast_difference": "high",
  "camouflage_score": 0.75,
  "confidence": 0.95,
  "camouflage_type": "Mimicry",
  "explanation": "The insect in the image is a hoverfly (likely a species from the Syrphidae family). Its black and yellow-orange striped pattern is a classic example of Batesian mimicry, where a harmless species (the hoverfly) evolves to imitate the warning coloration of a harmful one (like a bee or wasp). This deception serves as a defense mechanism to deter predators. While the hoverfly's distinct markings create a high contrast against the bright orange flower it is resting on, making it visually prominent in this immediate environment, its overall strategy is a form of camouflage through mimicry rather than blending into its surroundings."
}