{
  "entity_type": "Organism",
  "camouflage_presence": "Camouflage",
  "object_category": "Insect",
  "object_name": "Katydid",
  "background_description": "The background consists of vibrant green fern fronds. The fronds are made up of numerous small, segmented leaflets (pinnae or pinnules) arranged along a central rachis. The leaves exhibit visible fine venation and a slightly textured, somewhat waxy surface. A darker brown stem/rachis is visible on the left side, and there are deep black areas representing shadows or obscured background elements.",
  "color_similarity": "high",
  "texture_similarity": "high",
  "contrast_difference": "low",
  "camouflage_score": "0.9",
  "confidence": "1.0",
  "camouflage_type": "Mimicry",
  "explanation": "The Katydid demonstrates excellent camouflage by perfectly blending with the green fern leaf. Its body and wings are a translucent, light green, almost perfectly matching the hue and lightness of the surrounding foliage. The insect's wings possess fine vein-like patterns and texture that closely resemble the venation of the fern leaf, enhancing its integration with the plant. The overall form of the Katydid, with its flattened, leaf-like body and delicate, thin legs, further contributes to its ability to mimic a part of the plant itself. The low contrast difference between the Katydid and the leaf makes it incredibly difficult to discern, showcasing highly effective mimicry and color blending."
}