{
  "entity_type": "Organism",
  "camouflage_presence": "Camouflage",
  "object_category": "Fish",
  "object_name": "Pipefish",
  "background_description": "The background consists of dark, shadowy water with light-colored, irregularly branched, tubular structures, likely corals or sponges. The overall lighting is dim, creating a strong contrast between illuminated parts of the structures and the dark depths, with some diffused light catching the edges of the background elements.",
  "color_similarity": "medium",
  "texture_similarity": "low",
  "contrast_difference": "medium",
  "camouflage_score": 0.65,
  "confidence": 0.9,
  "camouflage_type": "Mimicry",
  "explanation": "The Pipefish exhibits camouflage through a combination of mimicry and color blending. Its slender, elongated body closely mimics the branched, tubular structures of the coral or sponge in the background, making it difficult to discern its outline as a distinct organism. The light base coloration of its body also blends moderately with the lighter parts of the background elements, reducing color contrast. However, the distinct black stripes and yellow markings on its head, along with its prominent eyes and purplish snout, create some areas of higher contrast, particularly against the darker surrounding water. Despite these prominent facial features, the overall effect is that its body form and color allow it to blend reasonably well by appearing as part of the environment rather than a separate creature."
}