{
  "entity_type": "Organism",
  "camouflage_presence": "Camouflage",
  "object_category": "Fish",
  "object_name": "GhostPipefish",
  "background_description": "The background consists of dense, vibrant yellow, frilly marine flora, likely seaweed or hydroids, with darker, blurred areas and brown, branch-like structures interspersed. The environment is clearly an underwater scene.",
  "color_similarity": "high",
  "texture_similarity": "high",
  "contrast_difference": "low",
  "camouflage_score": 0.95,
  "confidence": 1.0,
  "camouflage_type": "Mimicry",
  "explanation": "The GhostPipefish demonstrates outstanding camouflage, primarily through mimicry of its immediate environment. Its elongated body is adorned with numerous frilly, branching appendages that precisely replicate the texture and shape of the surrounding dense yellow marine flora. The organism's mottled coloration, featuring pale yellowish-brown, greenish, and brownish tones, harmonizes perfectly with the bright yellow hues of the flora and the darker brown of the branch-like elements. This masterful combination of shape disruption, pattern matching, and color blending makes the GhostPipefish exceptionally difficult to discern from its habitat, effectively rendering it almost invisible."
}