{
  "entity_type": "Organism",
  "camouflage_presence": "Camouflage",
  "object_category": "Fish",
  "object_name": "SeaHorse",
  "background_description": "The background consists primarily of a gorgonian coral, which displays a lumpy, textured surface in shades of reddish-pink and white. The areas immediately surrounding the coral branches are completely black, indicating a dark deep-water environment or a heavily focused shot.",
  "color_similarity": "high",
  "texture_similarity": "high",
  "contrast_difference": "low",
  "camouflage_score": 0.95,
  "confidence": 1.0,
  "camouflage_type": "Mimicry",
  "explanation": "The SeaHorse in this image demonstrates exceptional camouflage, almost perfectly blending with the gorgonian coral it is resting upon. Its body exhibits a coloration of pale pinks and whites, adorned with numerous reddish-pink, bulbous protuberances (tubercles), which are nearly identical in color and shape to the polyps and surface texture of the coral. The seahorse's unique morphology, with its irregular and bumpy outline, further contributes to shape disruption, making its individual form almost indistinguishable from the coral branches. The extremely high color and texture similarity, coupled with the low contrast difference between the organism and its environment, creates an effective visual disguise, which is a prime example of mimicry where the organism imitates its substrate."
}