{
  "entity_type": "Organism",
  "camouflage_presence": "Camouflage",
  "object_category": "Insect",
  "object_name": "Katydid",
  "background_description": "The background consists primarily of vibrant green leaves, some in sharp focus revealing veins and slight textural variations, while others are softly blurred, creating a diffuse green environment. There are bright highlights on the shiny leaf surfaces, suggesting a light source from above or behind, and deeper shadowed areas. A small tear or hole is visible in one of the leaves in the upper left.",
  "color_similarity": "high",
  "texture_similarity": "medium",
  "contrast_difference": "low",
  "camouflage_score": "0.85",
  "confidence": "0.95",
  "camouflage_type": "Mimicry",
  "explanation": "The Katydid demonstrates excellent camouflage through mimicry. Its entire body, especially its wing cases, is a vivid green that closely matches the various shades of green present in the surrounding leaves. This high color similarity makes it incredibly difficult to distinguish the organism from its environment at first glance. While its texture isn't perfectly identical to the rougher leaf surfaces, the Katydid's smooth, elongated body with subtle longitudinal lines contributes to a leaf-like appearance, specifically resembling a young or smooth leaf. The low contrast difference between the Katydid and the leaves, combined with its strategic positioning amongst the foliage, effectively breaks up its outline and prevents it from standing out visually. Its leg segments also display some reddish-brown markings that could blend with minor imperfections or shadows on leaves, further enhancing its mimicry."
}