{
  "entity_type": "Organism",
  "camouflage_presence": "Camouflage",
  "object_category": "Insect",
  "object_name": "Katydid",
  "background_description": "The background consists of a tree trunk heavily covered in various shades of green moss, patches of lighter, almost white or pale green lichen, and some darker, damp bark areas. The surface is rough and irregular, with varied textures and small growths. The lighting appears dim, characteristic of a nocturnal or deep forest setting.",
  "color_similarity": "high",
  "texture_similarity": "high",
  "contrast_difference": "low",
  "camouflage_score": 0.95,
  "confidence": 1.0,
  "camouflage_type": "Mimicry",
  "explanation": "The Katydid exhibits exceptional camouflage by mimicking a patch of light-colored lichen or a pale fungal growth on the tree trunk. Its body color is a pale, whitish-green that perfectly matches the lighter patches of lichen present on the bark. The irregular, somewhat flattened shape and granular texture of the Katydid further enhance this mimicry, allowing it to blend seamlessly with the natural patterns and textures of the moss-covered and lichen-encrusted environment. The contrast difference between the Katydid and its immediate surroundings is very low, making it extremely difficult to distinguish the insect's outline from the background. This combination of color blending, texture matching, and mimicry of a non-animal object provides a very high level of concealment."
}