{
  "entity_type": "Organism",
  "camouflage_presence": "Camouflage",
  "object_category": "Fish",
  "object_name": "SeaHorse",
  "background_description": "The background consists of a textured, sandy or gravelly seabed interspersed with various marine invertebrates. Prominently featured are coral-like structures with numerous small, white, star-shaped polyps, exhibiting colors ranging from white and pale orange to pink and a blueish-purple at the base of some structures. The substrate itself has patches of blue-green, brown, and lighter sand grains.",
  "color_similarity": "high",
  "texture_similarity": "high",
  "contrast_difference": "low",
  "camouflage_score": 0.9,
  "confidence": 1.0,
  "camouflage_type": "Mimicry",
  "explanation": "The SeaHorse exhibits excellent camouflage, blending seamlessly with its complex marine environment. Its body coloration, featuring pale pinks, whites, light oranges, and subtle blueish tones, closely matches the diverse palette of the surrounding corals and the variegated seabed. Crucially, the seahorse's skin is highly textured with numerous spiky appendages and protuberances that meticulously mimic the branching and polyp-like structures of the nearby coral or sponge-like organisms. This structural mimicry, combined with intricate patterns on its body, effectively disrupts its outline and prevents it from standing out against the busy background, making it extremely difficult to distinguish from its surroundings."
}