{
  "entity_type": "Organism",
  "camouflage_presence": "Camouflage",
  "object_category": "Insect",
  "object_name": "Caterpillar",
  "background_description": "The background consists of various plant branches and twigs, some in sharp focus and others blurred, with a soft-focus green foliage in the distant background. The main branch the caterpillar is resting on is thin, gnarled, and appears woody, with variations in color from light green to brownish tones, showing some natural texture and irregularities often found on bark and small twigs.",
  "color_similarity": "high",
  "texture_similarity": "high",
  "contrast_difference": "low",
  "camouflage_score": 0.9,
  "confidence": 0.95,
  "camouflage_type": "Mimicry",
  "explanation": "The caterpillar exhibits exceptional camouflage primarily through mimicry and shape disruption. Its body is highly irregular, covered in angular protrusions and textured surfaces that closely resemble dried leaves, broken twigs, or bark flakes. The mottled brown, reddish, and white coloration further enhances this effect by blending with the natural variations in color and texture found on the woody branch. The fragmented appearance effectively breaks up its outline, preventing it from being perceived as a continuous organism and making it extremely difficult to distinguish from its inanimate surroundings. It looks like a collection of debris rather than a living creature."
}