{
  "entity_type": "Organism",
  "camouflage_presence": "Camouflage",
  "object_category": "Fish",
  "object_name": "Pipefish",
  "background_description": "The background consists of an underwater environment with a sandy and rocky seafloor. It is densely covered with various forms of marine life, including reddish-brown and brown algae, detritus, and small sediment particles. The overall color palette is earthy, dominated by browns, tans, and dull reds, with some darker shadows and lighter sandy patches.",
  "color_similarity": "high",
  "texture_similarity": "high",
  "contrast_difference": "low",
  "camouflage_score": 0.9,
  "confidence": 0.95,
  "camouflage_type": "Color blending / Shape disruption / Mimicry",
  "explanation": "The Pipefish exhibits excellent camouflage in this image. Its elongated, slender body shape and mottled brown and tan coloration allow it to blend seamlessly with the surrounding environment of sandy substrate, small rocks, and various types of brown and reddish filamentous algae and detritus. The texture of its skin also mimics the rough, irregular surfaces of the seabed and organic debris. The overall color similarity is high, and the contrast difference between the fish's body and its background is low, making it very difficult to distinguish its outline. Its body form effectively disrupts its silhouette by mimicking the linear elements of the marine plant life, contributing to strong mimicry and making it look like a piece of the environment rather than a distinct organism."
}