{
  "entity_type": "Organism",
  "camouflage_presence": "Camouflage",
  "object_category": "Mammal",
  "object_name": "Dog",
  "background_description": "The background is uniformly dark, appearing as a deep, featureless black void. There are no discernible textures, objects, or environmental elements present, indicating a completely unlit or isolated dark space.",
  "color_similarity": "high",
  "texture_similarity": "high",
  "contrast_difference": "low",
  "camouflage_score": 0.9,
  "confidence": 0.95,
  "camouflage_type": "Color blending",
  "explanation": "The dog, a chocolate Labrador, possesses very dark brown fur which blends exceptionally well with the uniformly black background. The majority of the dog's body is enveloped in deep shadow, making it nearly indistinguishable from the environment. This results in extremely high color similarity and very low contrast between the dog and its surroundings. Only one eye, which reflects some light, and a faint outline of the snout are clearly visible, preventing complete optical disappearance. The effective camouflage is achieved through a combination of the dog's natural dark coloration and the lack of illumination against a dark backdrop, creating an impressive 'shadow hiding' effect and color blending."
}