{
  "entity_type": "Organism",
  "camouflage_presence": "Camouflage",
  "object_category": "Fish",
  "object_name": "GhostPipefish",
  "background_description": "The background consists of clear turquoise-blue ocean water with visible particulate matter (backscatter). The immediate environment is dominated by a large, dark reddish-brown to black feather star (crinoid) with numerous delicate, feathery arms that branch out. Interspersed among the crinoid arms are patches of fine, filamentous green and brownish-orange algae or hydroids, creating a dense, highly textured, and complex underwater habitat.",
  "color_similarity": "high",
  "texture_similarity": "high",
  "contrast_difference": "low",
  "camouflage_score": 0.9,
  "confidence": 1.0,
  "camouflage_type": "Mimicry",
  "explanation": "The GhostPipefish demonstrates exceptional camouflage through a sophisticated combination of mimicry, shape disruption, color blending, and pattern matching. Its elongated, slender body is adorned with numerous spiky and frilly appendages that perfectly replicate the intricate, feathery structure of the crinoid arms and the surrounding filamentous algae it inhabits. The fish's reddish-brown base color, highlighted with white and cream speckles, blends seamlessly with the dark, rich hues of the crinoid and the varied green and brown tones of the other plant-like growths. This combination effectively breaks up its outline and prevents it from contrasting sharply with the busy background, making it incredibly difficult to detect among the complex textures and patterns of its environment."
}