{
  "entity_type": "Organism",
  "camouflage_presence": "Camouflage",
  "object_category": "Fish",
  "object_name": "LeafySeaDragon",
  "background_description": "The background consists of an underwater environment featuring large, textured rocks, varying in color from dark greenish-blue to mottled brown and purple. Several prominent stalks and blades of dark greenish-brown kelp or large marine algae are visible, particularly on the right side. Smaller patches of green and purplish algae growth adhere to the rocky surfaces. The water in the upper background appears clear and light blue.",
  "color_similarity": "high",
  "texture_similarity": "high",
  "contrast_difference": "low",
  "camouflage_score": 0.95,
  "confidence": 1.0,
  "camouflage_type": "Mimicry",
  "explanation": "The Leafy Sea Dragon demonstrates outstanding camouflage primarily through mimicry and shape disruption. Its body is adorned with numerous elaborate, leaf-like appendages that perfectly replicate the form, color, and translucency of the surrounding marine vegetation, specifically kelp and algae. The organism's overall pale yellowish-green coloration blends seamlessly with the greenish hues of the background flora and algae-covered rocks. The intricate frills effectively break up its silhouette, preventing it from being perceived as a distinct animal and instead making it appear as just another part of the drifting or rooted marine plant life. This results in very low contrast and high similarity in color and texture with its environment, rendering it almost invisible to predators and prey."
}