{
  "entity_type": "Organism",
  "camouflage_presence": "Camouflage",
  "object_category": "Fish",
  "object_name": "Pipefish",
  "background_description": "The background consists of a dense bed of submerged aquatic vegetation, likely seagrass, with long, thin, green blades. Many of the blades are covered in detritus, sediment, or epiphytes, giving them a mottled, brownish-white, or paler green appearance in places. The overall environment is murky underwater, with varying light penetration and dark shadowy areas among the dense plant growth.",
  "color_similarity": "high",
  "texture_similarity": "high",
  "contrast_difference": "low",
  "camouflage_score": 0.8,
  "confidence": 0.9,
  "camouflage_type": "Mimicry",
  "explanation": "The Pipefish exhibits excellent camouflage in this image. Its body is remarkably long and slender, closely mimicking the shape and linear form of the surrounding seagrass blades. The fish's coloration is a translucent pale yellowish-green, which blends seamlessly with the varied hues of the aquatic vegetation, especially those blades that are slightly faded or covered in sediment. Small dark spots visible along its body further enhance the texture similarity by resembling natural imperfections or detritus on the plant material. While the eye and a slight reddish tint near the head are somewhat discernible, the overall effect is one of very low contrast and high visual integration with its environment, making it very difficult to spot among the dense vegetation. This is a clear example of mimicry, where the organism's morphology and coloration imitate elements of its habitat."
}