{
  "entity_type": "Organism",
  "camouflage_presence": "Camouflage",
  "object_category": "Mammal",
  "object_name": "Lioness",
  "background_description": "The background consists of dry, golden-brown savanna grass with some sparse, thin stems and shadows. The ground appears arid and dusty, consistent with a savanna or grassland during a dry season. The lighting suggests a bright, sunny day, creating highlights and shadows within the tall grass.",
  "color_similarity": "high",
  "texture_similarity": "medium",
  "contrast_difference": "low",
  "camouflage_score": 0.8,
  "confidence": 1.0,
  "camouflage_type": "Color blending",
  "explanation": "The lioness exhibits effective natural camouflage through color blending. Its tawny-brown fur closely matches the dry, golden-brown savanna grass, providing high color similarity with the arid environment. This coloration makes it difficult for the animal to be spotted by prey or rival predators, especially when stalking or resting. While its fur has a smoother texture than the rough grass, the overall mottled appearance and slight variations in the lioness's coat blend well with the varied textures of the dry vegetation. The contrast difference between the lioness and its background is low, which further enhances its ability to disappear within the landscape."
}