{
  "entity_type": "Organism",
  "camouflage_presence": "Camouflage",
  "object_category": "Insect",
  "object_name": "Katydid",
  "background_description": "The background consists of deeply textured tree bark, displaying various shades of brown, dark brown, and greyish-brown. The bark has a rough, uneven surface with numerous cracks, crevices, and irregular patterns, some areas appearing darker due to shadows or deeper indentations, and lighter where raised. There are also hints of green moss in the upper right portion of the bark.",
  "color_similarity": "high",
  "texture_similarity": "high",
  "contrast_difference": "low",
  "camouflage_score": "0.9",
  "confidence": "1.0",
  "camouflage_type": "Pattern matching",
  "explanation": "The Katydid demonstrates exceptional camouflage in this image. Its body is covered in a complex, mottled pattern of black, white, and various shades of grey and brown, which perfectly mimics the colors, textures, and irregular shapes found on the surrounding tree bark. This highly disruptive coloration and pattern matching effectively break up the insect's outline, making it extremely difficult to distinguish its form from the textured background. The color blending is superb, with the varying tones on its body closely matching the light and dark areas, cracks, and raised sections of the bark. This combination of pattern, color, and texture similarity results in a very low contrast difference between the Katydid and its environment, allowing it to blend seamlessly."
}