{
  "entity_type": "Organism",
  "camouflage_presence": "Camouflage",
  "object_category": "Fish",
  "object_name": "GhostPipefish",
  "background_description": "The background consists of an underwater environment densely covered with marine growth, including various forms of algae, detritus, and possibly coral or rock fragments. The colors are predominantly mottled greenish-browns, darker browns, and some lighter beige or yellowish patches, creating a textured and irregular surface. Small particulates and organic debris are visible throughout.",
  "color_similarity": "high",
  "texture_similarity": "high",
  "contrast_difference": "low",
  "camouflage_score": 0.9,
  "confidence": 0.95,
  "camouflage_type": "Mimicry",
  "explanation": "The GhostPipefish demonstrates exceptional camouflage, blending almost perfectly with its complex marine habitat. Its body, especially the broad, fan-like fins, exhibits a mottled greenish-brown coloration that precisely matches the algae and detritus in the background. The irregular, serrated edges and feathery appearance of its fins and body mimic the texture and shape of decaying plant matter or drifting seaweed. This remarkable mimicry, combined with high color and texture similarity, effectively disrupts the fish's outline and makes it incredibly difficult to distinguish from the surrounding environment, providing a high degree of protection from predators and enhancing its ability to ambush prey."
}