{
  "entity_type": "Organism",
  "camouflage_presence": "Camouflage",
  "object_category": "Fish",
  "object_name": "ScorpionFish",
  "background_description": "The background consists of a complex underwater reef environment, predominantly composed of stony corals and rocky substrata. The colors are mottled, featuring shades of brown, reddish-brown, off-white, and some darker, almost greenish-brown patches. The textures are highly irregular, bumpy, and rough, with numerous crevices, ridges, and a coral formation with a distinct porous, nodular surface in the foreground.",
  "color_similarity": "high",
  "texture_similarity": "high",
  "contrast_difference": "low",
  "camouflage_score": 0.95,
  "confidence": 1.0,
  "camouflage_type": "Color blending / Pattern matching / Shape disruption / Texture matching",
  "explanation": "The ScorpionFish exhibits exceptional camouflage in this image. Its mottled coloration, comprising various shades of brown, reddish-brown, and off-white, perfectly matches the colors of the surrounding rocky reef and coral. The fish's irregular, bumpy, and warty skin texture precisely mimics the rough, uneven surfaces of the stony corals and rocks, making it almost indistinguishable from its environment. Furthermore, its body shape is highly disrupted and irregular, breaking up its outline and preventing it from being easily recognized against the similarly chaotic background. The combination of color blending, intricate pattern matching, texture mimicry, and shape disruption results in a very low contrast difference with the background, allowing the ScorpionFish to blend seamlessly."
}