{
  "entity_type": "Organism",
  "camouflage_presence": "Camouflage",
  "object_category": "Insect",
  "object_name": "Caterpillar",
  "background_description": "The background consists of the underside of a light greenish-yellow leaf, characterized by a dense covering of fine, fuzzy hairs and a network of subtle, raised veins. The texture is soft and velvety, and the lighting is even, preventing harsh shadows.",
  "color_similarity": "high",
  "texture_similarity": "high",
  "contrast_difference": "low",
  "camouflage_score": 0.9,
  "confidence": 1.0,
  "camouflage_type": "Pattern matching",
  "explanation": "The caterpillars demonstrate exceptional camouflage by blending almost seamlessly with the leaf. Their greenish-yellow body color very closely matches the muted hue of the leaf. The most remarkable aspect of their camouflage is the presence of numerous fine, hair-like projections extending from their bodies. These projections perfectly mimic the dense, fuzzy texture of the leaf's surface, effectively disrupting the caterpillars' outlines and making them appear as an extension of the leaf rather than distinct entities. This combination of high color similarity and masterful texture/pattern matching results in a very low visual contrast, making the caterpillars extremely difficult to discern."
}