{
  "entity_type": "Organism",
  "camouflage_presence": "Camouflage",
  "object_category": "Fish",
  "object_name": "SeaHorse",
  "background_description": "The background is an underwater environment consisting of a seabed covered with fine sediment, small gravel, fragments of shells, and a dense growth of finely branched brown and greenish-brown algae or hydroids. The overall texture is complex and mottled, with variations in light and shadow.",
  "color_similarity": "high",
  "texture_similarity": "high",
  "contrast_difference": "low",
  "camouflage_score": "0.95",
  "confidence": "0.98",
  "camouflage_type": "Mimicry",
  "explanation": "The SeaHorse in this image exhibits exceptional camouflage. Its body coloration, a mottled mix of browns, beiges, and reddish-browns, perfectly matches the earthy tones of the surrounding sediment, detritus, and algae. The most striking feature is its highly specialized morphology: the seahorse's body is covered with numerous frilly, branching appendages that precisely mimic the texture and structure of the surrounding hydroids or algae. This structural mimicry, coupled with its matching coloration, effectively breaks up its outline and prevents it from being recognized as a distinct organism. The low contrast difference between the SeaHorse and its immediate environment further enhances its ability to blend seamlessly, making it extremely difficult to detect even upon close inspection. This is a clear example of both color blending and structural mimicry."
}