{
  "entity_type": "Organism",
  "camouflage_presence": "Camouflage",
  "object_category": "Arachnid",
  "object_name": "Spider",
  "background_description": "The background consists of a tree trunk with deeply fissured and rugged bark. The bark exhibits a variety of earthy tones, including shades of brown, reddish-brown, grey, and some lighter, almost whitish patches that suggest lichen or weathered areas. The surface is highly textured with prominent ridges, grooves, and irregular patterns.",
  "color_similarity": "high",
  "texture_similarity": "high",
  "contrast_difference": "low",
  "camouflage_score": 0.9,
  "confidence": 0.95,
  "camouflage_type": "Color blending / Pattern matching / Shape disruption",
  "explanation": "The spider demonstrates excellent camouflage against the tree bark. Its body and legs display a mottled pattern of browns, greys, and darker shades that perfectly match the varied coloration and intricate patterns of the bark. The striped and blotchy markings on its legs and abdomen mirror the irregular textures, grooves, and lichen-like patches on the tree. This high degree of color and pattern similarity results in a very low contrast difference, making it incredibly difficult to visually separate the spider from its environment. Furthermore, its flattened posture and the way its legs blend with the bark's contours help to disrupt its distinct arachnid shape, enhancing its concealment."
}