{
  "entity_type": "Organism",
  "camouflage_presence": "Camouflage",
  "object_category": "Insect",
  "object_name": "Caterpillar",
  "background_description": "The background consists primarily of a textured tree trunk with rough, furrowed bark. The bark displays a variety of natural colors including dark browns, greys, and lighter patches, along with areas of light green and grey lichen growth. To the right, there is a soft, out-of-focus background of bright green foliage.",
  "color_similarity": "high",
  "texture_similarity": "high",
  "contrast_difference": "low",
  "camouflage_score": 0.9,
  "confidence": 1.0,
  "camouflage_type": "Pattern matching",
  "explanation": "The caterpillar exhibits exceptional camouflage against the tree bark. Its body coloration, a complex mix of browns, greys, and mottled patterns, almost perfectly matches the variegated hues of the bark and the lichen growing on it. Furthermore, the caterpillar's rough, bumpy texture closely mimics the uneven and cracked surface of the tree bark, making it incredibly difficult to distinguish its form from the background. The combination of high color and texture similarity, along with very low contrast difference, makes this a clear example of effective pattern matching and background blending."
}