{
  "entity_type": "Organism",
  "camouflage_presence": "Camouflage",
  "object_category": "Fish",
  "object_name": "Seahorse",
  "background_description": "The background consists of several slender, vertical, green plant-like stalks in the foreground, with a dark, blurred purple-brown to black watery background behind them, exhibiting some visible grain.",
  "color_similarity": "low",
  "texture_similarity": "low",
  "contrast_difference": "high",
  "camouflage_score": 0.35,
  "confidence": 0.95,
  "camouflage_type": "Mimicry",
  "explanation": "The organism is a seahorse, which are known for their ability to use their body morphology and coloration to blend with marine vegetation or coral. In this image, the seahorse is positioned vertically among slender green plant-like stalks, aligning its elongated body with the vertical lines of the environment, which is a form of structural mimicry. This positioning also helps to partially disrupt its outline against the dark background. However, its prominent orange-brown color provides low color similarity and high contrast against the green stalks and the dark, deep-water background, making the camouflage less effective in terms of color blending in this specific scene."
}