{
  "entity_type": "Organism",
  "camouflage_presence": "Camouflage",
  "object_category": "Mammal",
  "object_name": "Wolf",
  "background_description": "The background consists of a dense field of tall, dry, golden-brown and tan grasses. The grass stalks are mostly vertical, creating a highly textured and somewhat uniform pattern that extends to the horizon. There are subtle variations in hue and light/shadow within the grass, indicating direct sunlight.",
  "color_similarity": "high",
  "texture_similarity": "medium",
  "contrast_difference": "low",
  "camouflage_score": 0.85,
  "confidence": 0.95,
  "camouflage_type": "Color blending",
  "explanation": "The wolf exhibits strong camouflage in this image primarily through color blending. Its fur features a palette of golden-brown, tan, and lighter cream tones that remarkably match the dry, golden-brown grasses of its environment. This high degree of color similarity makes it difficult to distinguish the animal from the background. The texture of its fur, while not identical to the individual grass blades, has enough variation and depth to blend with the textured environment, contributing to a medium texture similarity. Furthermore, the overall contrast between the wolf and the background is low, as its form does not starkly stand out. The dense, tall grass also partially obscures its body, aiding in shape disruption and making it harder for a predator or prey to quickly identify its outline. The combination of these factors results in effective camouflage."
}