{
  "entity_type": "Organism",
  "camouflage_presence": "Camouflage",
  "object_category": "Fish",
  "object_name": "GhostPipefish",
  "background_description": "The background consists of a dark, likely deep-water or night marine environment, featuring the intricate, branching arms of a crinoid (feather star). These arms are primarily dark reddish-brown, with numerous bright yellow-orange, segmented, and frond-like extensions or pinnules creating a complex, textured backdrop.",
  "color_similarity": "high",
  "texture_similarity": "high",
  "contrast_difference": "low",
  "camouflage_score": 0.9,
  "confidence": 1.0,
  "camouflage_type": "Mimicry",
  "explanation": "The GhostPipefish exhibits exceptional camouflage through a combination of mimicry, pattern matching, and shape disruption. Its body is highly irregular, covered in spiky and frond-like appendages that precisely mimic the branching structure and texture of the crinoid's arms and pinnules. The fish's coloration, a mix of reddish-brown, yellow-orange, and white speckles, perfectly matches the hues present in the crinoid, particularly the dark stems and the bright yellow-orange tips. This high degree of visual similarity in shape, texture, and color effectively disrupts the fish's outline, making it incredibly difficult to distinguish from its environment and allowing it to blend seamlessly into the complex structure of the feather star."
}