{
  "entity_type": "Organism",
  "camouflage_presence": "Camouflage",
  "object_category": "Fish",
  "object_name": "BatFish",
  "background_description": "The background consists of a shallow underwater environment, characterized by a sandy and silty seabed. Scattered across the bottom are small pebbles, detritus, and patches of fine, branching marine algae or plant matter, displaying muted shades of green, brown, and reddish hues. The water itself appears slightly turbid, further reducing visibility and softening edges.",
  "color_similarity": "high",
  "texture_similarity": "high",
  "contrast_difference": "low",
  "camouflage_score": 0.9,
  "confidence": 1.0,
  "camouflage_type": "Mimicry",
  "explanation": "The BatFish exhibits exceptional camouflage by perfectly blending with its immediate environment. Its body coloration, which includes mottled browns, greens, and grays, closely matches the sandy, silty seabed and the marine detritus. The fish's highly irregular and flattened body shape, along with its rough, bumpy texture and frilly fin edges, remarkably mimics the appearance of rocks, algae, and seabed debris. The reticulated pattern on its fins further enhances this mimicry, making its outline almost indistinguishable from the background. The low contrast and high similarity in color and texture between the BatFish and its surroundings make it incredibly difficult to spot, suggesting an advanced form of mimicry to avoid predators or ambush prey."
}