{
  "entity_type": "Organism",
  "camouflage_presence": "Camouflage",
  "object_category": "Mammal",
  "object_name": "Tiger",
  "background_description": "The background consists of dark, blurry green foliage or dense vegetation, suggesting a forest or jungle environment. In the foreground, the tigers are resting on a dark greyish-brown, textured surface, likely rock or wood.",
  "color_similarity": "medium",
  "texture_similarity": "low",
  "contrast_difference": "high",
  "camouflage_score": "0.6",
  "confidence": "1.0",
  "camouflage_type": "Disruptive pattern",
  "explanation": "The image features two tigers, prominent mammals known for their distinctive striped coats which serve as a form of camouflage. This pattern, characterized by orange-brown fur with black stripes, is a classic example of disruptive coloration. It helps break up the animal's outline and blends with the vertical elements (like trees) and shadows in their natural habitat of forests and tall grasses, making them harder for prey to spot. In this specific image, while the background is a dark, blurry green and the foreground a greyish-brown surface, the black stripes still contribute to breaking up the tiger's form by mimicking shadows. However, the bright orange and white areas of the tigers create a relatively high contrast against the uniformly dark background, making them quite visible. Therefore, while the camouflage pattern is inherently present and functional, its effectiveness is somewhat reduced against this immediate backdrop compared to a more varied and broken natural environment. The color similarity is medium because the black stripes can blend with shadows, but the orange and white fur contrasts with the dark green. Texture similarity is low as the soft fur differs from the blurry foliage and hard resting surface."
}