{
  "entity_type": "Organism",
  "camouflage_presence": "Camouflage",
  "object_category": "Fish",
  "object_name": "Pipefish",
  "background_description": "The background consists of a dense, cluttered underwater environment. It features various forms of marine growth, including green, red, and brown algae, detritus, and possibly encrusting sponges or corals. The textures are highly irregular and granular, with a mix of light-colored, encrusted areas, darker shadowed regions, and vibrant patches of green and red marine flora.",
  "color_similarity": "high",
  "texture_similarity": "high",
  "contrast_difference": "low",
  "camouflage_score": 0.9,
  "confidence": 0.95,
  "camouflage_type": "Mimicry",
  "explanation": "The Pipefish in this image demonstrates highly effective camouflage. Its elongated, irregular, and somewhat lumpy body shape, combined with its sandy-brown color and granular texture, allows it to closely mimic the surrounding detritus, fragments of coral, and various encrusted marine growths. The organism's outline is thoroughly disrupted by its resemblance to the ambient clutter, making it extremely difficult to distinguish from the background. The color palette of the pipefish perfectly matches the lighter, encrusted areas of the environment, and its texture mirrors the rough, uneven surfaces around it, resulting in very low contrast and high similarity in both color and texture."
}