{
  "entity_type": "Organism",
  "camouflage_presence": "Camouflage",
  "object_category": "Fish",
  "object_name": "GhostPipefish",
  "background_description": "The background consists of deep blue water with a large, intricate marine invertebrate, likely a crinoid (feather star), which has numerous branching, feathery arms. The crinoid is predominantly dark reddish-brown to purplish, with some areas appearing vibrant red/pink due to lighting and possibly its natural coloration. Its texture is highly complex, spiky, and feathery.",
  "color_similarity": "high",
  "texture_similarity": "high",
  "contrast_difference": "low",
  "camouflage_score": "0.95",
  "confidence": "1.0",
  "camouflage_type": "Mimicry",
  "explanation": "The GhostPipefish exhibits exceptional camouflage in this image. Its body morphology, covered in numerous spiky projections, filaments, and appendages, perfectly mimics the intricate, feathery structure of the crinoid it is positioned among. The primary body color of the fish is a dark reddish-brown/purplish, which closely matches the dominant color of the crinoid. Additionally, the white and yellow spots on the fish's body further break up its outline and blend with the perceived textural variations of the background. The combination of its disruptive shape, highly similar coloration, and texture matching makes the GhostPipefish incredibly difficult to distinguish from the crinoid, demonstrating a highly effective form of mimicry."
}