{
  "entity_type": "Organism",
  "camouflage_presence": "Camouflage",
  "object_category": "Insect",
  "object_name": "StickInsect",
  "background_description": "The background consists of dense, dark green foliage and thin, winding green stems or vines. Some leaves are lighter green and prominent, while others recede into shadow. The lighting appears to be artificial (flash) against a dark, possibly nighttime or deeply shaded, natural environment, highlighting the immediate foreground vegetation.",
  "color_similarity": "high",
  "texture_similarity": "high",
  "contrast_difference": "low",
  "camouflage_score": 0.85,
  "confidence": 0.95,
  "camouflage_type": "Mimicry",
  "explanation": "The StickInsect in this image exhibits excellent camouflage through mimicry. Its elongated, slender body and legs perfectly replicate the appearance of a thin green stem or twig. The insect's yellowish-green coloration closely matches the hue of the surrounding stems and lighter green leaves, providing high color similarity. Furthermore, its smooth, segmented body texture mimics the texture of young plant stems. The insect's posture, extending its legs in a way that resembles additional plant growth, enhances the illusion. While the flash photography makes the insect somewhat illuminated, its form and color effectively blend it into the complex network of vegetation, making it extremely difficult to distinguish from the actual plant structures at first glance. The contrast difference is low against its immediate surroundings, further aiding its concealment."
}