{
  "entity_type": "Organism",
  "camouflage_presence": "Camouflage",
  "object_category": "Insect",
  "object_name": "StickInsect",
  "background_description": "The background consists of a uniformly blurred light grey to beige area, suggesting a distant, out-of-focus environment. In the mid-ground, a prominent, vibrant green stem or blade of grass runs horizontally. Below this main stem, there are thinner, darker, and somewhat curled plant tendrils or dried leaves.",
  "color_similarity": "medium",
  "texture_similarity": "high",
  "contrast_difference": "medium",
  "camouflage_score": 0.7,
  "confidence": 0.9,
  "camouflage_type": "Mimicry",
  "explanation": "The organism, identified as a StickInsect, exhibits effective camouflage through mimicry. Its extremely slender, elongated body and very thin, spiky legs are positioned horizontally along a bright green stem. This posture and morphology allow it to closely resemble a twig or a natural extension of the plant structure. While its reddish-brown color provides a medium contrast against the vibrant green stem, it aligns with colors commonly found in dried or woody plant parts, which is a key aspect of stick insect mimicry. The high texture and shape similarity, combined with its linear alignment with the stem, effectively disrupts its outline and enables it to blend seamlessly into the botanical environment, making it difficult for predators to spot."
}