{
  "entity_type": "Organism",
  "camouflage_presence": "Camouflage",
  "object_category": "Insect",
  "object_name": "Mantis",
  "background_description": "The background consists of rough, gnarled brown tree branches and twigs, some with freshly cut ends revealing lighter wood. The distant background is blurred with out-of-focus green foliage and earthy tones.",
  "color_similarity": "low",
  "texture_similarity": "low",
  "contrast_difference": "medium",
  "camouflage_score": "0.6",
  "confidence": "0.9",
  "camouflage_type": "Mimicry",
  "explanation": "The mantis displays remarkable leaf mimicry, with its flattened body, appendages, and serrated edges expertly shaped to resemble green foliage. Its mottled green coloration is inherently a camouflaging color for a leafy environment. However, in this specific image, the mantis is primarily situated on rough, brown tree branches and twigs. This placement results in a low color similarity and a medium contrast difference with its immediate woody background, making it somewhat noticeable despite its form. Despite this positional mismatch, its highly specialized morphology as a 'leaf insect' still functions as a strong form of camouflage, primarily through mimicry, causing potential predators to mistake it for inert plant matter rather than an animal."
}