{
  "entity_type": "Organism",
  "camouflage_presence": "Camouflage",
  "object_category": "Fish",
  "object_name": "GhostPipefish",
  "background_description": "The background consists of a dense, branching soft coral or gorgonian, characterized by numerous small, star-shaped polyps. The dominant colors are shades of yellowish-brown and olive green, with some polyps appearing bright white or pale yellow. The texture is highly irregular, feathery, and intricate, with many protrusions and a generally organic, clustered appearance. A faint light blue background, likely open water, is visible in the upper right.",
  "color_similarity": "high",
  "texture_similarity": "high",
  "contrast_difference": "low",
  "camouflage_score": 0.9,
  "confidence": 0.95,
  "camouflage_type": "Mimicry",
  "explanation": "The GhostPipefish exhibits exceptional camouflage, seamlessly blending with its gorgonian coral environment. Its body shape is highly modified with numerous feathery appendages and an irregular, fragmented outline that perfectly mimics the branching structure and the individual polyps of the coral. The fish's coloration, a complex pattern of dark green/black, yellowish-brown, and white patches, precisely matches the mottled hues and variegated textures of the coral branches and their pale polyps. This combination of structural mimicry, disruptive coloration, and pattern matching makes the GhostPipefish nearly indistinguishable from its background, effectively breaking up its silhouette and making it incredibly difficult for predators to spot."
}