{
  "entity_type": "Organism",
  "camouflage_presence": "Camouflage",
  "object_category": "Fish",
  "object_name": "GhostPipefish",
  "background_description": "The background environment is an underwater scene dominated by a large, complex crinoid (feather star). It features numerous branching, feathery arms that are primarily dark blue-grey with segmented, lighter tan or white sections along their central stems. The water in the distant background is a hazy, turquoise-green.",
  "color_similarity": "high",
  "texture_similarity": "high",
  "contrast_difference": "low",
  "camouflage_score": "0.95",
  "confidence": "1.0",
  "camouflage_type": "Mimicry",
  "explanation": "The GhostPipefish demonstrates exceptional camouflage, primarily through mimicry of the crinoid it is resting upon. Its body shape is highly irregular, branched, and adorned with numerous spiny and feathery projections, making it almost indistinguishable from the delicate arms and textures of the feather star. The fish's coloration, a complex pattern of dark reddish-browns, whites, and subtle orange accents, blends remarkably well with the dark blue-grey and striped segments of the crinoid. The intricate textures of the pipefish perfectly match the feathery appearance of its host, disrupting its outline and making it appear as an integral part of the crinoid rather than a separate organism. The low contrast difference further enhances this illusion, rendering the GhostPipefish nearly invisible in its environment."
}