{
  "entity_type": "Organism",
  "camouflage_presence": "Camouflage",
  "object_category": "Insect",
  "object_name": "StickInsect",
  "background_description": "The background consists primarily of a tree trunk covered in various types of moss and lichen. The bark has a rough, textured appearance with shades of brown, grey, and dark patches. The moss and lichen are predominantly green, light green, and grayish-white, with a somewhat spiky or fuzzy texture. In the blurry background, there are hints of other trees and green foliage.",
  "color_similarity": "high",
  "texture_similarity": "high",
  "contrast_difference": "low",
  "camouflage_score": "0.85",
  "confidence": "1.0",
  "camouflage_type": "Mimicry",
  "explanation": "The StickInsect exhibits excellent camouflage, blending seamlessly with the tree trunk it is resting on. Its body coloration is a mottled green-brown, closely matching the various shades of moss, lichen, and bark found on the tree. The texture of its body, especially the small protuberances and segmented appearance, remarkably mimics the spiky and fuzzy textures of the mosses and lichens, as well as the roughness of the bark. Its elongated, slender shape and posture also contribute significantly to its camouflage, making it appear like a natural part of the tree growth rather than a distinct organism. The overall contrast between the StickInsect and its immediate background is very low, making it difficult to spot at first glance. This is a classic example of mimicry, where the organism's form, color, and texture imitate its surroundings."
}