{
  "entity_type": "Organism",
  "camouflage_presence": "Camouflage",
  "object_category": "Insect",
  "object_name": "Katydid",
  "background_description": "The background consists of a soft, out-of-focus blur of vibrant green and yellow-green, characteristic of lush foliage. In the foreground, the organism is positioned on a healthy, bright green leaf, with another similar leaf partially visible to its right. A subtle brown stem can be seen peeking from behind the leaves.",
  "color_similarity": "high",
  "texture_similarity": "high",
  "contrast_difference": "low",
  "camouflage_score": 0.95,
  "confidence": 1.0,
  "camouflage_type": "Mimicry",
  "explanation": "The Katydid in this image exhibits exceptional camouflage through mimicry. Its body, particularly its wings, is shaped, colored, and textured to precisely resemble a decaying or damaged leaf. The left wing is predominantly green, matching the color of the healthy leaf it rests upon, but it also features mottled brown and black spots that convincingly mimic areas of disease, blight, or damage often found on leaves. The irregular outline of the wings further enhances this illusion, breaking up the typical insect silhouette. The visible parts of its body (head, thorax, abdomen) are a mottled brown and reddish-brown, which can blend with dead plant material or stems in the environment. This combination of color blending, pattern matching (to leaf damage), texture mimicry (leaf veins/surface), and shape disruption (leaf-like form) makes the Katydid incredibly difficult to distinguish from its natural surroundings, offering a highly effective defense against predators."
}