{
  "entity_type": "Organism",
  "camouflage_presence": "Camouflage",
  "object_category": "Fish",
  "object_name": "GhostPipefish",
  "background_description": "The background depicts a cluttered underwater environment, likely a reef or sea bottom, dominated by a mix of dark green, brown, and reddish marine flora, detritus, and possibly some small coral or sponge structures. It features irregular shapes, fuzzy textures, and shadowy areas, creating a complex and diverse visual landscape.",
  "color_similarity": "high",
  "texture_similarity": "high",
  "contrast_difference": "low",
  "camouflage_score": 0.95,
  "confidence": 1.0,
  "camouflage_type": "Color blending / Pattern matching / Shape disruption / Mimicry",
  "explanation": "The GhostPipefish exhibits exceptional camouflage in this image. Its body is covered in frilly, leaf-like appendages and fine red filaments that perfectly mimic the surrounding marine algae and detritus. The color palette of greens, whites, and reds on the fish precisely matches the greens, browns, and reddish hues present in the background. Furthermore, its highly irregular shape effectively disrupts its outline, making it blend seamlessly with the textured, disorganized nature of its environment. The combination of color blending, detailed pattern matching (mimicking plant matter), and shape disruption makes it extremely difficult to distinguish the organism from the background, serving as a textbook example of mimicry and crypsis."
}