{
  "entity_type": "Organism",
  "camouflage_presence": "Camouflage",
  "object_category": "Mammal",
  "object_name": "Sheep",
  "background_description": "The background consists of a dense, bushy environment with numerous tree branches and green foliage. There are darker, out-of-focus branches and leaves in the immediate foreground, creating a visual barrier. Further back, patches of dry, light-brown grass are visible on the ground, interspersed with more green vegetation. The lighting is dappled, casting significant shadows across the scene.",
  "color_similarity": "medium",
  "texture_similarity": "low",
  "contrast_difference": "medium",
  "camouflage_score": 0.75,
  "confidence": 0.9,
  "camouflage_type": "Shape disruption",
  "explanation": "The 'Sheep' in this image is effectively camouflaged due to several factors. Its reddish-brown coat, particularly when in shadow, blends reasonably well with the dark browns of the tree trunks and shadowed parts of the environment, contributing to medium color similarity. The most prominent camouflage mechanism is shape disruption: the dense network of branches and leaves in the foreground and midground heavily obscures the animal's outline, making it difficult to discern its full form. Additionally, the animal is positioned largely within a shaded area, allowing it to recede into the shadows (shadow hiding). While its texture doesn't match the rough bark or varied leaves (low texture similarity), and parts like its horns might have medium contrast, the overall effect of being hidden amongst the foliage significantly reduces its visibility, making it not immediately apparent."
}