{
  "entity_type": "Organism",
  "camouflage_presence": "Camouflage",
  "object_category": "Fish",
  "object_name": "Pipefish",
  "background_description": "The background consists of an underwater environment with a sandy seabed. The sand is fine-grained, light brownish-gray, with scattered darker flecks and small pieces of organic debris. A prominent elongated object, likely a branch or log, lies on the sand, heavily covered with greenish-brown and reddish algae or marine growth, and some small orange sponge-like growths. The water above is murky blue-green.",
  "color_similarity": "high",
  "texture_similarity": "high",
  "contrast_difference": "low",
  "camouflage_score": "0.85",
  "confidence": "0.95",
  "camouflage_type": "Mimicry",
  "explanation": "The Pipefish exhibits excellent camouflage. Its elongated, slender body is mottled with shades of light brown and tan, which closely matches the color of the sandy seabed and the algae-covered debris. The subtle patterns on its skin help to break up its outline, making it difficult to distinguish from the textured background. The pipefish's overall shape and coloration allow it to mimic a piece of organic debris or a stick on the seabed, further enhancing its concealment. This combination of color blending, pattern matching, and shape mimicry results in low contrast and high similarity with its environment, making it very effective at avoiding detection."
}