{
  "entity_type": "Organism",
  "camouflage_presence": "Camouflage",
  "object_category": "Bird",
  "object_name": "House sparrow",
  "background_description": "The background consists of a highly blurred, out-of-focus scene dominated by warm, light brown and tan hues, suggesting dry vegetation, soil, or distant structures. There are also faint hints of soft green tones towards the upper right, possibly indicating sparse foliage. The overall impression is an arid or semi-arid outdoor environment under sunlight. A dark grey wire fence runs across the mid-ground, on which the bird is perched.",
  "color_similarity": "high",
  "texture_similarity": "low",
  "contrast_difference": "medium",
  "camouflage_score": 0.6,
  "confidence": 0.95,
  "camouflage_type": "Color blending",
  "explanation": "The image features a House sparrow (Organism) perched on a wire fence. The bird's plumage, predominantly brown and grey, is naturally adapted for camouflage through color blending. The background is a highly blurred mix of warm light browns, tans, and faint greens, consistent with dry grass, soil, or distant vegetation in its natural habitat. The sparrow's colors closely match the dominant earthy tones of the background, making it less conspicuous to predators. Although the bird is clearly visible due to being in sharp focus against a blurred background and the presence of the fence, its natural coloration provides a high degree of color similarity to its typical environment, reducing its contrast and aiding in concealment. The texture similarity is low due to the blurred background and distinct feather texture, but the overall color scheme provides effective blending."
}