{
  "entity_type": "Organism",
  "camouflage_presence": "Camouflage",
  "object_category": "Fish",
  "object_name": "Pipefish",
  "background_description": "The background consists of a dense, intricate network of reddish-pinkish-orange gorgonian coral (sea fan) branches. The branches are narrow, cylindrical, and highly convoluted, forming a web-like pattern against a dark, almost black, background, suggesting deep water or low light conditions. The coral exhibits a porous and somewhat textured surface with minor variations in shade.",
  "color_similarity": "high",
  "texture_similarity": "medium",
  "contrast_difference": "low",
  "camouflage_score": 0.85,
  "confidence": 0.95,
  "camouflage_type": "Mimicry",
  "explanation": "The Pipefish exhibits excellent camouflage against the gorgonian coral background. Its long, slender body perfectly mimics the shape and vertical orientation of the individual coral branches, achieving strong structural mimicry. The fish's coloration, with alternating reddish-brown and yellowish stripes, closely matches the reddish-orange hue of the coral and also creates a pattern that blends with the intricate network of branches. This combination of shape mimicry and pattern matching effectively breaks up the organism's outline and allows it to seamlessly integrate into its environment, making it very difficult to distinguish from the coral itself."
}