{
  "entity_type": "Organism",
  "camouflage_presence": "Camouflage",
  "object_category": "Insect",
  "object_name": "Caterpillar",
  "background_description": "The background consists of a thick, gnarled tree branch heavily covered in vibrant green, velvety moss, along with patches of lighter gray and white lichen and exposed bark. Behind the branch, the environment is a dark, out-of-focus expanse of deep green and black, suggesting dense forest foliage and shadows.",
  "color_similarity": "high",
  "texture_similarity": "high",
  "contrast_difference": "low",
  "camouflage_score": "0.95",
  "confidence": "1.0",
  "camouflage_type": "Mimicry",
  "explanation": "The caterpillar exhibits exceptional camouflage, specifically through mimicry, making it incredibly difficult to distinguish from its environment. Its body is shaped and textured to perfectly resemble a broken, lichen-covered twig or a mossy protrusion on the main tree branch. The mottled grey, white, and green coloration of the caterpillar precisely matches the bark, lichen, and moss found on the branch, resulting in very high color similarity. Furthermore, its rough, irregular body surface and segmented form mimic the natural textures of the woody branch and the fuzzy moss, effectively disrupting its outline. The overall low contrast difference between the organism and its surroundings ensures that it blends seamlessly, providing an almost perfect example of camouflage."
}