{
  "entity_type": "Organism",
  "camouflage_presence": "Camouflage",
  "object_category": "Fish",
  "object_name": "GhostPipefish",
  "background_description": "The background consists of a complex underwater reef environment, primarily composed of various sessile invertebrates such as branching hydroids, encrusting sponges, and possibly soft corals. The dominant colors are shades of reddish-brown, orange, and dark brown/black, with areas of lighter brown and white. Delicate, translucent, and feathery structures (likely hydroids or bryozoans) are prominent, particularly on the left side and below the organism, creating a highly textured and intricate environment.",
  "color_similarity": "high",
  "texture_similarity": "high",
  "contrast_difference": "low",
  "camouflage_score": 0.9,
  "confidence": 1.0,
  "camouflage_type": "Mimicry",
  "explanation": "The GhostPipefish exhibits exceptional camouflage through a combination of mimicry, color blending, and texture matching. Its elongated, slender body is adorned with numerous feathery and spiky appendages that perfectly replicate the intricate forms and textures of the surrounding branching hydroids and other sessile reef inhabitants. The organism's coloration, a mottled pattern of reddish-browns, whites, and dark accents, blends seamlessly with the dominant colors of the background, making it extremely difficult to distinguish from the environment. The overall effect is that the pipefish appears to be an integral part of the reef structure rather than a separate living creature, effectively breaking up its outline and reducing any discernable contrast."
}