{
  "entity_type": "Organism",
  "camouflage_presence": "Camouflage",
  "object_category": "Fish",
  "object_name": "Pipefish",
  "background_description": "The background consists of a shallow underwater seabed, primarily covered with light brown to yellowish-tan sand, mixed with various sizes of small pebbles, shell fragments, and detritus. There are also strands of what appear to be submerged plant matter or algae, particularly on the right side of the image. The environment is illuminated by filtered sunlight, creating subtle shadows and variations in color and texture across the sandy bottom.",
  "color_similarity": "high",
  "texture_similarity": "high",
  "contrast_difference": "low",
  "camouflage_score": 0.85,
  "confidence": 0.95,
  "camouflage_type": "Mimicry",
  "explanation": "The Pipefish is exceptionally well camouflaged in this image. Its elongated, slender body perfectly mimics the shape of the surrounding detritus, plant matter, or small twigs found on the sandy seabed. The organism's pale reddish-brown to yellowish-tan coloration blends almost seamlessly with the color of the sand, pebbles, and submerged organic debris, resulting in high color similarity. The texture of its smooth, streamlined body does not significantly contrast with the granular and irregular textures of the seabed. This combination of color matching and form mimicry makes it very difficult to distinguish the Pipefish from its immediate environment, effectively hiding it from potential predators or prey."
}