{
  "entity_type": "Organism",
  "camouflage_presence": "Camouflage",
  "object_category": "Insect",
  "object_name": "Worm",
  "background_description": "The background consists primarily of a vibrant green leaf, which the organism is resting on. The leaf has visible veins and a slightly textured surface with small bumps and subtle variations in color, including lighter yellowish-green areas and darker green shadows. Parts of the background also include darker, out-of-focus areas suggesting other foliage or shadows behind the main leaf.",
  "color_similarity": "high",
  "texture_similarity": "medium",
  "contrast_difference": "low",
  "camouflage_score": 0.9,
  "confidence": 1.0,
  "camouflage_type": "Color blending",
  "explanation": "The organism, identified as a 'Worm' (which appears to be a caterpillar), exhibits strong camouflage by almost perfectly matching the color of the leaf it is on. Its body is a vibrant green, nearly identical in hue and intensity to the surrounding foliage. The subtle segmentation of its body and the presence of small lighter speckles and a faint yellowish stripe near its head further mimic the natural textures and variations found on the leaf, such as veins and lighter growth patterns. This exceptional color blending results in low contrast between the organism and its environment, making it very difficult to visually distinguish and thus providing effective concealment from predators."
}