{
  "entity_type": "Organism",
  "camouflage_presence": "Camouflage",
  "object_category": "Insect",
  "object_name": "Caterpillar",
  "background_description": "The background consists of the deeply textured, rough bark of a tree trunk. The bark is primarily composed of various shades of grey and muted brown, with dark crevices and lighter, raised sections. There are also small patches of darker, almost black, coloration scattered across the surface, possibly from lichen or shadows.",
  "color_similarity": "high",
  "texture_similarity": "high",
  "contrast_difference": "low",
  "camouflage_score": 0.95,
  "confidence": 1.0,
  "camouflage_type": "Color blending / Pattern matching / Shape disruption",
  "explanation": "The Caterpillar is exceptionally camouflaged against the tree bark. Its body coloration perfectly matches the grey and brown hues of the bark, exhibiting high color similarity. Furthermore, the caterpillar's body texture and irregular surface mimic the rough, fissured quality of the bark, showing high texture similarity. The patterns and streaks on its body align seamlessly with the natural variations and crevices in the bark, creating very low contrast difference. Its elongated, somewhat gnarled shape also contributes to shape disruption, making it appear like an integral part of the bark structure or a broken twig, rather than a living organism. It is extremely difficult to spot without careful scrutiny, making it a prime example of effective camouflage through a combination of color, texture, and pattern matching."
}