{
  "entity_type": "Organism",
  "camouflage_presence": "Camouflage",
  "object_category": "Insect",
  "object_name": "Katydid",
  "background_description": "The background consists of dense, slightly out-of-focus foliage, primarily composed of thin green stems and elongated green leaves. Some of the stems exhibit a reddish-brown hue. The overall environment suggests a thicket or bushy area with various plant structures.",
  "color_similarity": "high",
  "texture_similarity": "medium",
  "contrast_difference": "low",
  "camouflage_score": 0.8,
  "confidence": 0.9,
  "camouflage_type": "Color blending",
  "explanation": "The Katydid in this image exhibits effective camouflage through color blending and shape disruption. Its body is predominantly a mottled green, closely matching the green leaves and stems of the surrounding vegetation. The elongated, somewhat rigid shape of its body and its thin legs allow it to integrate with the linear forms of the plant stems and leaf midribs. While the grid-like patterns on its back are distinct upon close inspection, they help to break up its overall outline rather than making it stand out, contributing to a low contrast with the environment. The combination of matching coloration and a form that mimics plant structures makes it difficult to distinguish the insect from the dense foliage, especially from a distance."
}