{
  "entity_type": "Organism",
  "camouflage_presence": "Camouflage",
  "object_category": "Fish",
  "object_name": "GhostPipefish",
  "background_description": "The background consists of a dark, fine-grained substrate, likely sand or volcanic sediment, sparsely covered with various forms of marine vegetation and detritus. There are leafy green marine plants and stringy, brown, feathery algae or hydroids visible, creating a textured and somewhat cluttered underwater environment.",
  "color_similarity": "high",
  "texture_similarity": "high",
  "contrast_difference": "low",
  "camouflage_score": 0.9,
  "confidence": 1.0,
  "camouflage_type": "Mimicry",
  "explanation": "The GhostPipefish exhibits exceptional camouflage through a combination of mimicry, shape disruption, and color blending. Two individuals are visible: one bright green and one mottled brown. The green GhostPipefish's flattened, broad body and irregular frond-like protrusions perfectly match the shape, texture, and vibrant green color of the leafy marine plant it is positioned near. Its form makes it nearly indistinguishable from a plant frond. The brown GhostPipefish, situated amidst more stringy, detritus-laden algae, displays a highly textured, feathery body with numerous appendages that mimic the surrounding brown, tangled marine debris. Both individuals seamlessly integrate into their immediate environment, significantly reducing their visual contrast and disrupting their outlines by imitating the surrounding flora and detritus. Their body shapes are highly adapted to blend with the specific textures and forms found in their habitat, making them very difficult to spot."
}