{
  "entity_type": "Organism",
  "camouflage_presence": "Camouflage",
  "object_category": "Fish",
  "object_name": "GhostPipefish",
  "background_description": "The background consists of a vibrant coral reef environment. On the left and upper-left, there is a large formation of white, branching stony coral with distinct, rounded tips. Towards the bottom-right, the organism is positioned near or partially on a dense, dark, feathery or bushy invertebrate, possibly a crinoid or black coral, which features dark strands punctuated with small, orange-brown dots or tips. The water in the mid-ground appears a blurred blue-green.",
  "color_similarity": "high",
  "texture_similarity": "high",
  "contrast_difference": "medium",
  "camouflage_score": 0.9,
  "confidence": 1.0,
  "camouflage_type": "Shape disruption / Mimicry / Pattern matching / Color blending",
  "explanation": "The GhostPipefish exhibits exceptional camouflage through multiple strategies. Its elongated body is covered in numerous frilly, leaf-like appendages and sharp spines, which perfectly disrupt its outline and make it difficult to distinguish from the surrounding coral and invertebrate structures. The organism's coloration, a complex mosaic of yellow-green, reddish-brown, and white patterns, closely matches the hues found in the reef environment, including the vibrant corals and the darker, feathery invertebrate it is near. The yellow-green tones blend with possible algal growth or specific coral colors, while the reddish-browns and whites echo the textures and colors of the adjacent reef structures. This combination of shape disruption, pattern matching, and color blending allows the GhostPipefish to effectively mimic a piece of debris, seaweed, or a part of the coral itself, making it almost invisible to predators and prey in its natural habitat. While not perfectly invisible upon close inspection, its overall integration with the complex visual clutter of the reef is highly effective."
}