{
  "entity_type": "Organism",
  "camouflage_presence": "Camouflage",
  "object_category": "Fish",
  "object_name": "Pipefish",
  "background_description": "The background is an underwater environment densely packed with marine vegetation, including various types of seaweed and algae. Dominant features are broad, crinkled yellow-green to brownish leaves of seaweed, interwoven with numerous delicate, stringy, and fluffy white-ish filaments suspended in the water and clinging to the plants. The water itself has a greenish-yellow tint and appears somewhat murky or cloudy, contributing to a visually cluttered and diffuse environment.",
  "color_similarity": "high",
  "texture_similarity": "medium",
  "contrast_difference": "low",
  "camouflage_score": 0.9,
  "confidence": 0.95,
  "camouflage_type": "Color blending / Mimicry / Shape disruption",
  "explanation": "The Pipefish exhibits excellent camouflage, blending almost seamlessly with its complex underwater habitat. Its slender, elongated body, colored in muted greenish-yellow and brownish tones, perfectly matches the dominant hues of the surrounding seaweed and the overall greenish tint of the water. The fish's thin, stick-like shape remarkably mimics the numerous strands of algae and other marine detritus, making it appear like just another piece of the environment rather than an organism. The low contrast between the Pipefish and its surroundings, combined with the visual clutter created by the fluffy white filaments and varied plant textures, makes it extremely difficult to distinguish, effectively concealing it from both predators and prey. This combination of color matching, shape mimicry, and low contrast is highly effective."
}