{
  "entity_type": "Organism",
  "camouflage_presence": "Camouflage",
  "object_category": "Mammal",
  "object_name": "Black Panther",
  "background_description": "The background is highly blurred, featuring warm tones of brown, orange, and yellow, indicative of natural outdoor environment like dry foliage, earth, or tree bark illuminated by bright sunlight. It lacks distinct textures or shapes due to the shallow depth of field.",
  "color_similarity": "low",
  "texture_similarity": "low",
  "contrast_difference": "high",
  "camouflage_score": 0.4,
  "confidence": 1.0,
  "camouflage_type": "Color blending",
  "explanation": "The image features a black panther, whose melanistic coat serves as a form of natural camouflage, primarily through 'Color blending'. Its dark fur helps it blend into shadowy environments, dense foliage, or during low-light conditions (dawn, dusk, or night), making it an effective ambush predator. However, in this particular image, the bright lighting and the warm, luminous, out-of-focus background create a strong contrast with the panther's dark fur. While the animal inherently possesses camouflage traits, in this specific bright scene, its dark coat stands out significantly against the lighter, warmer background, making the camouflage less effective. The high contrast and low color/texture similarity with the immediate background reduce its current concealment, even though its dark coloration is an adaptive camouflaging trait."
}