{
  "entity_type": "Environment",
  "camouflage_presence": "No Camouflage",
  "object_category": "Environment",
  "object_name": "Underwater coral reef",
  "background_description": "The image captures a vibrant underwater coral reef ecosystem. The foreground and midground are densely covered with a variety of corals, including large plate-like corals (likely Montipora or similar), branching corals, and brain corals, displaying shades of purplish-gray, brown, and some lighter creams. The textures are intricate and varied, forming a complex reef structure. Above the reef, the water column extends upwards towards the surface, where shafts of sunlight pierce through, creating dramatic light rays. The deeper water areas appear dark blue to black.",
  "color_similarity": "none",
  "texture_similarity": "none",
  "contrast_difference": "low",
  "camouflage_score": 0.0,
  "confidence": 1.0,
  "camouflage_type": "None",
  "explanation": "The image primarily showcases an extensive underwater coral reef, which constitutes an environment rather than an individual organism exhibiting camouflage. No distinct animal, insect, or fish is clearly visible as a primary subject. While corals are living organisms, in this context, they form the landscape itself. Therefore, no camouflage is detected. The camouflage-related metrics (color_similarity, texture_similarity, camouflage_score, camouflage_type) are set to 'none' or 0.0 accordingly. The 'contrast_difference' is set to 'low' as there is no specific camouflaged organism whose contrast against the background can be assessed."
}