{
  "entity_type": "Organism",
  "camouflage_presence": "Camouflage",
  "object_category": "Fish",
  "object_name": "GhostPipefish",
  "background_description": "The background consists of a sandy-gravelly seabed with various sizes of dark brown, black, and light-colored sediment particles. Numerous thin, upright, brownish, and slightly frilly plant stalks or detritus are scattered across the substrate, along with some patches of darker green algae or plant matter in the mid-background.",
  "color_similarity": "high",
  "texture_similarity": "high",
  "contrast_difference": "low",
  "camouflage_score": 0.9,
  "confidence": 1.0,
  "camouflage_type": "Color blending / Pattern matching / Shape disruption / Mimicry",
  "explanation": "The GhostPipefish exhibits exceptional camouflage in this image. Its body color, a translucent brownish-tan with subtle flecks, perfectly matches the sandy-gravelly substrate and the numerous pieces of plant detritus and upright stalks in its environment. The most striking aspect of its camouflage is its highly irregular body shape, including frilly fins and appendages, which mimic the texture and form of the surrounding detritus and plant matter, making it appear like a piece of debris rather than a living organism. This combination of color matching, textured body surface, and disruptive morphology effectively breaks up its outline and blends it seamlessly with the cluttered background, making it very difficult to discern from its surroundings."
}