{
  "entity_type": "Organism",
  "camouflage_presence": "Camouflage",
  "object_category": "Fish",
  "object_name": "Eel",
  "background_description": "The image depicts a vibrant and complex underwater coral reef environment. The background is a solid deep blue, simulating water. The foreground is dominated by various types of corals, including branching corals (acropora-like), brain corals, and textured encrusting corals, exhibiting a range of colors from earthy browns, light beiges, and greens to pinks and oranges. There are also plant-like structures with fine, bushy textures. The overall environment is rich in diverse forms and textures.",
  "color_similarity": "high",
  "texture_similarity": "medium",
  "contrast_difference": "low",
  "camouflage_score": 0.85,
  "confidence": 0.95,
  "camouflage_type": "Color blending",
  "explanation": "An eel-like organism is visible towards the upper middle part of the image, winding through the corals and green bushy structures. Its elongated, slender body is a yellowish-brown color, which provides high color similarity with the surrounding light-colored corals and some of the earthy-toned plant matter. The eel's form allows it to blend seamlessly with the irregular shapes and textures of the coral branches and growths. The low contrast between the organism and its immediate background makes it difficult to discern at first glance, indicating effective camouflage primarily through color blending and positional concealment within the complex reef structure. While other fish are present, their patterns and colors make them more distinct than this eel-like creature."
}