{
  "entity_type": "Organism",
  "camouflage_presence": "Camouflage",
  "object_category": "Insect",
  "object_name": "Bug",
  "background_description": "The background consists of vibrant green, slender plant stems and needle-like leaves, typical of an herbaceous plant such as dill or fennel. Some parts of the background are out of focus, creating a soft green blur, while the foreground elements are sharp, highlighting the plant's structure.",
  "color_similarity": "high",
  "texture_similarity": "high",
  "contrast_difference": "low",
  "camouflage_score": 0.9,
  "confidence": 1.0,
  "camouflage_type": "Color blending",
  "explanation": "The Bug exhibits excellent camouflage in this image. Its entire body, including its wings and carapace, is a vibrant green color that perfectly matches the lush green hue of the plant stems and leaves it is resting upon. The texture of the bug's body, particularly the somewhat waxy and smooth appearance, closely resembles the smooth, slightly glossy surface of the plant stems. Furthermore, the overall low contrast between the bug and its immediate environment makes it very difficult to discern at first glance. The bug's shape, especially the one curled up on the left, also somewhat mimics a plant bud or swelling, aiding in its concealment through shape disruption. All these factors contribute to a highly effective color blending camouflage."
}