{
  "entity_type": "Organism",
  "camouflage_presence": "Camouflage",
  "object_category": "Fish",
  "object_name": "Pipefish",
  "background_description": "The background consists of an underwater seabed covered with a mix of coarse dark grey and black sand, interspersed with numerous small to medium-sized rocks and pebbles of various earthy tones including dark grey, brown, and some lighter beige/white. There are also scattered fragments of shells (white, orange, brown), some reddish-orange sessile organisms (likely sponges or corals), and general detritus contributing to a varied, cluttered environment.",
  "color_similarity": "high",
  "texture_similarity": "medium",
  "contrast_difference": "low",
  "camouflage_score": "0.88",
  "confidence": "0.95",
  "camouflage_type": "Mimicry",
  "explanation": "The Pipefish exhibits excellent camouflage through a combination of mimicry and color blending. Its long, slender, dark brown/black body closely resembles a piece of submerged detritus, a twig, or a decaying plant stem, which are abundant in its environment. The coloration of the fish provides a high degree of color similarity with the dark sand, rocks, and other dark debris on the seabed, resulting in low contrast difference. While its surface texture is relatively smooth compared to the granular sand or rough rocks, its overall form and color allow it to blend seamlessly with the inanimate elements of the ocean floor, making it very difficult for predators to distinguish it from the background."
}