{
  "entity_type": "Organism",
  "camouflage_presence": "Camouflage",
  "object_category": "Fish",
  "object_name": "Pipefish",
  "background_description": "The background is an intricate underwater environment featuring a large, vibrant gorgonian coral that dominates the right side of the frame. This coral exhibits a dense, reticulated, fan-like structure with numerous fine, branching arms in shades of orange and reddish-brown, set against a deep blue ocean backdrop. On the left side, there are darker, irregular rock or sponge formations with patches of other marine growth, including smaller corals and sponges, displaying dark green, brown, and some pinkish hues.",
  "color_similarity": "high",
  "texture_similarity": "high",
  "contrast_difference": "low",
  "camouflage_score": 0.9,
  "confidence": 1.0,
  "camouflage_type": "Mimicry",
  "explanation": "The Pipefish exhibits highly effective camouflage through structural mimicry of the gorgonian coral branches. Its body is exceptionally slender, elongated, and often segmented, perfectly resembling the fine, branching arms of the coral in shape and texture. This allows the pipefish to blend seamlessly into the complex network of the gorgonian, making it extremely difficult to distinguish from its environment. The coloration of the pipefish, appearing in shades of reddish-brown or pale yellowish, closely matches the dominant orange and reddish hues of the coral. The low contrast between the pipefish and its surroundings further aids in disrupting its outline, causing it to disappear into the background and evade predation."
}