{
  "entity_type": "Organism",
  "camouflage_presence": "Camouflage",
  "object_category": "Bird",
  "object_name": "Bird",
  "background_description": "The background consists primarily of lush green grass of varying heights, interspersed with patches of bare earth, fallen leaves, and small green plants. There are also some darker, drier grass stems and a blurry brown branch or log in the distant background. The ground has an uneven texture with light and shadow.",
  "color_similarity": "high",
  "texture_similarity": "high",
  "contrast_difference": "low",
  "camouflage_score": "0.85",
  "confidence": "0.95",
  "camouflage_type": "Pattern matching",
  "explanation": "The bird's plumage exhibits excellent camouflage, blending seamlessly with its natural ground environment. Its feathers are a complex mix of browns, grays, blacks, and off-whites, creating a mottled, speckled pattern that closely resembles the uneven textures and colors of the forest floor, including soil, dead leaves, twigs, and shadows. This 'pattern matching' and 'disruptive coloration' effectively breaks up the bird's outline, making it difficult to distinguish from the background clutter. The color palette of the bird highly matches the earthy tones present in the background, especially the dirt patches and dried vegetation, resulting in low contrast difference against these elements. While the bright green grass is a different color, the bird's disruptive pattern helps to integrate it into the overall visual noise of the environment, making it hard to spot at first glance."
}