{
  "entity_type": "Organism",
  "camouflage_presence": "Camouflage",
  "object_category": "Insect",
  "object_name": "Grasshopper",
  "background_description": "The background features a large, slightly fuzzy green leaf in the foreground, on which the grasshopper is perched. The mid-ground and background are out of focus, showing blurry patches of vibrant green foliage, a distinct yellow blur on the left (likely a flower petal), and softer, lighter brown/beige tones in other areas, suggesting diverse vegetation.",
  "color_similarity": "high",
  "texture_similarity": "medium",
  "contrast_difference": "low",
  "camouflage_score": 0.8,
  "confidence": 0.9,
  "camouflage_type": "Color blending",
  "explanation": "The grasshopper demonstrates effective camouflage primarily through color blending. Its entire body is a vibrant green, which perfectly matches the color of the large green leaf it is resting on and the general green foliage in the background. This allows it to blend seamlessly with its immediate plant environment. While the background also contains contrasting elements like a bright yellow blur and lighter beige tones, the grasshopper's dominant green coloration significantly reduces its visibility within the green parts of the habitat. The texture similarity is medium, as the grasshopper's body is somewhat smoother than the finely textured leaf, but not significantly contrasting. The overall color contrast with its green surroundings is low, making it difficult to distinguish if not for the sharp focus of the photograph."
}