{
  "entity_type": "Organism",
  "camouflage_presence": "Camouflage",
  "object_category": "Fish",
  "object_name": "GhostPipefish",
  "background_description": "The background consists of blurred aquatic elements, primarily showing indistinct green shapes, likely marine vegetation or seaweed, in the upper and mid-sections, and a hazy, light bluish-green water column. The overall environment suggests an underwater setting with natural plant life.",
  "color_similarity": "high",
  "texture_similarity": "high",
  "contrast_difference": "low",
  "camouflage_score": 0.9,
  "confidence": 1.0,
  "camouflage_type": "Mimicry",
  "explanation": "The GhostPipefish in this image exhibits excellent camouflage through mimicry. Its elongated, slender body is primarily green, perfectly matching the dominant color of the blurred marine vegetation in the background. Furthermore, its body is adorned with irregular, frilly, and spiky protrusions, along with dark speckles, which mimic the texture and appearance of decaying plant matter or a fragment of seaweed. This combination of color blending, pattern matching, and highly effective shape disruption makes the organism virtually indistinguishable from its environment, allowing it to blend seamlessly into the underwater foliage."
}