{
  "entity_type": "Organism",
  "camouflage_presence": "Camouflage",
  "object_category": "Fish",
  "object_name": "Stonefish",
  "background_description": "The background is an underwater coral reef environment consisting of various types of corals (branching, encrusting, massive forms in shades of brown, yellow, and subtle blue/green), sand, and rock formations. The textures are highly diverse, ranging from smooth sandy patches to rough, porous coral structures and lumpy rock surfaces.",
  "color_similarity": "high",
  "texture_similarity": "high",
  "contrast_difference": "low",
  "camouflage_score": 0.95,
  "confidence": 0.98,
  "camouflage_type": "Mimicry",
  "explanation": "A stonefish is present in the upper left portion of the image, blending exceptionally well with the surrounding reef. Its mottled grey, brown, and slightly greenish coloration perfectly matches the hues of the rocky substrate and encrusting corals. More importantly, its irregular, warty, and lumpy body shape and texture are almost identical to the rough, uneven surfaces of the corals and rocks, making it extremely difficult to distinguish from the environment. This high degree of color and texture mimicry, combined with its overall form, allows it to appear as an inert part of the reef, providing excellent camouflage for ambush predation."
}