{
  "entity_type": "Organism",
  "camouflage_presence": "Camouflage",
  "object_category": "Mammal",
  "object_name": "Giraffe",
  "background_description": "The background is heavily blurred and out of focus, featuring bright, overexposed areas that suggest sky or strong light, interspersed with dark, abstract, blob-like shapes possibly representing distant trees or foliage. The textures are indistinct due to the bokeh effect, appearing soft and hazy.",
  "color_similarity": "medium",
  "texture_similarity": "low",
  "contrast_difference": "medium",
  "camouflage_score": 0.6,
  "confidence": 0.95,
  "camouflage_type": "Disruptive pattern",
  "explanation": "The image clearly shows a giraffe, an organism known for its distinctive spotted coat which functions as a disruptive pattern camouflage. In its natural savanna habitat, these patterns help break up the giraffe's large outline, allowing it to blend with the dappled light and shadows created by trees and foliage. The dark patches resemble shadows, while the lighter areas mimic sunlit gaps. In this black and white, close-up photograph, the giraffe's pattern is evident. Although the camouflage pattern is present, its effectiveness in concealing the animal in this specific image is limited. The tight framing, sharp focus on the animal, and the abstract, heavily blurred background make the giraffe highly visible. However, the inherent camouflage mechanism (disruptive patterning) is clearly identifiable on its fur, contributing to a medium color (tonal) similarity with the varied background tones, even if it doesn't make the animal disappear."
}