{
  "entity_type": "Organism",
  "camouflage_presence": "Camouflage",
  "object_category": "Fish",
  "object_name": "ScorpionFish",
  "background_description": "The background consists of a textured underwater environment, likely a rocky or coral reef, covered with various shades of algae and sediment. Dominant colors include mottled browns, greens (from algae), reddish-browns, and patches of lighter beige/sandy tones, creating a complex and irregular surface.",
  "color_similarity": "high",
  "texture_similarity": "high",
  "contrast_difference": "low",
  "camouflage_score": 0.9,
  "confidence": 0.95,
  "camouflage_type": "Pattern matching",
  "explanation": "The ScorpionFish exhibits excellent camouflage in this image. Its body coloration, which includes mottled patterns of reddish-orange, brown, beige, and dark speckles, highly matches the diverse color palette of the background's algae-covered rocks and sediment. Furthermore, the fish's highly textured skin, adorned with numerous dermal flaps and irregular outgrowths, perfectly mimics the rough, uneven, and organic textures of its surroundings. This combination of color blending and texture matching effectively disrupts its outline and prevents it from standing out against the complex background, making it very difficult to discern where the fish ends and the environment begins. The low contrast difference further enhances this blending effect."
}