{
  "entity_type": "Organism",
  "camouflage_presence": "Camouflage",
  "object_category": "Fish",
  "object_name": "Pipefish",
  "background_description": "The background consists of a complex underwater reef environment. There are numerous branching stony corals of yellowish-beige color, along with darker, more textured rocky or encrusting coral formations that appear bluish-grey and purplish in the dim lighting. The environment has a varied texture, ranging from the smooth surfaces of rock to the porous, intricate structures of coral branches. There are shadows and variations in light intensity creating depth.",
  "color_similarity": "high",
  "texture_similarity": "medium",
  "contrast_difference": "low",
  "camouflage_score": "0.9",
  "confidence": "1.0",
  "camouflage_type": "Mimicry",
  "explanation": "The Pipefish in this image exhibits exceptional camouflage. Its elongated, slender body perfectly mimics the shape and orientation of the surrounding branching coral structures. Its brownish-grey coloration closely matches the muted tones of the coral and the darker, shadowed areas of the rocky substrate. This combination of shape mimicry and color blending makes the organism incredibly difficult to distinguish from its environment. The low contrast between the Pipefish and the immediate background further enhances its concealment, allowing it to seamlessly blend among the coral branches as if it were just another part of the reef."
}