{
  "entity_type": "Organism",
  "camouflage_presence": "Camouflage",
  "object_category": "Insect",
  "object_name": "Millipede",
  "background_description": "The background consists of a dull grey, rough, and uneven ground surface, likely compacted dirt or concrete. It exhibits variations in tone, with darker moist patches and lighter, drier areas. Small specks of debris, gravel, and what appear to be tiny plant fragments are scattered across the surface, contributing to a granular and textured appearance.",
  "color_similarity": "high",
  "texture_similarity": "high",
  "contrast_difference": "low",
  "camouflage_score": 0.9,
  "confidence": 0.95,
  "camouflage_type": "Color blending",
  "explanation": "The image clearly shows a segmented organism, likely a millipede, camouflaged on a rough grey ground. Its body coloration is almost identical to the surrounding dirt and concrete, providing high color similarity. The texture of the millipede's segmented body also closely mimics the granular and uneven surface of the ground, making it very difficult to distinguish from the debris. The overall contrast difference between the organism and its background is very low, as it blends seamlessly into its environment, making it hard to detect. This effective 'color blending' camouflage helps the organism avoid predators."
}