{
  "entity_type": "Organism",
  "camouflage_presence": "Camouflage",
  "object_category": "Fish",
  "object_name": "Pipefish",
  "background_description": "The background consists of a complex underwater environment, likely a coral reef, characterized by various irregular textures and muted colors. Dominant colors include reddish-browns, dull greens, and off-white patches, suggestive of encrusting corals, algae, and detritus. The overall texture is rough, bumpy, and highly variegated, creating a cluttered visual field with no distinct smooth surfaces.",
  "color_similarity": "high",
  "texture_similarity": "high",
  "contrast_difference": "low",
  "camouflage_score": 0.9,
  "confidence": 0.95,
  "camouflage_type": "Color blending / Pattern matching / Shape disruption",
  "explanation": "The Pipefish exhibits excellent camouflage in this image. Its body coloration, a mottled mix of reddish-browns, whites, and light greens, perfectly matches the dominant hues of the surrounding coral reef substrate and encrusting organisms. The fish's irregular, bumpy texture, enhanced by various dermal appendages and growths along its body, mimics the rough, uneven surface of the corals and algae. This combination of color blending and pattern matching makes it incredibly difficult to distinguish the organism from the background. Furthermore, the pipefish's elongated and somewhat fragmented silhouette, especially its head with fine, branch-like projections, serves as a form of shape disruption, breaking up its outline and allowing it to blend seamlessly into the complex textures of the environment. The low contrast between the pipefish and its surroundings further enhances its invisibility."
}