{
  "entity_type": "Organism",
  "camouflage_presence": "Camouflage",
  "object_category": "Arachnid",
  "object_name": "Spider",
  "background_description": "The background is a tree trunk covered in rough, deeply fissured bark. The bark displays a complex texture with vertical ridges and crevices, and a mottled coloration primarily consisting of various shades of grey, brown, and pale greenish-grey, indicative of lichen or moss growth in certain areas.",
  "color_similarity": "high",
  "texture_similarity": "high",
  "contrast_difference": "low",
  "camouflage_score": 0.9,
  "confidence": 1.0,
  "camouflage_type": "Pattern matching",
  "explanation": "The spider exhibits exceptional camouflage against the tree bark. Its body and legs are covered in a dense, spiky, and irregular texture that perfectly mimics the rough, cracked, and lichen-covered surface of the bark. The coloration of the spider, a mottled mix of greys, browns, and pale greenish-grey, seamlessly matches the various tones present in the background. The irregular outline of the spider, due to its spiky protrusions and posture, also disrupts its silhouette, making it difficult to distinguish its form from the surrounding bark. The combination of high color similarity, identical texture, and low contrast makes the spider almost indistinguishable from its environment, providing highly effective camouflage through pattern matching and structural mimicry."
}