{
  "entity_type": "Organism",
  "camouflage_presence": "Camouflage",
  "object_category": "Insect",
  "object_name": "Hoverfly",
  "background_description": "A large, vibrant green leaf serving as the immediate foreground and midground, showing some subtle texture and veins. The upper portion of the image features a dark, out-of-focus background, suggesting deep shadow or distance.",
  "color_similarity": "low",
  "texture_similarity": "low",
  "contrast_difference": "high",
  "camouflage_score": 0.9,
  "confidence": 1.0,
  "camouflage_type": "Mimicry",
  "explanation": "The image features a hoverfly, which is easily identifiable by its prominent yellow and black striped abdomen, black head, and large compound eyes. This insect exhibits Batesian mimicry, a form of camouflage where a harmless species evolves to imitate a dangerous or unpalatable one. The hoverfly's coloration strongly mimics that of stinging wasps or bees. While its bright pattern contrasts sharply with the green leaf and dark background, making it highly visible in terms of traditional crypsis (blending with the environment), its camouflage strategy is to deceive predators by appearing dangerous. The high contrast of its stripes further enhances the warning signal for predators who associate these colors with a threat, making the mimicry highly effective as a defensive mechanism."
}