{
  "entity_type": "Organism",
  "camouflage_presence": "Camouflage",
  "object_category": "Insect",
  "object_name": "Katydid",
  "background_description": "The background consists of several vibrant green leaves, some appearing slightly weathered with small brown spots, edges, or winding trails from insect activity. A brown woody branch is visible in the upper right. The lighting creates a sense of depth within the dense foliage.",
  "color_similarity": "high",
  "texture_similarity": "high",
  "contrast_difference": "low",
  "camouflage_score": 0.95,
  "confidence": 1.0,
  "camouflage_type": "Mimicry",
  "explanation": "The Katydid exhibits outstanding camouflage through a remarkable instance of mimicry, specifically mimesis of a leaf. Its body and folded wings are shaped, colored, and textured to precisely resemble a green leaf, complete with a prominent central vein-like structure and subtle venation patterns. The vibrant green coloration of the Katydid is virtually identical to the surrounding healthy leaves, resulting in extremely high color similarity. Furthermore, its texture and shape perfectly mimic a leaf, leading to high texture similarity and effective shape disruption. The contrast difference between the organism and its background is exceptionally low, making it incredibly challenging to discern the Katydid's form from the actual foliage. Even minor imperfections or brown spots on its body blend seamlessly with similar markings on the background leaves, further enhancing its concealment."
}