{
  "entity_type": "Organism",
  "camouflage_presence": "Camouflage",
  "object_category": "Bird",
  "object_name": "Mallard duck",
  "background_description": "The duck is standing on a surface of partially frozen water, consisting of dark grey-blue ice with some darker reflective wet patches. In the blurred background, there are hints of dark, possibly brown or green, vegetation along the water's edge.",
  "color_similarity": "low",
  "texture_similarity": "low",
  "contrast_difference": "medium",
  "camouflage_score": 0.3,
  "confidence": 0.95,
  "camouflage_type": "Color blending",
  "explanation": "The image features a female Mallard duck. The duck's mottled brown and tan plumage is a natural form of camouflage, primarily utilizing color blending and disruptive patterns to help it hide within vegetation, reeds, and muddy banks in its natural habitat. However, in this specific scene, the duck is situated on a predominantly cool grey-blue ice surface. The warm tones of its feathers contrast with the cool tones of the ice, resulting in low color similarity. The feathery texture also significantly differs from the smooth, reflective texture of the ice. While the duck possesses camouflaging features, they are not effective in making it blend into this particular frozen background, leading to its clear visibility due to a medium contrast difference."
}