{
  "entity_type": "Organism",
  "camouflage_presence": "Camouflage",
  "object_category": "Arachnid",
  "object_name": "Spider",
  "background_description": "The background consists of a cluster of vibrant yellow flowers, likely small blossoms, with various petals and parts of the flower in focus and some slightly blurred. There are hints of out-of-focus green foliage or stems in the deeper background, suggesting an outdoor environment under bright lighting.",
  "color_similarity": "high",
  "texture_similarity": "medium",
  "contrast_difference": "low",
  "camouflage_score": 0.9,
  "confidence": 1.0,
  "camouflage_type": "Color blending",
  "explanation": "The spider exhibits exceptional camouflage through color blending. Its entire body, including its legs and abdomen, is a bright yellow color that almost perfectly matches the yellow petals of the flower it is resting on. This high degree of color similarity results in a very low contrast difference between the spider and its immediate floral background. Although its arachnid shape is discernible, its coloration effectively disrupts its outline and makes it blend seamlessly, making it very difficult to spot without the presence of the bee it has captured. This is a classic example of an ambush predator using its coloration to hide from both prey and potential predators."
}