{
  "entity_type": "Organism",
  "camouflage_presence": "Camouflage",
  "object_category": "Insect",
  "object_name": "StickInsect",
  "background_description": "The background consists primarily of a thick, rough-barked tree branch in the midground and foreground, exhibiting shades of grayish-brown with patches of lighter gray and some darker indentations, suggesting weathered wood. Behind this main branch, there is a soft-focus blur of lush green leaves and darker, indistinct foliage, indicating a dense vegetated environment.",
  "color_similarity": "high",
  "texture_similarity": "medium",
  "contrast_difference": "low",
  "camouflage_score": 0.9,
  "confidence": 1.0,
  "camouflage_type": "Mimicry",
  "explanation": "The StickInsect demonstrates exceptional camouflage through mimicry. Its elongated, slender body and thin legs are perfectly shaped to resemble twigs and small branches. The organism's coloration, a blend of brownish-green, closely matches both the grayish-brown weathered branch it is resting on and the subtle green tones of younger stems and the blurred foliage in the background. Its posture, with legs extended at angles, further enhances the illusion of being part of the plant structure. The low contrast between the insect's body and its arboreal surroundings makes it extremely difficult to distinguish from the environment, showcasing highly effective visual deception."
}