{
  "entity_type": "Organism",
  "camouflage_presence": "Camouflage",
  "object_category": "Fish",
  "object_name": "GhostPipefish",
  "background_description": "The background consists of a dense arrangement of numerous elongated, vertical, feathery or fern-like marine organisms, likely crinoids or hydroids, with dark brown to purplish hues and translucent edges. Some lighter, blurry areas of sediment or other marine growth are visible in the deeper background. The overall environment is an underwater scene with muted lighting.",
  "color_similarity": "high",
  "texture_similarity": "high",
  "contrast_difference": "low",
  "camouflage_score": "0.95",
  "confidence": "1.0",
  "camouflage_type": "Mimicry",
  "explanation": "The GhostPipefish exhibits exceptional camouflage through mimicry. Its body coloration, a mottled mix of dark browns, whites, and lighter yellowish-white accents, perfectly matches the hues of the surrounding feathery marine structures. More strikingly, its elongated body shape and numerous frilly appendages precisely mimic the form and texture of these background organisms, making it appear as just another part of the environment. The organism's outline is disrupted by these extensions, further aiding in blending. The low contrast difference between the pipefish and its immediate surroundings makes it exceedingly difficult to discern, even upon close inspection."
}