{
  "entity_type": "Organism",
  "camouflage_presence": "Camouflage",
  "object_category": "Fish",
  "object_name": "Pipefish",
  "background_description": "The background consists of a shallow aquatic seabed covered densely with a mix of small to medium-sized pebbles, gravel, and coarse sand. The dominant colors are muted browns, greys, and some lighter beige and reddish-brown tones, creating a mottled, uneven texture. There are minor organic debris visible, contributing to the rough and natural appearance.",
  "color_similarity": "high",
  "texture_similarity": "high",
  "contrast_difference": "low",
  "camouflage_score": "0.85",
  "confidence": "0.95",
  "camouflage_type": "Pattern matching",
  "explanation": "The Pipefish exhibits excellent camouflage against the gravelly seabed. Its body color, a yellowish-tan, closely matches the lighter stones and sandy patches in the background. The intricate dark brown and black patterns along its body are highly effective at mimicking the irregular shapes, shadows, and varying shades of the pebbles and coarse sand, creating a disruptive coloration. This pattern matching breaks up the organism's outline, making it difficult for a predator to distinguish its form from the mottled, granular environment. The texture of its skin, with its visible segments and patterns, also blends well with the rough texture of the substrate, further enhancing its concealment by minimizing any noticeable smooth surfaces. The overall low contrast between the organism and its environment significantly contributes to its camouflaged state."
}