{
  "entity_type": "Organism",
  "camouflage_presence": "Camouflage",
  "object_category": "Bird",
  "object_name": "Chicken",
  "background_description": "The background consists primarily of dense, tall blades of grass in varying stages of growth and dryness, presenting a mix of golden-brown, tan, and some green hues. The texture is fine and linear. Further in the background, there's a blurred, light-colored expanse, possibly representing a distant field or hazy sky.",
  "color_similarity": "medium",
  "texture_similarity": "low",
  "contrast_difference": "medium",
  "camouflage_score": 0.4,
  "confidence": 0.9,
  "camouflage_type": "Color blending",
  "explanation": "A chicken is partially visible, largely obscured by tall, dry grass. The chicken's reddish-brown plumage shares similar warm, earthy tones with the golden-brown dried grass, providing a degree of color blending (medium color similarity). However, its feathery texture is distinctly different from the linear texture of the grass (low texture similarity). While the chicken's body color helps it blend somewhat with the dried vegetation, the red comb or wattle on its head creates a high-contrast element, and its overall form is still discernible through the grass, leading to a medium contrast difference. The primary method of concealment here is the physical obstruction offered by the dense grass, enhancing the effect of its somewhat blending coloration with the dry environment. Therefore, camouflage is present, primarily through color blending with the dried grass, aided significantly by the dense cover."
}