{
  "entity_type": "Organism",
  "camouflage_presence": "Camouflage",
  "object_category": "Fish",
  "object_name": "GhostPipefish",
  "background_description": "The background consists of a dense, intricate feathery structure, characteristic of a crinoid or feather star. It features numerous long, branching arms with fine, segmented pinnules. The dominant colors are shades of reddish-brown, dark brown, orange, and yellowish-white, creating a complex, textured pattern with areas of light and shadow.",
  "color_similarity": "high",
  "texture_similarity": "high",
  "contrast_difference": "low",
  "camouflage_score": "0.95",
  "confidence": "1.0",
  "camouflage_type": "Mimicry",
  "explanation": "The GhostPipefish in this image exhibits exceptional camouflage. Its body shape is highly adapted to mimic the intricate, frilly arms of the crinoid it is resting upon. The fish's numerous appendages and spiky protrusions perfectly blend with the feather-like texture of the crinoid, making its outline virtually indistinguishable from the background. The dark reddish-brown color of the GhostPipefish, adorned with white spots, closely matches the color palette of the crinoid, which includes similar dark hues and lighter, mottled patterns. This combination of structural mimicry, color matching, and pattern disruption effectively hides the organism by making it appear as an integral part of its environment."
}