{
  "entity_type": "Organism",
  "camouflage_presence": "Camouflage",
  "object_category": "Fish",
  "object_name": "Pipefish",
  "background_description": "The background consists of a cluttered shallow marine environment, likely a seafloor, composed of fine light-colored sand, granular detritus, small pebbles, and various pieces of decaying reddish-brown plant matter or algae. The overall color palette is muted, featuring shades of light beige, sandy brown, and darker reddish-browns, with areas appearing slightly murky.",
  "color_similarity": "high",
  "texture_similarity": "high",
  "contrast_difference": "low",
  "camouflage_score": 0.9,
  "confidence": 1.0,
  "camouflage_type": "Color blending",
  "explanation": "The Pipefish exhibits excellent camouflage in this image. Its elongated, slender body shape, combined with its pale sandy-brown coloration and subtle darker speckles, allows it to blend almost seamlessly with the surrounding environment. The colors of the Pipefish closely match the dominant hues of the sandy substrate and detritus, achieving high color similarity. The irregular, granular texture of the Pipefish's body surface, including its small speckles, also mimics the varied textures of the background elements such as sand grains and small plant fragments, resulting in high texture similarity. This combination significantly reduces the contrast difference between the organism and its environment, making it very difficult for a predator to distinguish the Pipefish from the natural clutter of the seafloor. Its elongated form further aids in blending by appearing like another piece of debris or plant matter."
}