{
  "entity_type": "Organism",
  "camouflage_presence": "Camouflage",
  "object_category": "Bird",
  "object_name": "Frogmouth",
  "background_description": "The background consists of a thick, rough tree stump with deeply fissured, greyish-brown bark in the immediate foreground, serving as the perch. Behind this, there is a blurry backdrop of various green leaves and darker branches, indicating a dense forest or woodland environment.",
  "color_similarity": "high",
  "texture_similarity": "high",
  "contrast_difference": "low",
  "camouflage_score": 0.95,
  "confidence": 1.0,
  "camouflage_type": "Mimicry",
  "explanation": "The Frogmouth exhibits exceptional camouflage in this image. Its plumage coloration, a complex mix of greys, browns, and dark mottling, perfectly matches the hues and patterns of the rough tree bark it is perched on. The bird's feathers have a shaggy, textured appearance that mimics the fissures and irregularities of the bark. Furthermore, its posture, with its body held rigidly upright and its head tilted skyward, causes its shape to blend seamlessly with the broken top of the tree stump, effectively mimicking a jagged branch or a part of the wood itself. This combination of color blending, pattern matching, and shape disruption (mimicry of a natural object) makes it incredibly difficult to distinguish the bird from its environment, highlighting a very high level of camouflage."
}