{
  "entity_type": "Organism",
  "camouflage_presence": "Camouflage",
  "object_category": "Bird",
  "object_name": "House Finch",
  "background_description": "The immediate background on the left is a weathered, rusty brown metal bird feeder with a cage-like design and a perch. The background behind the bird and to the right is a blurry mix of dark greyish-brown and subtle green tones, suggesting shadowed structures or distant foliage.",
  "color_similarity": "medium",
  "texture_similarity": "low",
  "contrast_difference": "medium",
  "camouflage_score": 0.65,
  "confidence": 0.9,
  "camouflage_type": "Color blending",
  "explanation": "The bird, identified as a House Finch, displays natural camouflage through color blending. Its plumage consists of muted browns, greys, and some reddish-pink accents, which allows it to blend moderately well with the rusty brown and grey tones of the metal bird feeder it is perched on. These earthy colors are also typical of natural outdoor environments such as tree bark and soil, providing a degree of concealment. Although the bird's soft, feathered texture contrasts with the hard, rigid lines of the metal feeder, its coloration reduces its visibility against the immediate and distant background, preventing it from standing out significantly."
}