{
  "entity_type": "Organism",
  "camouflage_presence": "Camouflage",
  "object_category": "Insect",
  "object_name": "Caterpillar",
  "background_description": "The background consists of a soft, out-of-focus blur of brownish-green hues. In the foreground, there is a prominent, thick green plant stem with developing buds on the right side. Below the caterpillar, there are various withered, dried-up, and curled plant parts, mostly brown and greyish-brown, with visible textures resembling dried leaves and thin, brittle branches. The caterpillar itself is positioned on what appears to be a slender plant stem or branch, which has patches of light grey, white, and dark brown, mimicking bark or lichen.",
  "color_similarity": "high",
  "texture_similarity": "high",
  "contrast_difference": "low",
  "camouflage_score": "0.9",
  "confidence": "1.0",
  "camouflage_type": "Mimicry",
  "explanation": "The caterpillar displays an exceptional level of camouflage, specifically resembling a broken twig or a piece of dead bark. Its elongated, rigid posture, combined with its mottled coloration of off-white, grey, and dark brown patches, perfectly blends with the various textures and colors of the plant stem and dried foliage around it. The caterpillar's skin has an irregular, bumpy texture that further mimics the rough surface of natural wood or bark. This combination of color blending, texture matching, and highly effective shape mimicry makes it incredibly difficult to distinguish the living organism from the non-living plant material, resulting in very low contrast against its immediate surroundings."
}