{
  "entity_type": "Organism",
  "camouflage_presence": "Camouflage",
  "object_category": "Bird",
  "object_name": "Bird",
  "background_description": "The background consists primarily of a gnarled, weathered, light gray-brown tree branch with a rough, textured surface, indicating dead wood. Behind the branch and partially the bird, a clear, bright blue sky is visible.",
  "color_similarity": "high",
  "texture_similarity": "high",
  "contrast_difference": "low",
  "camouflage_score": 0.9,
  "confidence": 0.95,
  "camouflage_type": "Pattern matching",
  "explanation": "The bird exhibits strong camouflage against the dead tree branch. Its plumage is a mottled grayish-brown, which closely matches the desaturated, weathered colors of the bark. The irregular patterns and textures of the bird's feathers, particularly on its head and back, highly mimic the rough, gnarled, and cracked surface texture of the dead wood. While its silhouette is somewhat visible against the bright blue sky in certain areas, the primary portion of the bird's body blends exceptionally well with the branch due to the remarkable similarity in color and pattern, resulting in a low contrast difference with its immediate perch. This combination of color blending and pattern matching makes it very difficult to distinguish the bird from the tree."
}