{
  "entity_type": "Organism",
  "camouflage_presence": "Camouflage",
  "object_category": "Fish",
  "object_name": "Pipefish",
  "background_description": "The background depicts a shallow underwater environment, likely a seabed, densely covered with various types of detritus, algae, and possibly seagrass fragments. The substrate appears sandy or silty, obscured by organic matter ranging in colors from yellowish-brown, golden, dark green, to reddish hues. There are numerous irregular textures, shadows, and strands of plant material, creating a cluttered and highly patterned environment.",
  "color_similarity": "high",
  "texture_similarity": "high",
  "contrast_difference": "low",
  "camouflage_score": 0.9,
  "confidence": 1.0,
  "camouflage_type": "Color blending / Pattern matching / Shape disruption",
  "explanation": "The Pipefish exhibits excellent camouflage in this image. Its elongated, slender body, mottled brownish-yellow coloration, and irregular speckles and bands perfectly mimic the surrounding detritus, algae, and plant fragments. The organism's color palette blends seamlessly with the dominant hues of the background, making it very difficult to distinguish from the organic clutter. Furthermore, its body shape and textured surface allow it to resemble strands of plant matter or debris, disrupting its outline and effectively hiding its form within the highly textured environment. The low contrast difference between the pipefish and its immediate surroundings further enhances its ability to remain concealed."
}