{
  "entity_type": "Organism",
  "camouflage_presence": "Camouflage",
  "object_category": "Insect",
  "object_name": "Dragonfly",
  "background_description": "The organism is perched on a weathered, light-colored tree branch with a rough, fissured bark texture, covered in mottled grey, white, and brown lichen-like patches. The background behind the branch is a soft, out-of-focus blur of warm brown and green tones, suggesting distant foliage or earth.",
  "color_similarity": "high",
  "texture_similarity": "high",
  "contrast_difference": "low",
  "camouflage_score": "0.85",
  "confidence": "0.95",
  "camouflage_type": "Color blending / Pattern matching / Shape disruption",
  "explanation": "The organism (Dragonfly, as per instructions) exhibits highly effective camouflage. Its body and wings display a complex pattern of muted greys, browns, and creams that perfectly match the lichen and textured bark of the branch it is resting on. The intricate venation of its wings, along with the dark spot on the forewing, closely mimics the fissures, shadows, and irregular patches found on the branch. This excellent color blending and pattern matching, coupled with the overall low contrast between the insect and its perch, effectively breaks up its outline and makes it extremely difficult to distinguish from its environment."
}