{
  "entity_type": "Organism",
  "camouflage_presence": "Camouflage",
  "object_category": "Fish",
  "object_name": "Pipefish",
  "background_description": "The background consists primarily of a sandy or silty underwater seafloor, appearing yellowish-brown in color. The texture is granular and uneven, with various small clumps and depressions. There are darker patches that could be shadows, detritus, or areas of denser sediment. In the upper left, a larger, darker, textured object, possibly a piece of coral or rock, provides additional complexity to the environment.",
  "color_similarity": "medium",
  "texture_similarity": "high",
  "contrast_difference": "medium",
  "camouflage_score": 0.65,
  "confidence": 0.9,
  "camouflage_type": "Mimicry",
  "explanation": "The Pipefish exhibits good camouflage in this image. Its elongated, segmented body is reddish-brown, which, while not a perfect match to the yellowish-brown sand, falls within the earthy tones of the substrate. More importantly, its irregular outline and the presence of what appears to be sediment or algae clinging to its body allow it to perfectly mimic a piece of detritus, a twig, or a broken plant stem lying on the seabed. This 'debris-like' appearance creates a high texture similarity with the lumpy, granular sand and helps to disrupt its biological form. Although there is a medium contrast difference in some areas where its darker reddish segments stand out against brighter sand, its overall form, irregular surface, and strategic blending into the texture of the environment make it blend effectively as a non-living component of the seabed, thus leveraging mimicry."
}