{
  "entity_type": "Organism",
  "camouflage_presence": "Camouflage",
  "object_category": "Fish",
  "object_name": "Pipefish",
  "background_description": "The background consists of a dense arrangement of elongated, pillar-like structures, which are likely anemone tentacles or large coral polyps. These structures vary in color from rich reddish-brown to grey-brown, often with lighter, creamy white or pale yellow tips. Some areas in the deeper background show hints of green. The surfaces appear smooth with subtle folds and ridges, creating a crowded, textured environment.",
  "color_similarity": "high",
  "texture_similarity": "high",
  "contrast_difference": "low",
  "camouflage_score": 0.8,
  "confidence": 0.95,
  "camouflage_type": "Mimicry",
  "explanation": "The Pipefish exhibits strong camouflage by mimicking the form and coloration of the surrounding anemone tentacles. Its slender, elongated body shape is remarkably similar to the pillar-like structures of the anemone, allowing it to blend seamlessly into the complex arrangement. The pipefish's pale, almost translucent white/pinkish coloration, while not matching the dominant dark brown of the main tentacles, perfectly matches the creamy white and pale yellow tips and lighter inner folds of the anemone. This color and shape mimicry, coupled with its positioning within the dense anemone, significantly reduces its visibility, making it difficult to distinguish from the environment by disrupting its outline and making it appear as just another part of the anemone."
}