{
  "entity_type": "Organism",
  "camouflage_presence": "Camouflage",
  "object_category": "Insect",
  "object_name": "Caterpillar",
  "background_description": "The background consists of a large, green leaf with visible veins. The leaf shows signs of damage, with several irregular brown, dry patches and holes, some of which reveal a dark, black background beneath.",
  "color_similarity": "medium",
  "texture_similarity": "low",
  "contrast_difference": "medium",
  "camouflage_score": 0.65,
  "confidence": 0.9,
  "camouflage_type": "Color blending",
  "explanation": "The caterpillar exhibits a primary form of camouflage through color blending. Its main body color, a light yellowish-green, closely matches the vibrant green of the healthy sections of the leaf it is resting on. This allows it to blend quite effectively in terms of hue. However, its camouflage is not perfect due to several factors. The caterpillar's texture is highly spiky and hairy, which contrasts significantly with the smoother surface of the leaf. Additionally, it possesses a prominent bright yellow central stripe and distinct reddish-orange spots along its back, which stand out against the more uniform green background. The overall robust and three-dimensional shape of the caterpillar also creates a discernible outline and form that breaks the flat plane of the leaf, leading to a medium contrast difference despite the good color match. While the primary color provides a base for blending, the distinctive textures and patterns reduce its overall effectiveness."
}