{
  "entity_type": "Organism",
  "camouflage_presence": "Camouflage",
  "object_category": "Fish",
  "object_name": "Pipefish",
  "background_description": "The background is a vibrant and highly textured underwater marine environment. It consists of a dense arrangement of various hard and soft corals, sponges, and marine algae covering a rocky substrate. The colors are richly diverse, featuring shades of red, orange, brown, purple, green, yellow, and white, creating a complex and mottled visual field. The textures range from bumpy and encrusting to intricate branching forms.",
  "color_similarity": "high",
  "texture_similarity": "high",
  "contrast_difference": "low",
  "camouflage_score": 0.88,
  "confidence": 0.98,
  "camouflage_type": "Pattern matching",
  "explanation": "The Pipefish exhibits excellent camouflage in this image primarily through pattern matching and color blending. Its body is covered with intricate patterns of reddish-orange, white, and brown spots and stripes, which closely mimic the varied colors and mottled textures of the surrounding corals and algae. The elongated, slender form of the fish, combined with small, almost frilly appendages near its head, further aids in disrupting its outline, allowing it to blend seamlessly with the branching and textured structures of the reef. The overall low contrast difference between the pipefish and its busy background makes it very difficult to distinguish the organism, despite being in focus."
}