{
  "entity_type": "Organism",
  "camouflage_presence": "Camouflage",
  "object_category": "Fish",
  "object_name": "Pipefish",
  "background_description": "The background consists of a complex underwater environment, likely a coral reef or seagrass bed. It features various organic structures, including slender, elongated brown and beige plant-like forms (possibly seaweed, hydroids, or coral branches), a textured, light brown substrate with reddish-orange sponge-like patches, and a dark blue/green porous tube structure. The overall color palette is dominated by earthy tones of brown, beige, and muted greens.",
  "color_similarity": "high",
  "texture_similarity": "high",
  "contrast_difference": "low",
  "camouflage_score": "0.85",
  "confidence": "0.95",
  "camouflage_type": "Mimicry",
  "explanation": "The Pipefish exhibits excellent camouflage in this image. Its elongated, slender body shape and pale, sandy-brown coloration allow it to perfectly mimic the surrounding plant-like structures and detritus. The subtle variations in its body texture and shading are very similar to the irregular surfaces of the natural background elements. There is minimal color and texture contrast between the organism and its immediate environment, making it very difficult to distinguish from the surrounding organic matter. This form of mimicry, where the organism's shape and color resemble inanimate objects in its habitat, is highly effective at hiding it from predators and prey."
}