{
  "entity_type": "Organism",
  "camouflage_presence": "No Camouflage",
  "object_category": "Bird",
  "object_name": "Female Northern Cardinal",
  "background_description": "The background consists of a uniformly blurred, soft green, indicative of distant foliage or trees. In the foreground, there is a dark brown wooden railing or platform, covered with various bird seeds of different sizes and colors (black, grey, light brown, orange).",
  "color_similarity": "low",
  "texture_similarity": "low",
  "contrast_difference": "high",
  "camouflage_score": 0.2,
  "confidence": 0.95,
  "camouflage_type": "Color blending",
  "explanation": "The image features a female Northern Cardinal, an organism whose plumage, characterized by muted reddish-brown and tan tones, naturally provides a degree of color blending camouflage in its typical woodland environment, allowing it to blend with tree bark or dried leaves. However, in this specific scene, the bird is not effectively camouflaged. It is perched prominently on a dark brown wooden railing, which provides a strong contrast to its body. The background is a uniformly blurred green, and while the bird's colors might align with some natural elements, its distinct shape, bright red beak, and crest stand out clearly against both the blurred green and the dark wooden surface. Thus, despite the natural design for color blending, it is highly visible in this context."
}