{
  "entity_type": "Organism",
  "camouflage_presence": "Camouflage",
  "object_category": "Insect",
  "object_name": "StickInsect",
  "background_description": "The background consists of a dense, intricate network of dry, leafless twigs and thin branches in various shades of brown, gray-brown, and reddish-brown. Beyond this immediate tangle, the background is heavily blurred, showing hints of green foliage, a reddish-orange structure, and a blue-gray object.",
  "color_similarity": "high",
  "texture_similarity": "high",
  "contrast_difference": "medium",
  "camouflage_score": 0.85,
  "confidence": 0.95,
  "camouflage_type": "Mimicry",
  "explanation": "The StickInsect is exceptionally camouflaged in this image. Its elongated, slender body is dark brown, perfectly matching the color palette of the numerous dry, leafless twigs and branches that surround it. The insect's shape is a prime example of mimicry, as it precisely imitates a broken or dead twig, complete with small protuberances that resemble buds or scars on a branch. Its legs are also held in a way that further enhances this illusion. The texture of its body surface is also consistent with the rough, woody texture of the natural branches. While a very slight difference in hue or a smoother surface might be discernible upon very close inspection, the overall effect is highly effective, making it extremely difficult to differentiate the organism from its environment."
}