{
  "entity_type": "Organism",
  "camouflage_presence": "Camouflage",
  "object_category": "Insect",
  "object_name": "Grasshopper",
  "background_description": "The grasshopper is perched on a cluster of dry, weathered, light greyish-brown wooden branches or stalks, exhibiting a rough, vertical grain texture. The immediate background is also composed of these similar branches. Further behind, the environment consists of a blurred, arid, desert-like landscape with reddish-brown sandy/rocky ground and sparse, light-colored scrub vegetation. The sky above is clear blue with a few distant white clouds.",
  "color_similarity": "high",
  "texture_similarity": "high",
  "contrast_difference": "low",
  "camouflage_score": 0.95,
  "confidence": 1.0,
  "camouflage_type": "Mimicry",
  "explanation": "The grasshopper exhibits exceptional camouflage by perfectly blending with the dry, weathered wooden branches it is resting on. Its body color is a mottled mix of light grey, beige, and off-white with darker patterns, closely matching the desaturated tones of the dead wood. The texture of its exoskeleton, with its ridges and patterns, remarkably mimics the rough bark and grain of the branches. Furthermore, its elongated body shape and stick-like legs contribute to shape disruption, making it appear almost indistinguishable from a broken twig or part of the branch itself. The overall effect is a highly effective form of mimicry, making it very difficult to spot against its immediate background due to high color and texture similarity and low contrast difference."
}