{
  "entity_type": "Organism",
  "camouflage_presence": "Camouflage",
  "object_category": "Mammal",
  "object_name": "Sciuridae",
  "background_description": "The background features a large tree trunk with rough, scaly, grey-brown bark dominating the right side of the image. The left and top-left background consists of blurred green foliage and thin, dark branches, creating a soft, out-of-focus backdrop.",
  "color_similarity": "medium",
  "texture_similarity": "low",
  "contrast_difference": "medium",
  "camouflage_score": 0.65,
  "confidence": 0.9,
  "camouflage_type": "Color blending",
  "explanation": "The Sciuridae's reddish-brown fur provides a degree of color blending with the natural, earthy tones of the tree bark, which is its primary habitat. The bark itself is a mix of grey-browns and darker shadows, allowing the squirrel's natural coloration to integrate to some extent. While the fur's soft texture differs significantly from the rough, scaly bark (low texture similarity), and its prominent dark eyes and distinct head outline create a moderate contrast, the overall color palette allows for a level of integration. The organism's primary strategy in this image also heavily relies on concealment, with its head partially obscured by the tree trunk, which enhances its overall camouflage. Therefore, despite not being perfectly invisible, its natural coloring and positional advantage contribute to its camouflage."
}