{
  "entity_type": "Organism",
  "camouflage_presence": "Camouflage",
  "object_category": "Bird",
  "object_name": "Heron",
  "background_description": "The background consists of a dense field of tall, mostly dry reeds or grasses. The dominant colors are various shades of light brown, tan, and muted gold, indicating dried vegetation. There are also some vertical streaks of green, suggesting scattered live plant growth. The overall texture is vertical, linear, and somewhat cluttered, creating a busy, striped pattern.",
  "color_similarity": "medium",
  "texture_similarity": "low",
  "contrast_difference": "medium",
  "camouflage_score": 0.6,
  "confidence": 0.9,
  "camouflage_type": "Shape disruption",
  "explanation": "The Heron exhibits a moderate degree of camouflage in this image, primarily due to the dense vegetation obscuring its form. Its blue-grey plumage, while not perfectly matching the dominant golden-brown hues of the dry reeds, is a muted, natural tone that does not starkly contrast with the overall environment's color palette, contributing to a medium color similarity. The primary camouflage mechanism here is 'shape disruption': the tall, vertical reeds effectively break up the Heron's silhouette, making it difficult to discern its complete outline. While the texture of its feathers is different from the rigid reeds and its white head and yellowish beak create higher contrast points, the sheer volume and linear nature of the surrounding plants provide excellent cover, making the Heron less conspicuous than it would be in an open environment."
}