{
  "entity_type": "Organism",
  "camouflage_presence": "Camouflage",
  "object_category": "Fish",
  "object_name": "Lionfish",
  "background_description": "The background consists of a complex underwater environment, likely a coral reef or rocky seabed, featuring various mottled and textured formations. Colors range from earthy greens and browns to darker shadowy areas, with visible porous and uneven surfaces characteristic of coral or encrusted rocks. Some slender, sponge-like structures are also present.",
  "color_similarity": "medium",
  "texture_similarity": "medium",
  "contrast_difference": "medium",
  "camouflage_score": "0.75",
  "confidence": "0.95",
  "camouflage_type": "Disruptive pattern",
  "explanation": "The Lionfish exhibits a significant degree of camouflage, primarily through disruptive patterning. Its body is covered in bold, contrasting stripes of reddish-brown, white, and dark brown that effectively break up its outline against the varied textures and mottled colors of the coral reef background. The intricate, spiky fins further contribute to this disruptive effect, making the fish's distinct shape harder to discern. While Lionfish also have warning coloration due to their venomous spines, their patterns and coloration allow them to blend with the complex environment, ambushing prey or hiding from predators. The colors and textures of the fish show a medium similarity to the browns, greens, and irregular surfaces of the background, aiding in its concealment."
}