{
  "entity_type": "Organism",
  "camouflage_presence": "Camouflage",
  "object_category": "Insect",
  "object_name": "Dragonfly",
  "background_description": "The organism is perched on a rough tree branch, which is unevenly covered with patches of vibrant green moss, dried brown lichen, and areas of light-colored, textured bark. The background behind the branch is dark and out of focus, suggesting deep shadow or distant, indistinct foliage.",
  "color_similarity": "medium",
  "texture_similarity": "low",
  "contrast_difference": "medium",
  "camouflage_score": 0.6,
  "confidence": 0.9,
  "camouflage_type": "Color blending",
  "explanation": "The dragonfly displays a moderate level of camouflage. Its body, primarily reddish-brown and dark brown, blends effectively with the earthy tones of the tree bark and dried lichen on the branch. The transparent nature of its wings allows the background to show through, further aiding in reducing its visual presence. However, its distinct insect shape, the prominent clubbed antennae, the dark eyes, and subtle iridescent reflections on its wings create some contrast against the background. While it does not perfectly disappear, its coloration provides good color blending with its immediate environment, preventing it from overtly standing out."
}