{
  "entity_type": "Organism",
  "camouflage_presence": "Camouflage",
  "object_category": "Arachnid",
  "object_name": "Spider",
  "background_description": "The background consists of a cluster of blackberries at various stages of ripeness, including ripe black berries, unripe green berries, and reddish-green berries. There is also a soft-focus, bright green background, likely foliage.",
  "color_similarity": "medium",
  "texture_similarity": "low",
  "contrast_difference": "high",
  "camouflage_score": 0.5,
  "confidence": 0.9,
  "camouflage_type": "Color blending",
  "explanation": "The spider, likely a crab spider, exhibits a pale greenish-yellow coloration. This color is a form of camouflage (color blending) typically used to blend with green foliage or yellow flowers. In this image, while the spider is partially perched on a dark, ripe black blackberry, making it stand out due to high contrast, its color strongly matches the unripe green blackberries and the blurred green foliage in the background. If it were positioned entirely on a green berry or leaf, its camouflage would be highly effective. Thus, its intrinsic coloration is a camouflage adaptation, although its immediate placement against the dark berry makes it more visible than it would be on green parts of its environment."
}