{
  "entity_type": "Organism",
  "camouflage_presence": "Camouflage",
  "object_category": "Insect",
  "object_name": "StickInsect",
  "background_description": "The background consists of dense green foliage, featuring various leaves and brown woody stems and branches. The lighting appears to be dim, with some areas of the background being darker and blurred, suggesting a forest or dense plant environment. The primary elements relevant to the camouflage are the numerous thin brown branches and stems.",
  "color_similarity": "high",
  "texture_similarity": "high",
  "contrast_difference": "low",
  "camouflage_score": 0.9,
  "confidence": 1.0,
  "camouflage_type": "Mimicry",
  "explanation": "The StickInsect exhibits exceptional camouflage through its remarkable mimicry of a twig or small branch. Its elongated body and legs are perfectly shaped and colored to blend seamlessly with the surrounding woody stems and branches. The insect's brown and grey coloration closely matches the tones of the plant's bark, and its segmented body even mimics the rough texture and nodes found on natural twigs. The low contrast between the insect and its environment, coupled with its convincing shape, makes it extremely difficult to distinguish from the actual plant material, demonstrating highly effective mimicry and shape disruption."
}