{
  "entity_type": "Organism",
  "camouflage_presence": "Camouflage",
  "object_category": "Bird",
  "object_name": "Grouse",
  "background_description": "The background consists of a dry, arid environment dominated by tall, golden-brown grasses and various low-lying shrubs, likely sagebrush, which show a grayish-green hue. The lighting is warm, suggesting late afternoon or early morning sun, creating varied tones and shadows within the dense vegetation.",
  "color_similarity": "high",
  "texture_similarity": "high",
  "contrast_difference": "low",
  "camouflage_score": 0.85,
  "confidence": 0.95,
  "camouflage_type": "Pattern matching",
  "explanation": "The Grouse exhibits excellent camouflage in this image. Its mottled plumage, a mix of browns, greys, and whites with dark speckles and streaks, perfectly matches the colors and textures of the dry golden grasses and the grayish-green sagebrush in its environment. The irregular patterns on its feathers mimic the visual complexity of the surrounding vegetation, including the shadows and varying plant structures. This high color and texture similarity, combined with a low contrast difference against the background, effectively disrupts the bird's outline, making it very difficult to distinguish from the environment. The organism blends seamlessly into the dense, dry foliage."
}