{
  "entity_type": "Organism",
  "camouflage_presence": "Camouflage",
  "object_category": "Fish",
  "object_name": "Pipefish",
  "background_description": "The background consists of a shallow underwater environment with a sandy and gritty substrate, featuring various shades of brown, gray, and off-white sediment, small pebbles, and detritus. Several blades of vibrant green aquatic plants (likely seagrass or similar vegetation) are prominently visible, along with some paler, translucent plant stalks or debris.",
  "color_similarity": "high",
  "texture_similarity": "medium",
  "contrast_difference": "low",
  "camouflage_score": 0.9,
  "confidence": 0.95,
  "camouflage_type": "Mimicry",
  "explanation": "The Pipefish demonstrates excellent camouflage by mimicking its aquatic plant environment. Its elongated, slender body is predominantly pale and semi-translucent, allowing it to blend almost perfectly with the lighter, decaying, or specialized parts of the surrounding seagrass or aquatic vegetation it's resting upon. The head, while slightly more distinct with a visible eye, matches the brownish-tan hues of the sandy substrate and detritus, and its overall slender form further contributes to the mimicry of plant material. The low contrast between the pipefish and its immediate surroundings, combined with high color similarity, makes it exceptionally difficult to distinguish from the background."
}