{
  "entity_type": "Organism",
  "camouflage_presence": "Camouflage",
  "object_category": "Insect",
  "object_name": "Worm",
  "background_description": "The background consists predominantly of thick, hairy, green plant stems and some green leaves, likely from a tomato plant. A dark, almost black void is visible behind the foliage, creating deep shadows. A bright green vertical support stake is also faintly visible in the mid-background among the plant stems.",
  "color_similarity": "high",
  "texture_similarity": "medium",
  "contrast_difference": "low",
  "camouflage_score": 0.9,
  "confidence": 1.0,
  "camouflage_type": "Color blending",
  "explanation": "The organism, identified as a 'Worm' (a caterpillar, specifically), exhibits excellent camouflage primarily through color blending. Its vibrant green body perfectly matches the hue and lightness of the surrounding plant stems and leaves on which it resides. The overall contrast between the caterpillar and the green foliage is very low, making it difficult to spot at first glance. While the caterpillar has distinct white diagonal stripes and an orange horn, these features do not significantly compromise its overall concealment due to the dominant color match and how these patterns can also help disrupt its outline or mimic natural patterns in the foliage. Its body shape, although distinct, integrates well with the irregular forms of the plant's branches and leaves."
}