{
  "entity_type": "Organism",
  "camouflage_presence": "Camouflage",
  "object_category": "Bird",
  "object_name": "Bittern",
  "background_description": "The background consists of a patchy landscape with significant amounts of dried, brown grass mixed with some sparse green shoots. Irregular patches of melting snow and ice are scattered across the ground, indicating a late winter or early spring environment. The terrain is uneven, with clumps of vegetation providing varying textures and tones.",
  "color_similarity": "high",
  "texture_similarity": "high",
  "contrast_difference": "low",
  "camouflage_score": 0.85,
  "confidence": 0.9,
  "camouflage_type": "Color blending / Pattern matching / Shape disruption",
  "explanation": "The two organisms, identified as Bitterns as per the prompt, exhibit excellent camouflage within this environment. Their plumage displays a complex mosaic of muted browns, grays, and reddish-browns. These colors closely match the dominant tones of the dried grasses and earthy patches in the background. The intricate, mottled patterns on their feathers, particularly on their backs and flanks, effectively mimic the fragmented and irregular textures of the surrounding vegetation. The birds are observed hunkered down, which aids in disrupting their overall shape and minimizing their silhouette against the uneven ground. This combination of color matching, pattern disruption, and posture results in a low contrast difference between the birds and their surroundings, making them difficult to spot and thus highly camouflaged."
}