{
  "entity_type": "Organism",
  "camouflage_presence": "Camouflage",
  "object_category": "Insect",
  "object_name": "StickInsect",
  "background_description": "The organism is resting on a sturdy tree branch with rough, textured bark. The bark displays a mosaic of earthy brown and gray tones, heavily interspersed with vibrant green moss and lighter green lichen-like growths. The background is a soft, out-of-focus blur of light green and muted brown, suggesting dense foliage or distant vegetation.",
  "color_similarity": "high",
  "texture_similarity": "high",
  "contrast_difference": "low",
  "camouflage_score": 0.95,
  "confidence": 1.0,
  "camouflage_type": "Mimicry",
  "explanation": "The StickInsect demonstrates exceptional camouflage, blending almost perfectly with the mossy tree branch. Its body coloration, a mottled mix of browns, grays, and bright green patches, precisely matches the bark and the lush green moss growing on it. The insect's highly textured, spiky, and irregular body shape remarkably mimics the rough bark and the clustered appearance of the moss and lichen, effectively disrupting its outline. Its thin legs also contribute to the illusion of being a natural part of the branch. This combination of color blending, texture matching, and shape mimicry results in very low visual contrast, making the StickInsect extremely difficult to distinguish from its environment."
}