{
  "entity_type": "Organism",
  "camouflage_presence": "Camouflage",
  "object_category": "Mammal",
  "object_name": "Deer",
  "background_description": "The background consists of a dense, snowy forest environment. The ground is covered in white snow. Numerous bare, dark brown and grey tree branches crisscross the frame, creating a tangled, visually cluttered network. There are also darker, thicker tree trunks visible, partially covered in snow.",
  "color_similarity": "medium",
  "texture_similarity": "low",
  "contrast_difference": "medium",
  "camouflage_score": 0.65,
  "confidence": 0.9,
  "camouflage_type": "Shape disruption",
  "explanation": "The deer, with its reddish-brown coat, is partially camouflaged in this snowy, wooded environment. While its color contrasts with the pure white snow (low color similarity here), it shares some tonal qualities with the darker brown tree trunks and branches, providing a medium color similarity against these elements. Texture similarity is low as its fur differs significantly from bark and snow. The contrast difference is medium; the deer stands out against the snow but blends somewhat with the general woody tones. The primary form of camouflage here is 'shape disruption' and visual obstruction provided by the dense network of bare branches. These branches effectively break up the deer's outline and obscure significant portions of its body, making it harder for a predator or observer to immediately detect and recognize its form. This visual clutter significantly aids in its concealment, even though its intrinsic coloration isn't perfectly adapted for a snowy landscape."
}