{
  "entity_type": "Organism",
  "camouflage_presence": "Camouflage",
  "object_category": "Insect",
  "object_name": "Katydid",
  "background_description": "The background consists of a thick, gnarled tree branch with rough, textured bark in shades of brown, grey, and hints of green moss. Behind the branch, the environment is a softly blurred, light grey-brown, suggesting a distant background or diffuse lighting.",
  "color_similarity": "high",
  "texture_similarity": "high",
  "contrast_difference": "low",
  "camouflage_score": "0.9",
  "confidence": "1.0",
  "camouflage_type": "Mimicry",
  "explanation": "The Katydid exhibits outstanding camouflage through a combination of mimicry, color blending, and pattern matching. Its elongated and irregular body shape perfectly mimics a broken twig or a rough patch of bark on the branch. The coloration, a mottled mix of dark browns, greys, and subtle lighter tones, precisely matches the varied hues and textures of the surrounding bark, including what appears to be lichen or moss. This high degree of color and texture similarity, along with the effective shape mimicry, results in very low contrast, making the organism exceptionally difficult to discern from its environment."
}