{
  "entity_type": "Organism",
  "camouflage_presence": "Camouflage",
  "object_category": "Insect",
  "object_name": "StickInsect",
  "background_description": "The immediate background for the StickInsect is a weathered, rough plant stem or stalk, likely dried, with mottled grey, white, and dark speckles resembling lichen or dried bark. There is also a dried, fuzzy seed pod or flower head above and to the right, exhibiting similar textures and muted earthy tones. The further background is a soft, out-of-focus beige/light brown.",
  "color_similarity": "high",
  "texture_similarity": "high",
  "contrast_difference": "low",
  "camouflage_score": 0.95,
  "confidence": 1.0,
  "camouflage_type": "Mimicry",
  "explanation": "The StickInsect exhibits exceptional camouflage, blending almost perfectly with the weathered plant stem and dried flower/seed pod it is positioned on. Its body coloration, a mottled mix of grey, white, dark brown, and subtle greenish tones, precisely matches the lichen-like patterns and dried textures of the plant material. The irregular, bumpy, and somewhat 'furry' texture of the insect's exoskeleton, especially on its legs and main body, mimics the rough, fibrous, and speckled surface of the dried plant parts. The low contrast between the insect and its immediate environment, along with its twig-like posture and an overall shape that disrupts its outline, makes it incredibly difficult to distinguish from the surrounding plant debris. This is a prime example of crypsis achieved through structural and color mimicry of an inanimate object (a dried twig or weathered plant part)."
}