{
  "entity_type": "Organism",
  "camouflage_presence": "Camouflage",
  "object_category": "Fish",
  "object_name": "GhostPipefish",
  "background_description": "The background is a vibrant underwater coral reef environment. Prominently featured next to the GhostPipefish is a large, deep reddish-orange feather star (crinoid) with intricate, segmented arms. Further in the background, there are blurred areas of various corals and sponges displaying mottled greens, browns, pinks, and yellows, suggesting a rich and complex marine habitat.",
  "color_similarity": "high",
  "texture_similarity": "high",
  "contrast_difference": "low",
  "camouflage_score": "0.9",
  "confidence": "1.0",
  "camouflage_type": "Mimicry",
  "explanation": "The GhostPipefish exhibits exceptional camouflage in this image. Its highly irregular body shape, adorned with numerous spiky and frilly appendages, effectively disrupts its outline, making it difficult to perceive as a distinct organism. This shape closely mimics detritus or the complex structures of sessile invertebrates like the nearby feather star or coral polyps. The coloration, a mottled pattern of dark purplish-brown, white, and orange/yellow, perfectly matches the earthy tones and intricate patterns of the surrounding reef, especially the deep red and brown hues of the feather star and other background elements. The texture of the fish's body, with its rough and segmented appearance, further blends it with the natural textures of the reef. This combination of shape disruption, texture matching, and color blending results in highly effective mimicry, allowing the GhostPipefish to remain inconspicuous in its environment."
}