{
  "entity_type": "Organism",
  "camouflage_presence": "Camouflage",
  "object_category": "Fish",
  "object_name": "Pipefish",
  "background_description": "The background consists of dark blue/black water, with dense clusters of vibrant yellow-green, branching, leaf-like marine vegetation (likely seaweed or kelp). Some of this vegetation is in sharp focus, immediately surrounding the organism, while much of it is out of focus, creating a blurry yet textured depth.",
  "color_similarity": "high",
  "texture_similarity": "high",
  "contrast_difference": "low",
  "camouflage_score": "0.9",
  "confidence": "1.0",
  "camouflage_type": "Mimicry",
  "explanation": "The Pipefish exhibits excellent camouflage by perfectly mimicking the surrounding marine vegetation. Its body is a similar greenish-yellow color to the seaweed it inhabits. Crucially, it possesses numerous frilly, leaf-like dermal appendages that match the branching, irregular texture and shape of the kelp/seaweed. This 'vegetative' mimicry, combined with its elongated, segmented body blending seamlessly with the plant stems, makes it incredibly difficult to distinguish the organism from its environment. The combination of color matching, texture matching, and shape disruption through mimicry renders its outline almost invisible against the complex background."
}