{
  "entity_type": "Organism",
  "camouflage_presence": "Camouflage",
  "object_category": "Arachnid",
  "object_name": "Spider",
  "background_description": "The background is primarily tree bark covered with various types of lichens. There are large patches of pale grayish-white and light green lichens, providing a mottled, textured surface. Interspersed are numerous small, raised, reddish-brown to orange-brown circular lichen structures, adding to the irregular pattern. The bark itself shows some darker crevices and a rough, uneven texture.",
  "color_similarity": "high",
  "texture_similarity": "high",
  "contrast_difference": "low",
  "camouflage_score": 0.9,
  "confidence": 1.0,
  "camouflage_type": "Pattern matching",
  "explanation": "The spider exhibits exceptional camouflage, blending seamlessly with its environment. Its body color, a mottled grayish-white with darker specks, perfectly matches the dominant pale lichens on the tree bark. The spider's irregular and textured exoskeleton also mimics the rough, bumpy surface of the bark and the varied lichen growths, including the small reddish-brown circular patterns. The overall effect is a highly effective pattern matching, where the spider's shape, color, and texture make it nearly indistinguishable from the surrounding tree bark and lichens. The low contrast between the spider and its background further enhances its concealment, making it very difficult to spot."
}