{
  "entity_type": "Organism",
  "camouflage_presence": "Camouflage",
  "object_category": "Insect",
  "object_name": "Dragonfly",
  "background_description": "The background consists of a dense and cluttered layer of dry, fallen leaves, twigs, and plant debris, predominantly in shades of brown, tan, and muted ochre. The texture is rough and crinkled, with varied patterns and forms. The lighting is natural, creating areas of soft focus and dappled sunlight, adding to the visual complexity of the environment.",
  "color_similarity": "high",
  "texture_similarity": "low",
  "contrast_difference": "medium",
  "camouflage_score": "0.75",
  "confidence": "0.9",
  "camouflage_type": "Color blending",
  "explanation": "The dragonfly in this image demonstrates effective camouflage primarily through color blending. Its body and wings exhibit a range of muted brown, tan, and yellowish-green tones that closely match the dry, earthy colors of the surrounding fallen leaves and twigs. This high degree of color similarity allows the insect to blend seamlessly into the background's dominant hues. Although its texture differs from the rough leaves and its large eyes present a point of higher contrast, the overall effect is one of blending. The chaotic and textured nature of the dried foliage further aids in disrupting the dragonfly's outline, making it less distinct against the busy background. It is not immediately obvious and requires close examination to discern, indicating good camouflage."
}