{
  "entity_type": "Organism",
  "camouflage_presence": "Camouflage",
  "object_category": "Fish",
  "object_name": "ScorpionFish",
  "background_description": "The background consists of various knobby, irregularly shaped coral formations, predominantly in shades of greenish-white and muted green. There are also darker, shadowed areas between the coral structures, suggesting crevices or deeper sections of the reef. The overall environment is a complex coral reef.",
  "color_similarity": "medium",
  "texture_similarity": "medium",
  "contrast_difference": "medium",
  "camouflage_score": 0.85,
  "confidence": 0.95,
  "camouflage_type": "Mimicry",
  "explanation": "The ScorpionFish displays excellent camouflage, primarily through its remarkable mimicry of a piece of algae or a decaying leaf. Its highly modified body and fins are irregularly shaped and crinkled, effectively breaking up its outline (shape disruption) and allowing it to blend seamlessly with the complex textures of the coral reef. The fish's vibrant green coloration, while not an exact color match for the immediate greenish-white coral, aligns with the general presence of algal growth and other green flora often found in such environments. Darker mottled patterns on its body further enhance this effect, making it difficult to discern the organism from the natural reef debris and vegetation. The combination of its specialized morphology and disruptive color patterning makes it highly inconspicuous."
}