{
  "entity_type": "Organism",
  "camouflage_presence": "Camouflage",
  "object_category": "Fish",
  "object_name": "Pipefish",
  "background_description": "The background consists of an uneven underwater rocky or coral substrate heavily covered with various types of algae and detritus. The colors are predominantly mottled shades of dull green, brown, and greyish-white, creating a textured, somewhat chaotic surface with small darker patches.",
  "color_similarity": "high",
  "texture_similarity": "high",
  "contrast_difference": "low",
  "camouflage_score": 0.85,
  "confidence": 0.95,
  "camouflage_type": "Pattern matching",
  "explanation": "The Pipefish demonstrates excellent camouflage, primarily through pattern matching and color blending. Its slender, elongated body is adorned with a mottled greenish-grey coloration and irregular darker stripes and spots, which closely mimic the varied textures and hues of the algae-covered rocky seabed. The detailed reticulated pattern on its head further aids in disrupting its outline, making it difficult to distinguish from the surrounding organic growth and sediment. The overall low contrast between the organism and its environment ensures that it blends seamlessly into its habitat, effectively hiding it from predators and prey."
}