{
  "entity_type": "Organism",
  "camouflage_presence": "Camouflage",
  "object_category": "Insect",
  "object_name": "Katydid",
  "background_description": "The background consists of various dry, brown, and gray woody debris, dead leaves, and fibrous plant material. There are also out-of-focus areas of green foliage and bright light sources further in the background, suggesting a natural, vegetated environment, likely a forest floor or dense shrubbery.",
  "color_similarity": "high",
  "texture_similarity": "high",
  "contrast_difference": "low",
  "camouflage_score": "0.95",
  "confidence": "1.0",
  "camouflage_type": "Mimicry",
  "explanation": "The Katydid in this image exhibits exceptional camouflage through mimicry. Its body and wings are shaped and colored almost identically to a dried, decaying leaf, complete with realistic leaf venation patterns and ragged edges. The mottled brown and tan coloration perfectly matches the surrounding dry woody debris and leaf litter. The texture of the insect's body also closely mimics the rough, brittle texture of a dead leaf, further enhancing the illusion. There is very low contrast between the Katydid and its immediate environment, making it incredibly difficult to discern the organism from the background at first glance. Its irregular shape effectively disrupts its outline, preventing it from being identified as a living creature and instead making it appear as just another piece of natural detritus."
}