{
  "entity_type": "Organism",
  "camouflage_presence": "Camouflage",
  "object_category": "Fish",
  "object_name": "Camouflaged cephalopod",
  "background_description": "The background consists of various marine invertebrates, primarily coral formations. There is a prominent light yellow-green brain coral with intricate, wavy ridges and textured surfaces. Other areas feature darker, mottled rock or coral structures, and some shadowy crevices typical of a coral reef environment. A large, pinkish, porous tube sponge is also a major feature.",
  "color_similarity": "high",
  "texture_similarity": "high",
  "contrast_difference": "low",
  "camouflage_score": 0.95,
  "confidence": 0.98,
  "camouflage_type": "Mimicry",
  "explanation": "A small cephalopod (likely an octopus or cuttlefish) is expertly camouflaged within the coral reef environment. It is visible in the background, to the right of the pink sponge and above the yellow-green brain coral. The organism displays remarkable mimicry, matching both the mottled brown-green colors and the irregular, bumpy textures of the surrounding rock and coral. Its body contour is also irregular, blending seamlessly with the uneven surfaces. This high degree of color and texture similarity, combined with a low contrast difference against the background, makes the cephalopod extremely difficult to detect, indicating highly effective camouflage."
}