{
  "entity_type": "Organism",
  "camouflage_presence": "Camouflage",
  "object_category": "Fish",
  "object_name": "Pipefish",
  "background_description": "The background consists of a vibrant and diverse coral reef environment. Prominently featured are large clusters of light blue to greenish-white branching soft coral, among which the Pipefish is nestled. To the upper left, there's a denser, feathery soft coral. On the right, a darker brown, textured coral with a hexagonal pattern is visible. The substratum exhibits patches of reddish-pink, dark brown, and some green elements, indicating various other corals, sponges, or algae. The overall environment is rich in complex textures and varied coloration.",
  "color_similarity": "high",
  "texture_similarity": "medium",
  "contrast_difference": "low",
  "camouflage_score": 0.75,
  "confidence": 0.9,
  "camouflage_type": "Color blending",
  "explanation": "The Pipefish exhibits good camouflage against the soft coral background. Its slender, elongated body, particularly the posterior half, is a pale greenish-white to light blue, very closely matching the dominant color of the branching soft coral it is positioned within. This high degree of color similarity significantly reduces its visibility. While the Pipefish's texture is smooth compared to the frilly, branched texture of the coral, its overall thin and linear shape allows it to visually integrate with the coral branches, mimicking their form to some extent. The head region, with its reddish-orange and white stripes, stands out more against the pale coral, creating a medium contrast in that specific area. However, the majority of its body blends effectively, resulting in a low overall contrast difference. This combination of color blending and shape integration makes the Pipefish reasonably difficult to spot, especially to an unobservant eye."
}