{
  "entity_type": "Organism",
  "camouflage_presence": "Camouflage",
  "object_category": "Fish",
  "object_name": "Lionfish",
  "background_description": "The background consists of deep blue-green water, appearing somewhat murky or diffused, with faint, indistinct textures that suggest distant underwater features or particulate matter.",
  "color_similarity": "medium",
  "texture_similarity": "low",
  "contrast_difference": "medium",
  "camouflage_score": 0.85,
  "confidence": 0.98,
  "camouflage_type": "Disruptive pattern",
  "explanation": "The lionfish exhibits effective camouflage primarily through disruptive coloration. Its body and fins are adorned with bold, contrasting stripes of brown, white, black, and touches of orange and blue-green. These patterns break up the fish's outline, making it difficult for predators and prey to discern its shape against the complex, varied textures of coral reefs, rocky crevices, or shadowy areas in its natural marine habitat. While the immediate background in the image is somewhat uniform deep water, the disruptive patterns are designed to blend with a busy, textured environment, allowing the lionfish to ambush prey and avoid detection. The expansive, patterned fins further contribute to breaking up its silhouette, making it appear less like a solid, singular organism."
}