{
  "entity_type": "Organism",
  "camouflage_presence": "Camouflage",
  "object_category": "Fish",
  "object_name": "Pipefish",
  "background_description": "The background consists of a dense underwater environment dominated by dark red, possibly coral or sponge, heavily encrusted with lighter, off-white, beige, and brown detritus, small filamentous algae, and various sessile organisms. The textures are diverse, ranging from smoother red surfaces to highly irregular, grainy, fuzzy, and stringy patches, creating a cluttered and textured marine substrate.",
  "color_similarity": "medium",
  "texture_similarity": "high",
  "contrast_difference": "medium",
  "camouflage_score": 0.85,
  "confidence": 1.0,
  "camouflage_type": "Mimicry",
  "explanation": "The Pipefish exhibits excellent camouflage, making it exceptionally difficult to spot. Its body is adorned with irregular, lumpy growths and fine, stringy filaments that precisely mimic the encrusted textures, detritus, and small organisms present in its immediate marine environment. While the pipefish itself has a pale, off-white to beige coloration, it effectively blends with the similarly colored sediments and growths scattered across the darker red/brown substrate. This detailed mimicry of both shape and texture disrupts its outline, preventing it from being perceived as a distinct organism. Instead, it appears to be an integral part of the cluttered, encrusted background, like a piece of coral debris or part of the sessile life, providing strong protection against visual predators."
}