{
  "entity_type": "Organism",
  "camouflage_presence": "Camouflage",
  "object_category": "Insect",
  "object_name": "Caterpillar",
  "background_description": "The background consists of tree bark, characterized by a rough, fissured texture with deep crevices and raised areas. The bark exhibits a variety of muted colors including dark grays, lighter grays, and patches of off-white/pale green lichen, along with some subtle greenish moss. The overall impression is one of natural, irregular patterns and textures.",
  "color_similarity": "high",
  "texture_similarity": "high",
  "contrast_difference": "low",
  "camouflage_score": 0.9,
  "confidence": 1.0,
  "camouflage_type": "Pattern matching",
  "explanation": "This caterpillar exhibits exceptional camouflage, blending almost perfectly with the tree bark it rests upon. Its body coloration, a mosaic of grays, whites, and dark speckles, meticulously matches the varied tones and patchy appearance of the bark, including areas of lichen. The caterpillar's highly textured surface, covered in fine, bristly hairs and featuring prominent, irregular projections, mimics the rough, fissured texture and knobby growths of the bark. This combination creates an effective pattern matching, where the caterpillar's markings and form integrate seamlessly into the visual noise of the background. Furthermore, the irregular shape of the caterpillar and its projections act as a form of shape disruption, breaking up its distinct outline and making it very difficult to discern from the surrounding environment. The low contrast difference between the organism and the background further enhances its ability to remain hidden."
}