{
  "entity_type": "Organism",
  "camouflage_presence": "Camouflage",
  "object_category": "Fish",
  "object_name": "Pipefish",
  "background_description": "The background consists of a shallow underwater environment with a rocky substrate heavily covered in various types of marine algae and growth. The colors of the environment are predominantly olive green, brown, and dark brown, with some lighter sandy patches. Numerous small air bubbles are scattered throughout the algae, adding to the cluttered and textured appearance. The overall texture is rough, irregular, and granular.",
  "color_similarity": "high",
  "texture_similarity": "high",
  "contrast_difference": "low",
  "camouflage_score": 0.85,
  "confidence": 1.0,
  "camouflage_type": "Color blending / Pattern matching",
  "explanation": "The Pipefish in this image demonstrates effective camouflage. Its body coloration, which is a mix of yellowish-green and olive tones with intricate dark, fine, irregular lines and patterns, closely mimics the colors and visual textures of the surrounding algae-covered rocks and marine growth. The low contrast difference between the organism and its immediate background makes it difficult to discern its outline and form. The combination of color blending and detailed pattern matching allows the Pipefish to seamlessly integrate into the cluttered and textured underwater environment, making it well-hidden from potential predators."
}