{
  "entity_type": "Organism",
  "camouflage_presence": "Camouflage",
  "object_category": "Fish",
  "object_name": "Pipefish",
  "background_description": "The background consists of dense marine vegetation, likely seaweed or algae, characterized by numerous thin, branching stalks and smaller, round, yellowish-green bladder-like structures or berries. The colors of the vegetation are predominantly muted greens, browns, and reddish hues, with some parts appearing lighter or encrusted. The overall environment is aquatic, with a darker, somewhat murky greenish-blue water column and a hint of a lighter, possibly silty or sandy bottom at the base.",
  "color_similarity": "high",
  "texture_similarity": "high",
  "contrast_difference": "low",
  "camouflage_score": 0.9,
  "confidence": 1.0,
  "camouflage_type": "Mimicry",
  "explanation": "The Pipefish exhibits excellent camouflage by mimicking the surrounding marine vegetation. Its elongated, slender body closely resembles the thin, branching stalks of the seaweed, both in shape and overall form. The fish's mottled coloration, featuring light greenish-brownish tones with darker segments and faint spots, perfectly matches the varying hues and textures of the plant material, including the lighter, encrusted areas on the branches. This high similarity in color and texture, combined with a very low contrast difference against the background, makes it incredibly difficult to distinguish the Pipefish from the natural environment, effectively hiding it from predators and prey through visual resemblance to a non-living object."
}