{
  "entity_type": "Organism",
  "camouflage_presence": "Camouflage",
  "object_category": "Insect",
  "object_name": "Caterpillar",
  "background_description": "The background consists of a tree branch or bark, heavily textured with irregular patterns and patches of green, brown, and grey moss and lichen. The bark shows some reddish-brown undertones in places, indicating its natural wood color beneath the growth. There is a deep black, out-of-focus area in the upper left of the image, suggesting a dark background or deep shadow.",
  "color_similarity": "high",
  "texture_similarity": "high",
  "contrast_difference": "low",
  "camouflage_score": 0.95,
  "confidence": 1.0,
  "camouflage_type": "Color blending / Pattern matching / Shape disruption / Mimicry",
  "explanation": "The caterpillar exhibits exceptional camouflage, blending almost perfectly with its environment. Its coloration, a complex mix of greens, browns, and grays, meticulously matches the hues of the moss, lichen, and bark it rests upon. The most striking feature of its camouflage is its highly irregular and frilly body shape and texture, which precisely mimics the growth of lichen and moss on the tree bark. This 'shape disruption' and 'pattern matching' breaks up its outline and prevents it from being recognized as a distinct organism, making it appear as an integral part of the tree surface. The low contrast between the caterpillar and its surroundings further enhances this incredible mimicry, making it extremely difficult to spot."
}