{
  "entity_type": "Organism",
  "camouflage_presence": "Camouflage",
  "object_category": "Fish",
  "object_name": "Sea cucumber",
  "background_description": "The background consists of a vibrant coral reef environment. It features various coral types, including large brain corals, intricate branching corals, and encrusting algae-covered rocks. The predominant colors are muted browns, greens, and tans from the rocks and algae, interspersed with lighter cream and white tones from living corals. The upper part of the image shows the clear, blue hue of the open water.",
  "color_similarity": "high",
  "texture_similarity": "high",
  "contrast_difference": "low",
  "camouflage_score": 0.85,
  "confidence": 1.0,
  "camouflage_type": "Color blending",
  "explanation": "The sea cucumber exhibits effective camouflage through a combination of color blending and texture matching with its coral reef environment. Its mottled brown, tan, and cream coloration, adorned with darker spots, closely mimics the varied hues of the surrounding rocky substrate and algal-covered corals. The irregular, bumpy texture of the sea cucumber's skin further enhances its concealment by seamlessly integrating with the rough and uneven surfaces of the reef. This high degree of similarity in both color and texture, along with a low contrast difference, makes the sea cucumber difficult to distinguish from its natural environment, providing excellent concealment from predators. (Note: 'Fish' is used as the closest available category for a marine organism in the provided schema, though biologically a sea cucumber is an echinoderm and not a fish.)"
}