{
  "entity_type": "Organism",
  "camouflage_presence": "Camouflage",
  "object_category": "Crustacean",
  "object_name": "Pagurian",
  "background_description": "The background consists of dark, uneven rock or substrate forming an overhang or crevice in the upper part, creating a deeply shadowed area. The foreground is composed of coarse sand and small pebbles or gravel, exhibiting various earthy tones like light brown, dark brown, grey, and occasional specks of white, yellow, and blue. The overall lighting is dim and natural, contributing to a muted, low-contrast environment.",
  "color_similarity": "high",
  "texture_similarity": "high",
  "contrast_difference": "low",
  "camouflage_score": 0.8,
  "confidence": 0.9,
  "camouflage_type": "Color blending",
  "explanation": "The Pagurian exhibits effective camouflage through strong color blending with its environment. Its dark reddish-brown body and shell closely match the dark tones of the rocky crevice and the darker elements of the sandy substrate. The textured surface of the Pagurian's claws and shell also provides a good match to the rough, granular textures of the surrounding rocks and sand. Furthermore, the organism is nestled deep within a shadowed area, which significantly reduces its visual contrast against the dark background, aiding in concealment. The overall low light in the image and the harmonious color palette make the Pagurian difficult to discern at a glance, allowing it to blend seamlessly into its natural habitat."
}