{
  "entity_type": "Organism",
  "camouflage_presence": "Camouflage",
  "object_category": "Fish",
  "object_name": "GhostPipefish",
  "background_description": "The background is dominated by the intricate, branching arms of a deep red crinoid or feather star. These arms are densely covered with numerous small, white, feathery or spiky protrusions. The overall environment is highly textured and visually complex, with some blurry, lighter (yellowish/brownish) areas visible in the deeper background behind the crinoid.",
  "color_similarity": "high",
  "texture_similarity": "high",
  "contrast_difference": "low",
  "camouflage_score": 0.9,
  "confidence": 1.0,
  "camouflage_type": "Mimicry",
  "explanation": "The GhostPipefish exhibits exceptional camouflage by perfectly mimicking the deep red crinoid it is resting on. Its body is adorned with frilly, leaf-like appendages and spiky protrusions that closely match the intricate, branching structure of the crinoid's arms and their small, white, feathery extensions. Both the fish and the crinoid share a dominant deep red coloration interspersed with striking white patterns and markings, resulting in high color and texture similarity. This detailed resemblance effectively disrupts the fish's natural outline and blends it seamlessly into the complex background, making it extremely difficult to distinguish from its environment. The low contrast difference between the fish and its surroundings further aids in its concealment, demonstrating a highly effective form of mimicry."
}