{
  "entity_type": "Organism",
  "camouflage_presence": "Camouflage",
  "object_category": "Fish",
  "object_name": "Pipefish",
  "background_description": "The background consists of a sandy/silty seabed littered with small pebbles, fine sediment, and various pieces of detritus. The colors are predominantly muted browns, grays, and yellowish tones, with some areas showing hints of orange or red, suggestive of algae or mineral deposits. The pipefish is resting directly on a piece of brown, decaying leaf-like detritus, which itself has a textured, grid-like pattern.",
  "color_similarity": "high",
  "texture_similarity": "high",
  "contrast_difference": "low",
  "camouflage_score": 0.95,
  "confidence": 1.0,
  "camouflage_type": "Color blending / Pattern matching / Shape disruption",
  "explanation": "The Pipefish exhibits exceptional camouflage, blending almost seamlessly with its sandy and detritus-laden environment. Its body coloration, featuring mottled browns and yellowish tones with hints of purplish/pinkish spots, perfectly matches the hues of the decaying leaf it rests upon and the surrounding seabed. The irregular, often ragged texture and outline of its body, particularly the fins and tail, mimic the fragmented nature of detritus and plant debris, breaking up its silhouette effectively. The pipefish's elongated and somewhat flattened shape, combined with its strategic positioning on a piece of debris, allows it to resemble a discarded piece of plant matter. This combination of high color and texture similarity, along with a low contrast difference and significant shape disruption, makes it incredibly difficult to detect, providing excellent protection from predators."
}