{
  "entity_type": "Organism",
  "camouflage_presence": "Camouflage",
  "object_category": "Fish",
  "object_name": "Pipefish",
  "background_description": "The image portrays an underwater environment characterized by a dense growth of aquatic plants, predominantly seagrass or similar narrow-bladed vegetation. These plants display a range of colors from vibrant green to dark brown, creating a textured backdrop of vertical and angled linear forms. Some broader, darker green plant structures are also present. The bottom consists of a light, sandy or pebbly substrate, partially covered by finer green growth. The water itself has a greenish hue.",
  "color_similarity": "high",
  "texture_similarity": "high",
  "contrast_difference": "low",
  "camouflage_score": 0.85,
  "confidence": 0.95,
  "camouflage_type": "Mimicry",
  "explanation": "The Pipefish demonstrates highly effective camouflage within its seagrass habitat. Its slender, elongated body perfectly mimics the shape and form of the surrounding aquatic plant stems and blades. There are two Pipefish visible: a dark brown one in the upper-right blends almost seamlessly in color with the dark brown plant stalks, while a lighter, tan-colored Pipefish in the lower-left also harmonizes with the paler plant elements and the sandy bottom. Both individuals effectively disrupt their outline through shape mimicry and color blending, making them exceptionally difficult to spot against the linear and textured background of the vegetation. The vertical orientation of the dark brown Pipefish further enhances its resemblance to a plant stem."
}