{
  "entity_type": "Organism",
  "camouflage_presence": "Camouflage",
  "object_category": "Insect",
  "object_name": "Ant",
  "background_description": "The background consists of weathered, dark brown wooden surface, likely a tree stump or log. It is highly textured with visible wood grain, cracks, and crevices. Patches of light green and yellow lichen or moss are scattered across the surface, providing a granular texture and color variation. There are also small bits of organic debris, like dry leaves or plant matter, integrated into the wood's texture.",
  "color_similarity": "high",
  "texture_similarity": "medium",
  "contrast_difference": "medium",
  "camouflage_score": 0.65,
  "confidence": 0.9,
  "camouflage_type": "Color blending",
  "explanation": "The ant exhibits a good degree of camouflage in this image primarily due to color blending. Its dark, reddish-brown to black coloration closely matches the predominant dark brown and grey tones of the weathered wood and the shadowed areas. While the ant has a somewhat shiny exoskeleton that can reflect light, creating a slight contrast, its overall dark hue allows it to blend effectively with the darker parts of the irregular, textured wooden surface. The texture similarity is medium; the ant's smooth yet segmented body doesn't perfectly mimic the rough, granular texture of the wood and lichen, but its small size minimizes this discrepancy. The contrast difference is also medium; while it stands out against the lighter green/yellow lichen patches and bright highlights, it merges well with the darker wood grain and crevices, making it less conspicuous than if it were a brighter color against this background."
}