{
  "entity_type": "Organism",
  "camouflage_presence": "Camouflage",
  "object_category": "Bird",
  "object_name": "Great Blue Heron",
  "background_description": "The background consists of a tranquil body of water with a gently rippled surface, reflecting hues of light blue-gray, darker blue-gray, and brownish-gray, suggesting reflections of distant objects or structures. The immediate foreground features sparse, dry, brown reeds and grasses emerging from the water.",
  "color_similarity": "medium",
  "texture_similarity": "low",
  "contrast_difference": "medium",
  "camouflage_score": 0.6,
  "confidence": 0.95,
  "camouflage_type": "Color blending",
  "explanation": "The image features two Great Blue Herons in a watery environment. The primary heron, captured mid-landing with wings spread, displays a natural blue-gray plumage and dark wings. While its current dynamic pose and silhouette against the brighter water reduce its immediate crypsis, its overall coloration is adapted for color blending within its typical wetland and marsh habitats. The muted blue-gray tones of its body have a medium color similarity with the water's surface and the darker reflections, and a low texture similarity to the rippled water and sparse reeds. The second heron in the foreground, partially obscured by the brown reeds, demonstrates better blending due to its stationary position and partial concealment. Although the moving bird creates a medium contrast difference, the species' inherent coloration serves as a form of camouflage designed to help it blend into its natural surroundings for hunting and protection."
}