{
  "entity_type": "Organism",
  "camouflage_presence": "Camouflage",
  "object_category": "Fish",
  "object_name": "Pipefish",
  "background_description": "The background is an underwater environment, likely a shallow reef or rocky substrate. It is extensively covered with light yellowish-green sediment, fine detritus, and various marine growths including prominent reddish-brown patches of coralline algae or sponges, and some darker green algal filaments. The overall texture is rough, granular, and uneven, featuring small rocks and debris.",
  "color_similarity": "high",
  "texture_similarity": "low",
  "contrast_difference": "low",
  "camouflage_score": "0.7",
  "confidence": "0.9",
  "camouflage_type": "Color blending",
  "explanation": "The Pipefish is well camouflaged in this image, primarily through excellent color blending. Its mottled reddish-brown coloration closely matches the patches of reddish coralline algae, sponges, or detritus scattered across the rocky, sediment-covered seabed. While the dominant background sediment is yellowish-green, the Pipefish effectively hides among the similarly colored elements present within the environment. The contrast between the Pipefish and its immediate environment is low, making it difficult to spot at first glance. Although its elongated, slender shape is somewhat distinct from the purely amorphous background sediment, its thinness and slight curvature allow it to integrate into the visual clutter. Texture similarity is not as high, as the background is very granular while the Pipefish has a smoother, segmented body, but the strong color match is the dominant factor in its camouflage effectiveness."
}