{
  "entity_type": "Organism",
  "camouflage_presence": "Camouflage",
  "object_category": "Fish",
  "object_name": "GhostPipefish",
  "background_description": "The background consists primarily of a large crinoid (feather star) with numerous pale yellow to off-white, feathery, and highly branched arms. These arms have delicate, intricate structures and are speckled with small dark spots. Behind the crinoid, the environment is very dark, suggesting deep water or a shaded area, with hints of a dark, rocky or sandy seabed with small debris.",
  "color_similarity": "high",
  "texture_similarity": "high",
  "contrast_difference": "low",
  "camouflage_score": 0.95,
  "confidence": 1.0,
  "camouflage_type": "Mimicry",
  "explanation": "The GhostPipefish exhibits exceptional camouflage in this image, primarily through mimicry of the crinoid it is inhabiting. Its body shape is highly modified with numerous spiky, frilly, and filamentous appendages that precisely match the intricate, feathery structure of the crinoid's arms. The coloration of the pipefish, a blend of pale white and pinkish hues with reddish-brown markings, closely resembles the overall light tone and subtle patterns of the crinoid, including its speckling. This combination of structural mimicry, shape disruption, and color matching makes it incredibly difficult to distinguish the fish from its host organism, rendering it virtually invisible to predators and prey."
}