{
  "entity_type": "Organism",
  "camouflage_presence": "Camouflage",
  "object_category": "Fish",
  "object_name": "Pipefish",
  "background_description": "The background consists of a shallow sandy seabed with sparse patches of green seagrass, various forms of brownish and reddish-brown algae, and scattered organic detritus such as small sticks and dead plant matter. The water is clear, allowing light to penetrate and illuminate the varied textures of the bottom.",
  "color_similarity": "high",
  "texture_similarity": "high",
  "contrast_difference": "low",
  "camouflage_score": 0.9,
  "confidence": 1.0,
  "camouflage_type": "Mimicry",
  "explanation": "The Pipefish in this image demonstrates exceptional camouflage through a combination of color blending and mimicry. There are at least two pipefish visible, both blending remarkably well. One, located slightly off-center to the right, is pale beige/white and its elongated, slender body closely resembles a piece of light-colored dead plant matter or detritus on the sandy bottom, blending with both the sand and the pale elements. Another pipefish, positioned further up towards the top-center, is darker brown and extremely thin, perfectly mimicking a small twig or a strand of brown algae amidst the detritus. Their elongated, stick-like shapes mimic the surrounding plant matter and debris, while their coloration matches the varied hues of the sand and organic material. The low contrast difference between the pipefish and their immediate surroundings, along with their perfect mimicry of common background elements, makes them incredibly difficult to distinguish, providing effective protection from predators and aiding in ambush predation."
}