{
  "entity_type": "Organism",
  "camouflage_presence": "Camouflage",
  "object_category": "Insect",
  "object_name": "Grasshopper",
  "background_description": "The background consists of a dense scattering of dark grey to black volcanic gravel, small rocks, and pebbles. The textures are rough and angular, with varying shades of dark grey, brown, and some lighter mineral deposits. In the upper background, there are two out-of-focus, light-colored, fuzzy plant-like structures.",
  "color_similarity": "high",
  "texture_similarity": "high",
  "contrast_difference": "low",
  "camouflage_score": 0.8,
  "confidence": 0.9,
  "camouflage_type": "Color blending",
  "explanation": "The grasshopper demonstrates strong camouflage through color blending and pattern matching. Its body and wings are mottled in shades of grey and brown, with intricate patterns that perfectly mimic the appearance of the surrounding volcanic gravel and small rocks. The rough texture of the grasshopper's exoskeleton further contributes to this effect, making it visually almost indistinguishable from the irregular surfaces of the pebbles. There is a low contrast between the organism and its environment, making it difficult to discern its outline and details. This effective blending allows it to disappear into the rocky terrain."
}