{
  "entity_type": "Organism",
  "camouflage_presence": "Camouflage",
  "object_category": "Insect",
  "object_name": "StickInsect",
  "background_description": "The background consists predominantly of lush, vibrant green fern fronds with a delicate, serrated texture. Beneath and around the ferns, darker patches of brown soil, decaying leaves, and fallen twigs are visible, characteristic of a shaded woodland floor.",
  "color_similarity": "low",
  "texture_similarity": "low",
  "contrast_difference": "medium",
  "camouflage_score": 0.75,
  "confidence": 0.95,
  "camouflage_type": "Mimicry",
  "explanation": "The StickInsect in this image exhibits a remarkable degree of camouflage primarily through mimicry. Its elongated, slender body and legs are expertly shaped to resemble a dried twig or small stem. While its brownish-grey coloration does not blend with the vibrant green of the fern fronds it is resting upon (leading to low color and texture similarity with the immediate background and a medium contrast difference), its form is so convincingly 'twig-like' that it becomes incredibly difficult to distinguish from the natural clutter of a forest environment. The success of its camouflage relies on its structural imitation rather than direct color or texture matching with the dominant green foliage, making it appear as a non-living part of the plant."
}