{
  "entity_type": "Organism",
  "camouflage_presence": "Camouflage",
  "object_category": "Insect",
  "object_name": "Katydid",
  "background_description": "The background consists of a dark, likely woody, surface densely covered with various types of moss and small plant growths. The moss exhibits a range of green shades, from bright lime green to olive green and darker, muted brownish-green areas. The texture is highly irregular, fuzzy, and spiky, with individual moss strands and tiny plant structures creating a complex, textured environment. The upper portion of the background is a deep, dark shadow, almost black.",
  "color_similarity": "high",
  "texture_similarity": "high",
  "contrast_difference": "low",
  "camouflage_score": 0.9,
  "confidence": 1.0,
  "camouflage_type": "Mimicry",
  "explanation": "The Katydid in this image is exceptionally camouflaged, blending seamlessly with its mossy environment. Its body exhibits a remarkable range of green hues, from yellowish-green to olive green, which perfectly match the varied coloration of the surrounding moss and plant matter. More significantly, its physical structure is a prime example of mimicry and shape disruption; its exoskeleton is covered in numerous spiky protrusions, ridges, and irregular patterns that precisely replicate the spiky, fuzzy, and variegated textures of the moss. This structural mimicry makes it incredibly difficult to distinguish the Katydid's outline from the dense, textured background, breaking up its form and effectively hiding its presence. The low contrast and high similarity in both color and texture contribute to its near-perfect concealment, making it almost invisible to a casual observer."
}