{
  "entity_type": "Organism",
  "camouflage_presence": "Camouflage",
  "object_category": "Fish",
  "object_name": "CrocodileFish",
  "background_description": "The background consists of a vibrant underwater coral reef environment. It features various types of corals, including stony corals with intricate, textured surfaces, branching corals, and some soft, sponge-like structures. The dominant colors are shades of greenish-brown, teal, and earthy tones, with some lighter patches of coral and darker rocky crevices. The water imparts an overall blue-green hue to the scene.",
  "color_similarity": "high",
  "texture_similarity": "high",
  "contrast_difference": "low",
  "camouflage_score": 0.9,
  "confidence": 1.0,
  "camouflage_type": "Color blending / Pattern matching / Shape disruption",
  "explanation": "The CrocodileFish exhibits excellent camouflage against the coral reef background. Its skin coloration, a mottled mix of greens, browns, and teals, perfectly matches the hues of the surrounding stony and branching corals. The fish's highly textured body, covered with bumps, ridges, and irregular projections, mimics the rough and uneven surfaces of the coral structures, effectively disrupting its outline. The low contrast between the fish's patterns and the background makes it very difficult to distinguish from the environment, allowing it to blend seamlessly into the reef. Its form and pattern make it appear as part of the reef structure."
}