{
  "entity_type": "Organism",
  "camouflage_presence": "Camouflage",
  "object_category": "Fish",
  "object_name": "SeaHorse",
  "background_description": "The background consists of dense, intricate branching coral or gorgonian, predominantly in shades of yellow and orange. The coral branches are covered with numerous small, feathery or bulbous polyps, creating a highly textured and irregular surface. There are darker, shadowy areas visible between the branches, indicating depth.",
  "color_similarity": "high",
  "texture_similarity": "high",
  "contrast_difference": "low",
  "camouflage_score": 0.95,
  "confidence": 1.0,
  "camouflage_type": "Mimicry",
  "explanation": "The SeaHorse in this image demonstrates exceptional camouflage through mimicry. Its body coloration, predominantly yellow-orange with lighter, more translucent patches, perfectly matches the vibrant hues of the surrounding coral/gorgonian. Furthermore, its skin texture is incredibly adapted, featuring numerous small, bulbous protuberances that precisely mimic the individual polyps and the overall irregular, bumpy surface of its host. This combination of exact color matching, textural pattern mimicry, and a shape that blends with the intricate coral structure makes the seahorse virtually indistinguishable from its environment, providing highly effective concealment."
}