{
  "entity_type": "Organism",
  "camouflage_presence": "Camouflage",
  "object_category": "Insect",
  "object_name": "Grasshopper",
  "background_description": "The background consists of a dry, sunlit, arid terrain covered extensively with numerous small to medium-sized pebbles, rocks, and fine light-colored sand or dust. The colors of the ground are predominantly various shades of off-white, light beige, tan, and light grey, creating a muted, earthy palette. The texture is rough and irregular due to the varied shapes and sizes of the stones and the granular nature of the sand.",
  "color_similarity": "high",
  "texture_similarity": "high",
  "contrast_difference": "low",
  "camouflage_score": 0.8,
  "confidence": 0.9,
  "camouflage_type": "Color blending",
  "explanation": "The grasshopper exhibits strong camouflage against its arid, rocky environment. Its body is primarily a dull blend of light brown, tan, and greyish-brown, closely matching the dominant colors of the surrounding pebbles, sand, and dust. The irregular patterns and textures on its exoskeleton also complement the fragmented, rough nature of the ground, contributing to both color blending and some degree of pattern matching. The overall contrast between the grasshopper and its background is low, making it difficult to spot at a glance as it blends seamlessly into the desaturated earthy tones of the terrain. While a small shadow is cast, the organism itself is very well-integrated visually."
}