{
  "entity_type": "Organism",
  "camouflage_presence": "Camouflage",
  "object_category": "Insect",
  "object_name": "Katydid",
  "background_description": "The background consists of vibrant green foliage, including discernible leaves and stems, some of which exhibit reddish-brown edges or tips. The further background is a soft-focus bokeh of various shades of green, suggesting a dense, leafy environment under bright, natural lighting.",
  "color_similarity": "high",
  "texture_similarity": "low",
  "contrast_difference": "low",
  "camouflage_score": 0.75,
  "confidence": 0.9,
  "camouflage_type": "Color blending",
  "explanation": "The Katydid exhibits effective camouflage primarily through color blending. Its bright green body closely matches the various shades of green present in the surrounding foliage, including the leaves and stems it is perched upon. This high color similarity significantly reduces its visibility. While the ribbed texture of its abdomen is distinct from the smoother surfaces of the plant leaves and stems, and its overall insect shape is discernible upon close inspection, the lack of significant color and contrast difference allows it to blend seamlessly into the verdant environment, making it challenging to spot at first glance."
}