{
  "entity_type": "Organism",
  "camouflage_presence": "Camouflage",
  "object_category": "Fish",
  "object_name": "Pipefish",
  "background_description": "The background is an intricate underwater environment consisting of various marine growths such as corals, sponges, algae, and rubble. It presents a heterogeneous mix of colors including dull whites, light browns, rusty oranges, dark greens, and shadowed crevices. The overall texture is rough, irregular, and highly varied, with small fragments of shells or coral interspersed with denser organic matter.",
  "color_similarity": "high",
  "texture_similarity": "medium",
  "contrast_difference": "low",
  "camouflage_score": 0.88,
  "confidence": 0.95,
  "camouflage_type": "Mimicry",
  "explanation": "The Pipefish exhibits excellent camouflage in this image. Its elongated, slender body, combined with a mottled brownish-beige coloration and subtle darker bands, allows it to blend seamlessly with the complex background of coral rubble, algae, and detritus. The pipefish's colors closely match the varied hues of the substrate, resulting in high color similarity. While its texture isn't identical to every background element, its irregular body shape and segmented appearance contribute to a medium texture similarity with the rough and varied environment. Critically, the overall contrast difference between the pipefish and its surroundings is very low, making its outline difficult to discern. The pipefish's form and color effectively mimic a piece of marine detritus or a small branch, a classic example of mimicry, which makes it incredibly hard for predators to spot."
}