{
  "entity_type": "Organism",
  "camouflage_presence": "Camouflage",
  "object_category": "Insect",
  "object_name": "Bug",
  "background_description": "The background consists primarily of vibrant green plant foliage, featuring a central thick green stem and several broad leaves. The leaves display intricate networks of lighter green veins. The main stem has a slightly textured, possibly hairy surface. Parts of the background are blurred, showing lighter green and yellowish elements further away.",
  "color_similarity": "medium",
  "texture_similarity": "low",
  "contrast_difference": "medium",
  "camouflage_score": 0.65,
  "confidence": 0.9,
  "camouflage_type": "Color blending",
  "explanation": "The Bug exhibits moderate camouflage through color blending. Its body is primarily a pale, muted greenish-brown, which somewhat matches the general green hue of the surrounding plant. This allows it to blend with the overall color scheme of the foliage, making it less conspicuous at first glance. However, its specific shade of green is less vibrant and slightly lighter than the immediate stem and leaves, creating a noticeable difference in lightness and saturation. The texture of the bug's body (relatively smooth) also differs from the prominent veins of the leaves and the possibly hairy texture of the stem, preventing perfect blending. The contrast is medium, as its form and slightly different color and texture make it discernible upon closer inspection, but it's not starkly outlined against the background."
}