{
  "entity_type": "Organism",
  "camouflage_presence": "Camouflage",
  "object_category": "Invertebrate",
  "object_name": "Worm",
  "background_description": "The background consists of a dense cluster of small, varied floral elements. These include white to off-white petals, light green sepals, and numerous dried or wilting reddish-brown and orange stamens or petals. The overall impression is complex and textured, with a blurred, solid brownish background further behind.",
  "color_similarity": "high",
  "texture_similarity": "high",
  "contrast_difference": "low",
  "camouflage_score": 0.85,
  "confidence": 0.95,
  "camouflage_type": "Color blending",
  "explanation": "The organism, identified as a Worm, exhibits strong camouflage within the floral cluster. Its light brownish-orange body, with hints of pink, closely matches the color of the dried and wilting reddish-brown and orange floral elements, as well as the slightly yellowed white petals. The worm's rough, textured body surface also mimics the varied and somewhat fragmented textures of the flower parts, especially the dried stamens and petals. This high color and texture similarity results in a low contrast difference between the organism and its immediate environment, making it difficult to discern and effectively blending it into the background. The pink elements on the worm also match small pink parts within the flowers, further enhancing the camouflage through color blending."
}