{
  "entity_type": "Organism",
  "camouflage_presence": "Camouflage",
  "object_category": "Insect",
  "object_name": "StickInsect",
  "background_description": "The background consists of a dark, densely textured surface, likely a tree trunk or a cluster of thick vines, heavily covered in what appears to be wet moss, lichen, and other epiphytes. Numerous smaller, intertwining branches and root-like structures emerge from this main mass. The overall environment is very dark, with deep shadows and muted, desaturated greenish-brown tones, giving it a moist, forest-like appearance.",
  "color_similarity": "high",
  "texture_similarity": "high",
  "contrast_difference": "low",
  "camouflage_score": "0.9",
  "confidence": "0.95",
  "camouflage_type": "Mimicry",
  "explanation": "The StickInsect in this image is exceptionally well camouflaged. Its elongated body perfectly mimics the shape and irregular texture of the surrounding moss-covered branches and vines. The organism's color is a dull greenish-brown, which blends seamlessly with the dark, wet, and mossy environment. There is very low contrast between the insect and its immediate background, making it incredibly difficult to distinguish. The gnarled appearance of its body and legs, along with the very low light conditions, enhance its ability to disappear within the complex network of natural textures. This is a clear case of mimicry, where the organism's form, color, and texture are evolved to resemble a non-living part of its environment."
}