{
  "entity_type": "Organism",
  "camouflage_presence": "Camouflage",
  "object_category": "Fish",
  "object_name": "ScorpionFish",
  "background_description": "The background consists of a vibrant and complex coral reef ecosystem. It features various types of corals, including branching corals (yellowish and white), massive and encrusting corals (reddish, brown, purple, and white), and rocky substrate. The textures are highly irregular, lumpy, spiky, and mottled, creating a diverse and visually busy environment. There are also smaller orange fish visible in the right background.",
  "color_similarity": "high",
  "texture_similarity": "high",
  "contrast_difference": "low",
  "camouflage_score": 0.9,
  "confidence": 1.0,
  "camouflage_type": "Color blending / Pattern matching / Shape disruption",
  "explanation": "The ScorpionFish exhibits exceptional camouflage within this complex coral reef environment. Its body coloration, a mottled mix of reddish-browns, whites, and darker patches, perfectly matches the varying hues of the surrounding corals and rocks. The fish's skin is highly textured, covered with numerous bumps, warts, and projections, which mimic the irregular, spiky, and lumpy surfaces of the hard corals and encrusting organisms. Furthermore, its irregular shape and the presence of fin extensions and dermal flaps disrupt its outline, making it incredibly difficult to distinguish from the background structures. The overall contrast difference between the fish and its immediate surroundings is very low, allowing it to blend seamlessly into the visual noise of the reef. It takes careful observation to even spot the fish, indicating highly effective camouflage."
}