{
  "entity_type": "Organism",
  "camouflage_presence": "Camouflage",
  "object_category": "Insect",
  "object_name": "Katydid",
  "background_description": "The background consists of vibrant green leaves with visible veins, some stems showing reddish tints, and a blurred, warm-toned (reddish-brown) area in the distant background, possibly a wall or dry foliage. The lighting is bright and casts distinct shadows on the leaves.",
  "color_similarity": "high",
  "texture_similarity": "high",
  "contrast_difference": "low",
  "camouflage_score": 0.88,
  "confidence": 0.95,
  "camouflage_type": "Mimicry",
  "explanation": "The Katydid exhibits excellent camouflage, primarily through mimicry and color blending. Its entire body is a vibrant green, almost perfectly matching the hue and saturation of the surrounding leaves. This high degree of color similarity makes it incredibly difficult to distinguish from the foliage. Furthermore, its elongated body shape and the texture of its wings subtly resemble the structure and surface of the leaves, enhancing its concealment. The low contrast between the organism and its environment, coupled with its natural coloration and form, allows it to blend seamlessly into its leafy habitat, making it challenging for predators to spot."
}