{
  "entity_type": "Organism",
  "camouflage_presence": "No Camouflage",
  "object_category": "Insect",
  "object_name": "Katydid",
  "background_description": "The background consists primarily of two large, vibrant pink lily flowers, generously covered in clear water droplets, suggesting a recent rain or dew. The petals are a rich pink with darker reddish-pink spots towards the center. Surrounding and partially behind the flowers is dense, lush green foliage of various textures, including broader leaves and finer, feathery greenery.",
  "color_similarity": "low",
  "texture_similarity": "low",
  "contrast_difference": "high",
  "camouflage_score": 0.2,
  "confidence": 0.9,
  "camouflage_type": "None",
  "explanation": "The Katydid, being a bright green insect, is positioned on a vibrant pink lily petal. This creates a strong color contrast between the green organism and its immediate pink background, making it highly conspicuous. While Katydids often rely on color blending (their green coloration) to camouflage among green foliage, its current placement on a distinctively colored flower negates this natural camouflage. Furthermore, the smooth texture of the Katydid contrasts with the water droplet-covered, textured surface of the lily petal, further preventing it from blending in. Therefore, in this specific image, the Katydid does not blend with its environment."
}