{
  "entity_type": "Organism",
  "camouflage_presence": "Camouflage",
  "object_category": "Fish",
  "object_name": "FrogFish",
  "background_description": "The background consists of a vibrant coral reef, primarily composed of various stony coral formations. These corals display lumpy, undulating, and porous textures, with colors ranging from pale yellowish-beige and light brown to off-white, interspersed with some darker patches and reddish marine growth. The upper portion of the image shows clear blue ocean water with sunlight dappling on the surface.",
  "color_similarity": "high",
  "texture_similarity": "high",
  "contrast_difference": "low",
  "camouflage_score": 0.95,
  "confidence": 1.0,
  "camouflage_type": "Mimicry",
  "explanation": "The FrogFish exhibits exceptional camouflage by perfectly blending with the surrounding coral reef environment. Its body color, a pale yellowish-beige, almost identically matches the dominant hues of the stony corals around it. Furthermore, its skin possesses a highly irregular, lumpy, and textured surface that mimics the porous and convoluted forms of the adjacent corals. The overall shape of the FrogFish is disrupted, making its outline extremely difficult to distinguish from the natural contours of the reef. This combination of color matching, texture similarity, and shape mimicry effectively conceals the FrogFish, making it nearly indistinguishable from the coral, which is a prime example of mimicry."
}