{
  "entity_type": "Organism",
  "camouflage_presence": "Camouflage",
  "object_category": "Insect",
  "object_name": "StickInsect",
  "background_description": "The background consists of a large, vibrant green leaf with prominent parallel veins and a finely textured surface. There are areas of slight damage on the leaf edges, revealing a dark, out-of-focus background. Patches of white, wispy fibrous material (possibly mold, spider silk, or detritus) are also present on the leaf surface, particularly on the right side.",
  "color_similarity": "medium",
  "texture_similarity": "low",
  "contrast_difference": "medium",
  "camouflage_score": 0.7,
  "confidence": 0.9,
  "camouflage_type": "Mimicry",
  "explanation": "The StickInsect exhibits strong camouflage primarily through mimicry. Its elongated, slender body and thin legs are perfectly adapted to resemble a twig, stem, or a prominent vein on the leaf. Although its yellowish-green coloration is brighter and slightly more yellow than the darker green of the leaf, there is still a shared general hue that aids in color blending. The insect's placement along a leaf vein further enhances its ability to blend in by mimicking the plant's structure. While the color match isn't absolutely perfect in this specific lighting against this particular leaf, its form and posture are highly effective in disrupting its outline and making it appear as a natural part of the foliage."
}