{
  "entity_type": "Organism",
  "camouflage_presence": "Camouflage",
  "object_category": "Bird",
  "object_name": "Bittern",
  "background_description": "The background consists of a dense wall of dry, golden-brown and light beige reed stalks, standing vertically. In the lower foreground, there is shallow water reflecting the muted tones of the reeds and sky, with submerged and floating pieces of dead, broken vegetation and reed stumps. The overall environment is a typical reed bed habitat, characterized by vertical lines and a palette of earthy browns, tans, and creams.",
  "color_similarity": "high",
  "texture_similarity": "high",
  "contrast_difference": "low",
  "camouflage_score": 0.9,
  "confidence": 1.0,
  "camouflage_type": "Color blending / Pattern matching",
  "explanation": "The Bittern demonstrates exceptional camouflage in this image. Its plumage is a complex mosaic of vertical dark brown streaks, mottled patterns, and lighter beige-cream tones. This coloration and pattern highly resemble the dry, vertical reed stalks and the broken vegetation in the background. The bird's feathers mimic the linear, broken textures of the reeds, creating a high degree of texture similarity. The overall color palette of the Bittern perfectly blends with the earthy browns, tans, and creams of its reed bed environment, resulting in high color similarity. Furthermore, the contrast between the bird's patterned body and the surrounding reeds is very low, making its outline indistinct and difficult to perceive. The combination of color blending and pattern matching allows the Bittern to effectively disappear into its habitat, making it an excellent example of natural camouflage."
}