{
  "entity_type": "Organism",
  "camouflage_presence": "Camouflage",
  "object_category": "Fish",
  "object_name": "Pipefish",
  "background_description": "The background consists of a large, dark, textured piece of driftwood or log on the right side, extending downwards from the top. To the left and below, there are lighter, grey-greenish rocks with various marine growths, including some reddish and orange invertebrates (possibly anemones or sponges). The water in the background appears dark, creating a dim, natural aquatic environment with varied textures and muted colors.",
  "color_similarity": "high",
  "texture_similarity": "medium",
  "contrast_difference": "low",
  "camouflage_score": 0.75,
  "confidence": 0.9,
  "camouflage_type": "Shape disruption",
  "explanation": "The Pipefish exhibits effective camouflage primarily through its elongated, slender body shape, which allows it to blend seamlessly with the linear elements of the environment such as twigs, plant stems, or crevices in the driftwood. This 'shape disruption' makes it difficult to discern its outline as a fish. Additionally, its muted brownish-yellow coloration, with subtle darker patterns, provides 'color blending' that matches the earthy tones of the surrounding driftwood and rocks. The overall low contrast difference between the organism and its diverse background further aids in its concealment, making it visually indistinct despite the varying textures of the environment."
}