{
  "entity_type": "Organism",
  "camouflage_presence": "Camouflage",
  "object_category": "Insect",
  "object_name": "Butterfly",
  "background_description": "The background consists of a ground covered densely with various types of organic debris, including dry, weathered wood chips, small pieces of bark, dried leaves, and twigs. The textures are rough and irregular, and the colors are predominantly muted shades of brown, gray, and dull tan.",
  "color_similarity": "high",
  "texture_similarity": "high",
  "contrast_difference": "low",
  "camouflage_score": 0.9,
  "confidence": 0.95,
  "camouflage_type": "Pattern matching",
  "explanation": "The two butterflies in the image exhibit excellent camouflage against the ground debris. Their closed wings display colors (shades of brown, gray, and tan) that almost perfectly match the dry leaves, wood chips, and bark fragments in the background. Furthermore, the intricate patterns on their wings, such as the vein-like structures on the upper butterfly and the wavy lines and small ocelli on the lower one, highly resemble the textures, cracks, and irregularities found in the surrounding organic matter. The overall shape of the closed wings also subtly mimics fallen leaves or bark pieces, further enhancing their concealment. This combination of color blending, detailed pattern matching, and shape mimicry makes them very difficult to distinguish from their environment."
}