{
  "entity_type": "Organism",
  "camouflage_presence": "Camouflage",
  "object_category": "Bird",
  "object_name": "Sparrow",
  "background_description": "The bird is perched on an old, weathered wooden fence post with visible grain patterns and some cracks. The background behind the fence is a soft, out-of-focus blend of light green and beige, with blurry darker green foliage suggesting distant trees or bushes.",
  "color_similarity": "medium",
  "texture_similarity": "low",
  "contrast_difference": "medium",
  "camouflage_score": 0.55,
  "confidence": 0.95,
  "camouflage_type": "Color blending",
  "explanation": "The sparrow's natural plumage, consisting of various shades of brown and grey, offers a medium level of color blending with the weathered wooden fence post it is perched upon. While the bird's feathery texture is distinct from the rough wood grain (low texture similarity), and its overall form creates a moderate contrast against the lighter, blurry background, its earthy tones are typical of birds that use cryptic coloration to blend into their environment. The camouflage is present as an inherent characteristic for blending into common surroundings like branches, dirt, or wooden structures, even if the bird is clearly visible due to its pose and sharp focus in this particular shot."
}