{
  "entity_type": "Organism",
  "camouflage_presence": "Camouflage",
  "object_category": "Insect",
  "object_name": "Caterpillar",
  "background_description": "The background consists of vibrant green plant foliage, with a prominent, vertically oriented plant stem in the foreground. The stem is finely ribbed and covered with small, light-colored hairs or spines. Various smaller green leaves with serrated or divided edges branch out from this main stem, some in sharp focus, others slightly blurred, creating a lush, verdant environment. The deeper background is a soft, out-of-focus blur of green.",
  "color_similarity": "high",
  "texture_similarity": "high",
  "contrast_difference": "low",
  "camouflage_score": "0.9",
  "confidence": "1.0",
  "camouflage_type": "Mimicry",
  "explanation": "The caterpillar exhibits excellent camouflage by closely mimicking its plant environment. Its body is a similar shade of light to medium green as the surrounding stems and leaves, demonstrating high color similarity. The caterpillar's elongated, angular shape, along with the longitudinal ridges and varying shades on its body, perfectly imitates a developing plant shoot or a rolled leaf. This structural and textural resemblance (high texture similarity) to parts of the plant, combined with low contrast against the background, makes it extremely difficult to distinguish from the surrounding foliage. Its position tightly along a main stem further enhances the mimicry, making it appear as an integral part of the plant rather than a separate organism."
}