{
  "entity_type": "Organism",
  "camouflage_presence": "Camouflage",
  "object_category": "Fish",
  "object_name": "GhostPipefish",
  "background_description": "The background consists of a vibrant and highly textured coral reef environment. Dominant colors are various shades of red, orange, and brown, indicating different types of hard and soft corals, possibly encrusting sponges, and areas of detritus. There are also distinct branching structures of a lighter blue-white coloration, likely another species of coral or gorgonian, present in the lower and upper left portions of the image. The overall texture is complex, irregular, and diverse, with many nooks, crannies, and rough surfaces.",
  "color_similarity": "high",
  "texture_similarity": "high",
  "contrast_difference": "low",
  "camouflage_score": "0.9",
  "confidence": "1.0",
  "camouflage_type": "Mimicry",
  "explanation": "The GhostPipefish in this image exhibits exceptional camouflage. Its body is adorned with numerous frilly, branching appendages that perfectly mimic the texture and irregular forms of the surrounding corals and marine debris, effectively breaking up its distinct fish outline. The coloration, a mottled pattern of creams, whites, and various shades of brown and orange, closely matches the diverse palette of the coral reef background. This combination of color blending, pattern matching, and structural mimicry allows the GhostPipefish to seamlessly integrate with its environment, making it incredibly difficult to distinguish from the non-living elements of the reef. The overall low contrast difference between the organism and its surroundings further enhances its concealment."
}