{
  "entity_type": "Organism",
  "camouflage_presence": "Camouflage",
  "object_category": "Fish",
  "object_name": "GhostPipefish",
  "background_description": "The background consists of a sandy or rocky seabed, densely covered with a mix of small pebbles, coarse sand, detritus, and possibly some small algal or sessile invertebrate growth. The colors are muted and varied, featuring greens, grays, browns, whites, and occasional reddish tones, creating a mottled and textured surface.",
  "color_similarity": "high",
  "texture_similarity": "high",
  "contrast_difference": "low",
  "camouflage_score": 0.9,
  "confidence": 1.0,
  "camouflage_type": "Mimicry",
  "explanation": "The GhostPipefish demonstrates excellent camouflage by mimicking its environment. Its body features an intricate pattern of mottled browns, greens, and whites that closely match the varied colors of the detritus-covered seabed. The most striking aspect is its highly irregular, frilly, and spiky body shape, which perfectly mimics small pieces of debris, algae, or sessile organisms found on the ocean floor. This 'shape disruption' makes its outline indistinguishable from the background clutter, effectively breaking up its form and preventing it from being recognized as a distinct animal. The low contrast difference further aids in its concealment, making it incredibly difficult to spot against the busy and textured background."
}