{
  "entity_type": "Organism",
  "camouflage_presence": "Camouflage",
  "object_category": "Fish",
  "object_name": "GhostPipefish",
  "background_description": "The background consists primarily of dense, reddish-brown macroalgae or coral, characterized by a complex, highly branched, and frilly structure. This environment is further textured by a fine layer of yellowish-brown sediment or epiphytic growth, creating a mottled appearance. The deeper background shows blurred areas of green and teal, indicating an underwater setting.",
  "color_similarity": "medium",
  "texture_similarity": "high",
  "contrast_difference": "medium",
  "camouflage_score": 0.85,
  "confidence": 1.0,
  "camouflage_type": "Mimicry / Shape disruption",
  "explanation": "The GhostPipefish displays highly effective camouflage in this image, primarily through structural mimicry and shape disruption. Its body is adorned with numerous spiky, frilly, and feathery appendages that meticulously mimic the intricate, branched, and irregular textures of the surrounding reddish-brown macroalgae or coral. Although certain bright white areas on the fish create a moderate contrast against the darker background, the intricate reddish-brown patterns scattered across its body help to blend with the environment's base color and the yellowish sediment. The highly disruptive outline created by its ornate protrusions effectively breaks up its form, making it exceptionally difficult to distinguish the organism's true shape from the visual clutter of its habitat."
}