{
  "entity_type": "Organism",
  "camouflage_presence": "Camouflage",
  "object_category": "Fish",
  "object_name": "Pipefish",
  "background_description": "The background consists of a complex underwater reef environment. A large, textured hard coral formation with a bumpy surface in muted shades of brown, green, and blue-grey dominates the upper and mid-background. In the foreground and midground, there are several vibrant green, spherical or lobed sponge-like organisms (likely algae such as Valonia) with a distinctly granular texture. Surrounding these green elements are various other coral or rock formations displaying a range of colors including purple, white, dark brown, and hints of yellow and orange. The overall environment is cluttered, diverse, and rich in varying textures and patterns.",
  "color_similarity": "high",
  "texture_similarity": "high",
  "contrast_difference": "low",
  "camouflage_score": 0.85,
  "confidence": 0.9,
  "camouflage_type": "Pattern matching",
  "explanation": "The pipefish demonstrates strong camouflage in this image primarily through pattern matching and color blending. Its elongated body is covered in a disruptive pattern of mottled brown, white, reddish-brown, and subtle yellow/orange speckles and bands. These colors and patterns closely mimic the varied hues and intricate textures of the surrounding coral, rock, and algal structures, particularly the granular green sponges and the bumpy hard coral. The disruptive coloration effectively breaks up the pipefish's outline, preventing it from forming a distinct silhouette against the cluttered background. This combination of high color and texture similarity, along with low contrast difference, makes the pipefish blend remarkably well into its complex reef habitat, making it difficult for a predator to spot."
}