{
  "entity_type": "Organism",
  "camouflage_presence": "Camouflage",
  "object_category": "Insect",
  "object_name": "StickInsect",
  "background_description": "The background consists of several slender, dry plant stems or stalks, some featuring elongated, fuzzy or textured seed pods. The dominant colors of the plant material are light brown, tan, and faded greenish-yellow. The distant background is heavily blurred, displaying muted tones of green, brown, and grey, suggesting a natural, vegetated environment.",
  "color_similarity": "high",
  "texture_similarity": "high",
  "contrast_difference": "low",
  "camouflage_score": "0.9",
  "confidence": "1.0",
  "camouflage_type": "Mimicry",
  "explanation": "The StickInsect demonstrates exceptional camouflage by perfectly mimicking the form, color, and texture of the dry plant stems it is clinging to. Its elongated, slender body and thin, angular legs are almost indistinguishable from the surrounding twigs and stalks. The insect's pale yellowish-green and light brown coloration blends seamlessly with the faded tones of the dry vegetation, including subtle green stripes on its body that match underlying hues of the plant. This combination of mimicry (specifically Batesian mimicry of a twig), color blending, and shape disruption effectively hides the organism from predators by breaking up its outline and making it appear as a natural part of its environment."
}