{
  "entity_type": "Organism",
  "camouflage_presence": "Camouflage",
  "object_category": "Fish",
  "object_name": "ScorpionFish",
  "background_description": "The background is an underwater environment, likely a reef or rocky seafloor, densely covered with various types of marine algae and textured substrate. The dominant colors are shades of greenish-blue (teal), with areas of darker green and brown, indicating different types of vegetation and shadowed crevices. The textures are highly irregular, featuring frilly, clumpy, and bumpy structures of seaweed and algal growth.",
  "color_similarity": "high",
  "texture_similarity": "high",
  "contrast_difference": "low",
  "camouflage_score": "0.95",
  "confidence": "1.0",
  "camouflage_type": "Color blending / Pattern matching / Shape disruption",
  "explanation": "The ScorpionFish is exceptionally well camouflaged in this image. Its body color, a mottled greenish-teal, is a near-perfect match for the dominant hues of the surrounding marine algae and substrate. The fish's most striking camouflage feature is its highly irregular and textured surface, which is covered in numerous dermal flaps, tubercles, and protrusions. These features meticulously mimic the frilly, clumpy, and uneven textures of the surrounding seaweed and algal growths, making it incredibly difficult to distinguish the fish from the environment. The fish's natural body shape is also disrupted by these elaborate structures, effectively breaking up its outline and preventing it from being recognized as a distinct organism. The overall contrast between the fish and its immediate surroundings is very low, further enhancing its concealment. Only its slightly lighter mouth area provides a subtle hint of its presence upon very close inspection."
}