{
  "entity_type": "Organism",
  "camouflage_presence": "Camouflage",
  "object_category": "Fish",
  "object_name": "Pipefish",
  "background_description": "The background depicts a shallow marine or brackish water environment. It consists primarily of a sandy or silty bottom with a brownish-tan hue, extensively covered by fine, filamentous green and brown algae, as well as blades of green seagrass or aquatic plants. Scattered dark detritus and possibly shells or stones are also present. The overall texture is a rich mosaic of granular, wispy, and linear elements.",
  "color_similarity": "high",
  "texture_similarity": "high",
  "contrast_difference": "low",
  "camouflage_score": "0.9",
  "confidence": "0.95",
  "camouflage_type": "Mimicry",
  "explanation": "The Pipefish exhibits excellent camouflage through mimicry. Its elongated, slender body closely mimics the linear forms of the surrounding seagrass blades, aquatic plants, and submerged detritus or twigs. The reddish-brown coloration of the fish, with its pattern of small white spots, provides highly effective color and pattern blending with the sandy/silty bottom, the brownish algal growth, and the mottled textures of the underwater environment. The overall low contrast difference between the fish and its surroundings, combined with its shape and color matching, makes it very difficult to distinguish from the natural background elements."
}