{
  "entity_type": "Organism",
  "camouflage_presence": "Camouflage",
  "object_category": "Fish",
  "object_name": "Pipefish",
  "background_description": "The background consists of a complex underwater environment, likely a coral reef or rocky substrate, densely covered with various marine growths such as encrusting corals, sponges, and algae. It exhibits a mottled appearance with irregular patches of muted greens, olive yellows, reddish-browns, and some subtle purplish and whitish areas. The texture is rough and varied, with crevices and uneven surfaces, creating a highly textured and non-uniform backdrop.",
  "color_similarity": "high",
  "texture_similarity": "high",
  "contrast_difference": "low",
  "camouflage_score": 0.88,
  "confidence": 1.0,
  "camouflage_type": "Color blending / Pattern matching / Shape disruption",
  "explanation": "The Pipefish exhibits excellent camouflage in this image. Its body coloration, featuring irregular patches of reddish-brown and pale yellow/white, perfectly matches the dominant hues of the surrounding marine substrate, which includes encrusting corals, sponges, and algae. Furthermore, the mottled, broken pattern on its elongated body effectively mimics the varied and irregular textures and patterns of the background, helping to disrupt its overall shape. This combination of color blending and pattern matching results in a low contrast difference between the organism and its environment, making it very difficult to distinguish from the complex underwater backdrop."
}