{
  "entity_type": "Organism",
  "camouflage_presence": "Camouflage",
  "object_category": "Fish",
  "object_name": "Pipefish",
  "background_description": "The background consists of a vibrant and diverse underwater environment. Dominant elements include large, undulating fronds of green and deep reddish-brown seaweed, along with finer, frilly, reddish-brown algae. There are also visible patches of rocky or sandy substrate speckled with smaller detritus and organisms, all immersed in murky, sun-dappled water.",
  "color_similarity": "medium",
  "texture_similarity": "high",
  "contrast_difference": "low",
  "camouflage_score": 0.78,
  "confidence": 0.95,
  "camouflage_type": "Pattern matching",
  "explanation": "The Pipefish exhibits effective camouflage by blending remarkably well with its marine environment. Its elongated, slender body shape allows it to mimic the linear forms of various seaweeds and detritus. The fish's coloration, a brownish-beige with subtle darker stripes and speckles, provides medium color similarity to the duller brown and reddish-brown algae and parts of the rocky substrate. The most significant aspect of its camouflage is its texture and pattern matching; the fine linear patterns along its body disrupt its outline and allow it to seamlessly integrate with the intricate textures of the feathery algae and the linear structures present in the seaweed backdrop. The low contrast difference between the fish and its immediate surroundings, particularly against the darker red seaweed and textured algae, further enhances its ability to remain inconspicuous to predators or prey. Overall, the combination of its cryptic shape, coloration, and disruptive patterning makes it difficult to discern amidst the complex underwater flora."
}