{
  "entity_type": "Organism",
  "camouflage_presence": "Camouflage",
  "object_category": "Insect",
  "object_name": "Katydid",
  "background_description": "The organism is resting on a weathered, dark brown log extensively covered in patches of vibrant green moss. The background behind the log is a dense, dark green forest with blurred foliage, indicating a natural, humid environment with dappled light.",
  "color_similarity": "high",
  "texture_similarity": "high",
  "contrast_difference": "low",
  "camouflage_score": 0.9,
  "confidence": 1.0,
  "camouflage_type": "Mimicry",
  "explanation": "The Katydid exhibits outstanding camouflage, blending almost perfectly with the moss-covered log. Its body features a mottled coloration of browns, reddish-browns (especially on the head), and olive-greens on its back and legs. These colors closely match both the exposed bark of the log and the bright green moss growing on it. Furthermore, the insect's exoskeleton possesses a remarkably irregular, spiky, and rough texture that expertly mimics the natural texture of decaying wood and the organic growth of moss. The angular and fragmented shape of its body, enhanced by these protrusions, effectively disrupts its outline, preventing it from standing out as a distinct form. This combination of color blending, texture matching, and shape disruption creates a highly effective form of mimicry, making it appear as an integral part of its environment rather than a living creature."
}