{
  "entity_type": "Organism",
  "camouflage_presence": "Camouflage",
  "object_category": "Fish",
  "object_name": "ScorpionFish",
  "background_description": "The background consists of an underwater sandy seabed with numerous scattered rocks, coral rubble, and larger coral formations. The sand is light brown to tan, while the rocks and corals exhibit various shades of brown, red, orange, and white, often covered with algae or detritus. The water column above is a clear turquoise-blue, with sunlight penetrating from the surface, creating visible light rays.",
  "color_similarity": "high",
  "texture_similarity": "high",
  "contrast_difference": "low",
  "camouflage_score": "0.9",
  "confidence": "1.0",
  "camouflage_type": "Color blending / Pattern matching / Shape disruption",
  "explanation": "The ScorpionFish exhibits excellent camouflage in this image. Its mottled skin, featuring a complex pattern of reddish-browns, oranges, creams, and dark speckles, almost perfectly matches the irregular colors and patterns of the surrounding coral rubble, rocks, and sandy patches. The fish's rough, warty texture mimics the texture of the encrusted rocks and corals, making it difficult to distinguish from its environment. Furthermore, its highly irregular body shape and fins break up its outline, preventing it from standing out as a distinct organism. The overall contrast difference between the fish and its immediate background is very low, making it visually blend seamlessly into the seafloor debris."
}