{
  "entity_type": "Organism",
  "camouflage_presence": "Camouflage",
  "object_category": "Arachnid",
  "object_name": "Spider",
  "background_description": "The background consists of a dense cluster of small, delicate flowers. These flowers are predominantly a creamy white to pale pink, with distinct reddish or pink centers and fine, hair-like stamens. The overall texture is soft and floral. Behind the immediate flower cluster, the background is softly blurred, showing muted tones of olive green and brown, likely indicating foliage or distant elements.",
  "color_similarity": "high",
  "texture_similarity": "medium",
  "contrast_difference": "low",
  "camouflage_score": "0.9",
  "confidence": "1.0",
  "camouflage_type": "Color blending",
  "explanation": "The spider exhibits exceptional camouflage by perfectly matching the color and general texture of the flowers it resides upon. Its body is a pale, creamy white with hints of pinkish-brown, which almost identically matches the petals and their reddish centers. The spider's shape, particularly its legs, are tucked in a way that disrupts its typical arachnid outline, making it appear as an irregular part of the flower cluster rather than a distinct organism. This combination of color matching and shape disruption makes it extremely difficult to discern the spider from its floral environment, providing highly effective camouflage."
}