{
  "entity_type": "Organism",
  "camouflage_presence": "Camouflage",
  "object_category": "Insect",
  "object_name": "Grasshopper",
  "background_description": "The background consists of the deeply furrowed and textured bark of a tree. The bark displays a complex pattern of colors, including light grey, white, patches of moss or lichen in varying shades of green, and areas of reddish-brown and darker brown, indicating natural variations and possibly age or moisture.",
  "color_similarity": "high",
  "texture_similarity": "high",
  "contrast_difference": "low",
  "camouflage_score": 0.95,
  "confidence": 1.0,
  "camouflage_type": "Color blending / Pattern matching / Shape disruption",
  "explanation": "The grasshopper exhibits an exceptional level of camouflage. Its body is intricately colored with a mottled pattern of greens, grays, and browns that precisely match the lichen, moss, and varied tones present on the tree bark. Furthermore, the insect's rough, ridged, and irregular body texture perfectly mimics the coarse, furrowed surface of the bark, making it appear as an organic part of the tree itself rather than a separate organism. The overall shape of the grasshopper, with its angular legs and textured body, strongly contributes to shape disruption, breaking up its outline and preventing it from standing out. The contrast between the insect and its environment is remarkably low, making it extremely difficult to detect at first glance, demonstrating highly effective color blending and pattern matching."
}