{
  "entity_type": "Organism",
  "camouflage_presence": "Camouflage",
  "object_category": "Fish",
  "object_name": "GhostPipefish",
  "background_description": "The background consists primarily of a dark, feathery crinoid (likely a feather star) with numerous branching fronds, against a lighter, sandy seafloor dotted with small debris and particles. Shadows are cast by the crinoid onto the sand, creating areas of varying light and darkness.",
  "color_similarity": "high",
  "texture_similarity": "high",
  "contrast_difference": "low",
  "camouflage_score": 0.9,
  "confidence": 0.98,
  "camouflage_type": "Mimicry",
  "explanation": "The GhostPipefish exhibits exceptional camouflage through mimicry, blending seamlessly with the dark, feathery crinoid it is positioned next to. Its elongated body, covered in frilly, spiky protrusions and intricate patterns, precisely matches the texture and complex branching structure of the crinoid's arms and pinnules. The dark reddish-brown base color with lighter, almost white, stripes on the fish harmonizes effectively with the dark tones and subtle variations of the crinoid, as well as the shadowy areas. The fish's vertical posture further enhances its resemblance to a natural part of the invertebrate, making it extremely difficult to distinguish from its environment due to high texture and shape similarity, and low contrast with its immediate surroundings."
}