{
  "entity_type": "Organism",
  "camouflage_presence": "Camouflage",
  "object_category": "Mammal",
  "object_name": "Sciuridae",
  "background_description": "The background consists of a dense layer of fallen, dry autumn leaves, primarily oak leaves, in various shades of brown, reddish-brown, and golden-brown. There are distinct patterns of light and shadow cast across the leaves, creating a varied and textured surface.",
  "color_similarity": "high",
  "texture_similarity": "medium",
  "contrast_difference": "low",
  "camouflage_score": 0.85,
  "confidence": 0.95,
  "camouflage_type": "Shape disruption",
  "explanation": "The Sciuridae exhibits excellent camouflage in this image. Its fur coloration, predominantly reddish-brown and golden-brown, closely matches the dry, fallen leaves, resulting in high color similarity and low overall contrast with its environment. Furthermore, the organism is partially hidden among the leaves, with its body shape disrupted and broken up by the surrounding foliage. This 'shape disruption' combined with 'color blending' makes it very difficult to spot at first glance. While its dark eye provides a small point of contrast, the overall effect is that the Sciuridae blends seamlessly with the leaf litter, making it highly camouflaged."
}