{
  "entity_type": "Organism",
  "camouflage_presence": "Camouflage",
  "object_category": "Mammal",
  "object_name": "Fallow Deer",
  "background_description": "A vibrant, uniformly bright green grassy field, heavily blurred due to a shallow depth of field. There are minimal textural details, with only a few faint, out-of-focus wisps of dried grass visible in the foreground.",
  "color_similarity": "low",
  "texture_similarity": "low",
  "contrast_difference": "medium",
  "camouflage_score": 0.4,
  "confidence": 0.95,
  "camouflage_type": "Disruptive pattern",
  "explanation": "The Fallow Deer exhibits natural camouflage through its light brown to reddish-brown fur with distinctive white spots, especially on its flanks (partially visible). This spotted pattern serves as a disruptive pattern, designed to break up the animal's outline and mimic dappled sunlight or shadows in its natural woodland and grassland habitats. While the deer inherently possesses these camouflage features, in this specific image, the background is a uniformly bright green grassy field. The deer's colors and patterns offer low color and texture similarity to this immediate backdrop, causing it to stand out with a medium contrast. Therefore, its natural camouflage is present but less effective for concealment in this particular scene compared to a more varied or forested environment."
}