{
  "entity_type": "Organism",
  "camouflage_presence": "Camouflage",
  "object_category": "Amphibian",
  "object_name": "Toad",
  "background_description": "The background consists of dry, granular soil mixed with various small pebbles and rocks. The colors are predominantly earthy tones, including shades of brown, gray, beige, black, and some reddish-orange. The texture is rough, uneven, and highly varied due to the different sizes and shapes of the gravel.",
  "color_similarity": "high",
  "texture_similarity": "high",
  "contrast_difference": "low",
  "camouflage_score": 0.9,
  "confidence": 0.98,
  "camouflage_type": "Disruptive pattern",
  "explanation": "The toad exhibits excellent camouflage through a combination of color blending and disruptive patterning. Its skin coloration, a mottled mix of greens, browns, grays, and black spots with orange accents, very closely matches the diverse colors of the surrounding soil and small rocks. The bumpy, warty texture of its skin further enhances its blend with the rough, granular surface of the ground. The irregular blotches and stripes on its back serve as a disruptive pattern, breaking up the toad's outline and making it difficult to distinguish from the similarly irregular shapes and shadows cast by the pebbles and dirt. This combination results in a low contrast difference between the organism and its environment, making it very hard for a predator to spot."
}