{
  "entity_type": "Organism",
  "camouflage_presence": "Camouflage",
  "object_category": "Insect",
  "object_name": "Katydid",
  "background_description": "The background consists of a dense forest floor littered with an abundance of dried leaves, twigs, and earthy debris. The dominant colors are various shades of brown, tan, and dark earth tones, creating a highly textured and mottled surface. Some blurry green vegetation is visible in the more distant background, but the immediate surroundings of the Katydid are characterized by dead organic matter.",
  "color_similarity": "high",
  "texture_similarity": "high",
  "contrast_difference": "low",
  "camouflage_score": 0.95,
  "confidence": 1.0,
  "camouflage_type": "Mimicry",
  "explanation": "The Katydid exhibits exceptional camouflage through mimicry. Its entire body, particularly its wings, is shaped and textured to remarkably resemble a dried, curled-up leaf, complete with intricate vein-like patterns. The coloration of the Katydid, consisting of various shades of tan and brown, perfectly matches the surrounding dead leaf litter and earthy tones of the forest floor. This high color and texture similarity, combined with very low contrast against its immediate environment, makes it extremely difficult to distinguish from the background. The long, thin antennae are the only features that slightly break the illusion, but they are also subtle against the woody debris."
}