{
  "entity_type": "Organism",
  "camouflage_presence": "Camouflage",
  "object_category": "Fish",
  "object_name": "Pipefish",
  "background_description": "The background consists of a cluttered underwater environment, likely a coral reef or rocky seafloor, densely covered with various shades of brown, reddish-brown, and green algae, small sponges, and detritus. The texture is rough, irregular, and mottled, with diverse shapes and varying levels of light and shadow.",
  "color_similarity": "high",
  "texture_similarity": "medium",
  "contrast_difference": "low",
  "camouflage_score": "0.75",
  "confidence": "0.95",
  "camouflage_type": "Pattern matching",
  "explanation": "The Pipefish exhibits good camouflage against the complex marine background. Its body is covered in intricate yellowish-brown and dark brown wavy lines and spots, which closely match the variegated colors and irregular textures of the algae-covered rocks and detritus. This pattern helps to break up the pipefish's elongated outline and blend it into the busy, mottled environment. The color similarity is high, as the pipefish's hues are present in the background. While not perfectly identical, the disruptive patterns on its body create a texture similarity that aids in blending with the rough, uneven surfaces. The contrast difference between the pipefish and its surroundings is low, preventing it from standing out sharply, making it difficult for predators to spot. The overall effect is effective pattern matching and color blending."
}