{
  "entity_type": "Organism",
  "camouflage_presence": "Camouflage",
  "object_category": "Mammal",
  "object_name": "Lion",
  "background_description": "The background consists of a light-colored, possibly concrete or stucco, wall with visible texture and vertical striations. Shadows, likely from an overhead structure or fence, are cast across the wall. The foreground ground is covered with dry, light brown hay or sparse dry grass and dirt.",
  "color_similarity": "medium",
  "texture_similarity": "low",
  "contrast_difference": "high",
  "camouflage_score": 0.3,
  "confidence": 0.9,
  "camouflage_type": "Color blending",
  "explanation": "The lion possesses natural camouflage through color blending. Its golden-brown coat is adapted to match the dry grasses and sandy environments of its natural savanna habitat. In this image, the lion's fur color shows a medium similarity to the dry hay/grass on the ground, providing some degree of blending. However, the prominent light-colored concrete wall in the background is not typical of its natural environment, reducing the overall effectiveness of its camouflage. Furthermore, the strong sunlight creates high contrast and sharp outlines, and the lion's large size and distinct action (yawning) make it highly visible, rather than concealed. Therefore, while the inherent camouflage trait is present, its effectiveness in this specific scene is low."
}