{
  "entity_type": "Organism",
  "camouflage_presence": "Camouflage",
  "object_category": "Insect",
  "object_name": "StickInsect",
  "background_description": "The organism is situated on a weathered, rough piece of light brown wood, which appears to be part of a larger fallen branch or log. To the immediate right, a large tree trunk with deeply furrowed, greyish-brown bark is visible. The background consists of out-of-focus dry, sparse green and brown grass with hints of a distant fence post and arid terrain under a bright, diffuse light.",
  "color_similarity": "high",
  "texture_similarity": "high",
  "contrast_difference": "low",
  "camouflage_score": 0.9,
  "confidence": 1.0,
  "camouflage_type": "Mimicry",
  "explanation": "The StickInsect exhibits exceptional camouflage through mimicry. Its elongated, slender body and legs are almost indistinguishable from the dry twigs and weathered wood it is resting upon. Its color is a dull brown/grey, perfectly matching the sun-bleached wood and the general tone of the tree bark and dry grass in the background. The texture of its body also appears rough and segmented, further enhancing its resemblance to a natural piece of wood. The low contrast between the insect and its immediate environment, combined with its mimetic form, makes it incredibly difficult to spot, even upon close inspection, fulfilling the primary goal of camouflage."
}