{
  "entity_type": "Organism",
  "camouflage_presence": "Camouflage",
  "object_category": "Bird",
  "object_name": "Bittern",
  "background_description": "The background is a dense, marshy wetland environment characterized by a multitude of vertical and broken reeds, grasses, and emergent vegetation. The colors are predominantly dry browns, beige, straw-like yellows, dark greens, and blackish tones from submerged or decaying plant matter and muddy water. Patches of dark, muddy water reflect some light, creating varying dark and slightly brighter areas. The texture is highly irregular and linear due to the plant stems.",
  "color_similarity": "high",
  "texture_similarity": "high",
  "contrast_difference": "low",
  "camouflage_score": 0.9,
  "confidence": 1.0,
  "camouflage_type": "Color blending / Pattern matching / Shape disruption",
  "explanation": "The Bittern exhibits exceptional camouflage in this image. Its plumage is a complex mosaic of browns, beiges, and dark streaks that perfectly mimic the dry and decaying reeds and vegetation of its marshy habitat. The vertical patterns on its feathers align with the strong vertical lines of the surrounding reeds, creating a highly effective pattern matching. The overall color palette of the bird's feathers blends seamlessly with the dominant browns, greens, and grays of the environment (color blending). Furthermore, the bird is hunkered down low, minimizing its distinctive shape and making it appear as part of the tangled vegetation (shape disruption). The low contrast difference between the bird's patterned body and the chaotic background textures makes it extremely difficult for a predator (or observer) to discern its outline, allowing it to blend almost perfectly."
}