{
  "entity_type": "Organism",
  "camouflage_presence": "Camouflage",
  "object_category": "Mammal",
  "object_name": "Dog",
  "background_description": "The background consists of a dense, tall grassy field or meadow. The foreground features vibrant green grass and various wildflowers, including prominent yellow blossoms and some smaller white and pinkish flowers. The mid-ground and background transition into drier, straw-colored tall grasses, with a distant blurred line of darker green trees or dense foliage at the very back.",
  "color_similarity": "medium",
  "texture_similarity": "low",
  "contrast_difference": "medium",
  "camouflage_score": 0.75,
  "confidence": 0.9,
  "camouflage_type": "Shape disruption",
  "explanation": "The dog exhibits effective camouflage primarily due to 'Shape disruption' and 'Color blending' with the surrounding environment. Its brown fur color blends reasonably well with the dried, straw-colored grasses and shadowed areas within the dense vegetation, resulting in medium color similarity. While the fur texture itself is distinct from the linear grass blades (low texture similarity), the sheer density and irregular arrangement of the tall grasses and wildflowers in the foreground and mid-ground effectively break up the dog's outline. Only parts of its head, including an eye, nose, and tongue, are visible peeking through gaps in the foliage, making it difficult to discern the animal's full form. The variable light and shadow within the complex grassy environment further contribute to hiding the dog, despite some areas of medium contrast (e.g., dark nose/eye against lighter grass)."
}