{
  "entity_type": "Organism",
  "camouflage_presence": "Camouflage",
  "object_category": "Reptile",
  "object_name": "Crocodile",
  "background_description": "The background is a body of water completely covered by a dense, vibrant layer of bright lime green duckweed or algae. The surface has a granular, bubbly texture from the small individual plants. There are also slightly darker patches, possibly indicating deeper water or denser clusters of vegetation. The scene is brightly lit by sunlight, creating subtle reflections on the wet surfaces and some soft shadows.",
  "color_similarity": "low",
  "texture_similarity": "medium",
  "contrast_difference": "medium",
  "camouflage_score": 0.65,
  "confidence": 1.0,
  "camouflage_type": "Color blending",
  "explanation": "The crocodile exhibits effective camouflage in this image despite its inherent dark coloration contrasting with the bright green duckweed. Its primary camouflage strategy here involves remaining almost entirely submerged, leaving only the very top of its head, including its eyes and snout, exposed. The rough, textured scales of its head, combined with significant amounts of duckweed clinging to its skin, help to break up its outline and blend its surface with the surrounding vegetation. While the dark brownish-green color of the crocodile's skin itself has low similarity to the vibrant lime green duckweed, the clinging algae acts as a form of color blending and pattern matching, making the crocodile appear as another cluster of vegetation or debris floating on the water. The contrast difference is medium because, despite the overall darkness, its low profile and the textural disruption from the duckweed prevent it from standing out sharply. This concealment allows it to ambush prey or remain unnoticed."
}