{
  "entity_type": "Organism",
  "camouflage_presence": "Camouflage",
  "object_category": "Insect",
  "object_name": "Dragonfly",
  "background_description": "The background consists primarily of a vibrant green leaf or blade of grass, serving as the perch for the dragonfly. Behind this main leaf, there are blurred areas of darker green foliage, suggesting a dense natural environment.",
  "color_similarity": "low",
  "texture_similarity": "low",
  "contrast_difference": "high",
  "camouflage_score": 0.4,
  "confidence": 0.9,
  "camouflage_type": "Disruptive pattern",
  "explanation": "The dragonfly exhibits a form of camouflage known as 'Disruptive pattern' primarily on its wings. The prominent black patches on the semi-transparent wings, along with the distinct veining, serve to break up the insect's outline, making it harder for predators to recognize its true shape. While the blue-grey body contrasts with the vibrant green leaf, and the overall contrast difference is high, the wing patterns' primary function is to disrupt perception rather than blend perfectly with the background color. In a more varied background of dappled light or water, this disruptive pattern could be more effective. On this specific bright green leaf, the effect is somewhat reduced, but the design intent of camouflage is still present."
}