{
  "entity_type": "Organism",
  "camouflage_presence": "Camouflage",
  "object_category": "Fish",
  "object_name": "Pipefish",
  "background_description": "The background depicts an underwater environment, primarily composed of a vibrant reddish-pink coral or sponge substrate. This substrate is uneven, with various nooks, crannies, and textured surfaces. Scattered across the coral are patches of green algae, lighter sandy or detritus-covered areas, and thin, string-like strands of marine plant life or debris. The overall impression is a complex, textured, and varied marine benthos.",
  "color_similarity": "high",
  "texture_similarity": "high",
  "contrast_difference": "low",
  "camouflage_score": "0.95",
  "confidence": "1.0",
  "camouflage_type": "Mimicry",
  "explanation": "The Pipefish in this image exhibits exceptional camouflage through mimicry. Its body is elongated, thin, and covered in textures and small protrusions that make it almost indistinguishable from the surrounding detritus, sandy encrustations, and thin strands of marine plant life (such as seagrass or algae). Its light brownish-sandy coloration perfectly matches the color of these background elements, ensuring high color similarity. The rough, seemingly encrusted texture of the Pipefish's body blends seamlessly with the irregular, textured surfaces of the coral and the various debris caught on it. This combination of color, texture, and shape disruption allows the Pipefish to effectively disappear into the visual noise of its environment, making it incredibly difficult for a predator (or observer) to discern its form from the inanimate background elements. The contrast difference between the Pipefish and its immediate mimicking elements is very low, further enhancing its camouflage."
}