{
  "entity_type": "Organism",
  "camouflage_presence": "Camouflage",
  "object_category": "Mammal",
  "object_name": "Red fox",
  "background_description": "The background consists of tall, green and somewhat dry grasses, indicating a natural outdoor environment. The fox is positioned on a weathered, light greyish-brown log with prominent wood grain and some patches of moss.",
  "color_similarity": "medium",
  "texture_similarity": "low",
  "contrast_difference": "medium",
  "camouflage_score": 0.6,
  "confidence": 0.95,
  "camouflage_type": "Color blending",
  "explanation": "The red fox exhibits a form of camouflage through color blending. Its reddish-brown fur provides medium color similarity with the dry patches of grass and the weathered log it is standing on, helping it to blend into its natural woodland or grassland habitat. While it creates some contrast with the vibrant green grass in certain areas, its overall coloration is well-suited to conceal it amongst earthy tones, dry foliage, and wood, allowing it to remain less conspicuous to prey and predators. The texture of its fur, however, is distinct from the rough wood and the smooth blades of grass, contributing to a lower texture similarity. The black markings on its lower legs and ears also provide some minimal disruptive patterning against certain shadows."
}