{
  "entity_type": "Organism",
  "camouflage_presence": "Camouflage",
  "object_category": "Insect",
  "object_name": "Caterpillar",
  "background_description": "The organism is located within a dense cluster of small white flowers, likely an umbellifer species such as Queen Anne's Lace. The flower head comprises numerous tiny florets; many are pristine white, while others appear to be dried or past their prime, showing beige and light brown coloration in their centers and edges. The overall texture is intricate and somewhat granular due to the multitude of individual blooms. Hints of green stems and leaves are visible in the soft-focus background.",
  "color_similarity": "high",
  "texture_similarity": "high",
  "contrast_difference": "low",
  "camouflage_score": 0.9,
  "confidence": 0.95,
  "camouflage_type": "Color blending / Pattern matching / Shape disruption",
  "explanation": "The caterpillar demonstrates exceptional camouflage, making it very difficult to distinguish from its floral background. Its body exhibits a mottled pattern of white, light brown, and brownish-grey, which perfectly mimics the colors of both the fresh white petals and the dried, discolored florets of the flower cluster. Furthermore, the caterpillar's irregular, bumpy shape and texture disrupt its outline, making it blend seamlessly with the complex, varied textures of the flower head. This combination of color matching, pattern replication, and shape disruption creates a highly effective concealment, rendering the organism almost invisible within its environment."
}