{
  "entity_type": "Organism",
  "camouflage_presence": "Camouflage",
  "object_category": "Fish",
  "object_name": "GhostPipefish",
  "background_description": "The background consists primarily of blurred, murky blue-grey water with scattered bright bokeh effects, indicating shallow, sunlit underwater conditions. In the midground and foreground, there are dense clusters of dark green, somewhat fuzzy, and irregularly shaped marine plant life, likely seaweed or seagrass blades/stems, which are covered in small white speckles, possibly epiphytes or sediment particles.",
  "color_similarity": "high",
  "texture_similarity": "high",
  "contrast_difference": "low",
  "camouflage_score": 0.9,
  "confidence": 1.0,
  "camouflage_type": "Mimicry",
  "explanation": "The GhostPipefish exhibits exceptional camouflage through mimicry. Its body shape is highly irregular and elongated, with numerous frilly appendages, filaments, and textured surfaces that perfectly mimic the surrounding dark green marine plant life (seaweed or seagrass). The fish's coloration, a mottled green-brown, closely matches the color palette of the plants, including the darker, shaded parts and the lighter, more illuminated sections. Furthermore, its rough, 'fuzzy' texture and the presence of small white speckles on its body mirror the appearance of the plants, which also appear to have epiphytes or sediment. This combination of shape, color, and texture matching creates a seamless blend with the environment, making the GhostPipefish nearly indistinguishable from the plant material."
}