{
  "entity_type": "Organism",
  "camouflage_presence": "Camouflage",
  "object_category": "Fish",
  "object_name": "GhostPipefish",
  "background_description": "The background consists of an underwater environment densely populated with various marine flora, including vibrant green algae and other sessile organisms. There are leaf-like structures of varying shades of green, some with whitish tips or edges, and darker, brownish-green patches, creating a textured and intricate tapestry of marine vegetation.",
  "color_similarity": "high",
  "texture_similarity": "high",
  "contrast_difference": "low",
  "camouflage_score": 0.95,
  "confidence": 1.0,
  "camouflage_type": "Mimicry",
  "explanation": "The GhostPipefish in this image exhibits exceptional camouflage, primarily through mimicry of its plant-like environment. Its body color, a vibrant green, perfectly matches the surrounding algae and marine plants. The fish's unique body shape, characterized by flattened, leaf-like appendages and a textured, somewhat rough surface with small filamentous growths, allows it to precisely mimic the form and texture of the surrounding vegetation. Additionally, white patches on its body blend seamlessly with similar light-colored marine growths, further breaking up its outline. This combination of color blending, texture replication, and shape disruption makes it incredibly difficult to distinguish the organism from its immediate environment, providing highly effective concealment."
}