{
  "entity_type": "Organism",
  "camouflage_presence": "Camouflage",
  "object_category": "Fish",
  "object_name": "Pipefish",
  "background_description": "The background consists of a dark, murky underwater environment. It is densely packed with irregular, sediment-covered rocks, various types of detritus, patches of sponges or algae, and some reddish-orange branching structures (possibly hydroids or similar benthic organisms). The overall impression is a cluttered, low-light benthic zone with varied textures and muted, earthy colors.",
  "color_similarity": "high",
  "texture_similarity": "high",
  "contrast_difference": "low",
  "camouflage_score": 0.85,
  "confidence": 1.0,
  "camouflage_type": "Mimicry",
  "explanation": "The Pipefish in this image exhibits exceptional camouflage. Its long, slender body shape remarkably mimics the surrounding detritus, plant matter, and branching organisms, making it appear as an integral part of the cluttered background rather than a distinct organism. The mottled pattern of dark browns, blacks, and muted yellowish-browns on its body perfectly matches the colors of the sediment-covered rocks, decaying matter, and various benthic structures. This high degree of color and visual texture similarity, combined with a low contrast difference against the environment, effectively breaks up its outline and prevents it from standing out. The overall strategy is a strong form of mimicry, allowing it to blend seamlessly into the complex underwater habitat."
}