{
  "entity_type": "Organism",
  "camouflage_presence": "Camouflage",
  "object_category": "Fish",
  "object_name": "Pipefish",
  "background_description": "The background consists of a shallow underwater environment, likely a seafloor or riverbed, composed primarily of various irregularly shaped rocks and coarse sediment. The dominant colors are shades of brown, ranging from dark, muddy browns to reddish-browns and lighter tan or yellowish-brown patches. The rocks appear textured, often covered in fine sediment, detritus, or possibly small growths, giving them an uneven surface. There are also small white specks, likely particles or tiny organisms, scattered across the foreground and background. The water is somewhat turbid, and the lighting is subdued, creating areas of shadow and less distinct outlines for the background elements.",
  "color_similarity": "high",
  "texture_similarity": "high",
  "contrast_difference": "low",
  "camouflage_score": "0.85",
  "confidence": "0.95",
  "camouflage_type": "Pattern matching",
  "explanation": "The Pipefish exhibits excellent camouflage in this image. Its body is adorned with a complex, mottled pattern of dark brown, light brown, and off-white patches. This intricate pattern precisely mimics the varying hues, textures, and irregular shapes found in the rocky, sediment-laden background. The disruptive coloration effectively breaks up the organism's silhouette, making its outline indistinct against the similarly patterned and colored environment. The color palette of the fish closely matches the overall ambient colors of the submerged rocks and sediment, leading to high color and texture similarity and a low contrast difference, which significantly hinders visual detection."
}