{
  "entity_type": "Organism",
  "camouflage_presence": "Camouflage",
  "object_category": "Bird",
  "object_name": "Chaffinch",
  "background_description": "The bird is perched on a dark, textured tree branch covered with small, dried buds or cones. The background is largely out of focus, showing blurred patches of green foliage, warmer brown tones from other branches, and hints of bright sky, characteristic of a natural woodland or forest setting.",
  "color_similarity": "medium",
  "texture_similarity": "low",
  "contrast_difference": "medium",
  "camouflage_score": 0.45,
  "confidence": 0.95,
  "camouflage_type": "Color blending",
  "explanation": "The Chaffinch displays a form of color blending camouflage. Its reddish-brown chest and back, along with its darker wings and head, share similar earthy tones with the bark of the tree branches and the muted background foliage. This provides a medium level of color similarity, helping it to somewhat blend into its natural habitat. However, the bird's smooth plumage offers a low texture similarity to the rough bark, and features like its white wing bars and overall distinct outline create a medium contrast difference, making it noticeable upon close inspection. Despite these contrasts, its general coloration helps reduce its visibility in a woodland environment."
}