{
  "entity_type": "Organism",
  "camouflage_presence": "Camouflage",
  "object_category": "Insect",
  "object_name": "StickInsect",
  "background_description": "The background consists primarily of large, vibrant green plant leaves, likely from a bromeliad or similar plant. The leaves have a smooth to slightly textured surface with some fine striations and distinct serrated edges visible on one of the leaves. There are darker, shadowed areas surrounding the leaves, and a blurry reddish-brown element (possibly a stem or root) is present on the left side.",
  "color_similarity": "high",
  "texture_similarity": "high",
  "contrast_difference": "low",
  "camouflage_score": 0.85,
  "confidence": 0.95,
  "camouflage_type": "Mimicry",
  "explanation": "The StickInsect exhibits highly effective camouflage in this image. Its body is a translucent, vibrant light green, which almost perfectly matches the hue and tone of the surrounding plant leaves. This strong color blending makes it very difficult to distinguish from the background foliage. Additionally, its elongated, slender body shape, even as a juvenile, contributes to mimicry, resembling a young shoot, stem, or part of the plant itself. The insect's smooth, somewhat glossy texture also aligns well with the surface of the leaves, reducing any textural discontinuities. While its eyes and some faint internal structures are visible upon very close inspection, the overall low contrast and excellent color and shape integration make it remarkably well hidden within its environment."
}