{
  "entity_type": "Organism",
  "camouflage_presence": "Camouflage",
  "object_category": "Fish",
  "object_name": "GhostPipefish",
  "background_description": "The background consists of murky, blue-green underwater. The immediate surroundings of the GhostPipefish are dominated by a complex structure of marine growth, likely a coral or hydroid colony, covered in various sessile organisms, algae, and feathery growths. This structure displays a highly textured appearance with branching patterns, fine filaments, and some round, bulbous green growths. The overall color palette of the background marine growth is muted greens, light browns, and off-whites, with some darker shadows and lighter highlights.",
  "color_similarity": "high",
  "texture_similarity": "high",
  "contrast_difference": "low",
  "camouflage_score": "0.9",
  "confidence": "0.95",
  "camouflage_type": "Mimicry",
  "explanation": "The GhostPipefish demonstrates outstanding camouflage in this image. Its body is adorned with numerous frilly, leaf-like appendages and extensions that perfectly mimic the intricate, textured, and irregular branching patterns of the surrounding hydroids, algae, and other sessile marine growth. The fish's coloration, a mosaic of light yellowish-browns, whites, and intricate reddish-brown lines, blends seamlessly with the muted greens, browns, and off-white tones of its immediate environment. This combination of structural mimicry (resembling inanimate plant-like objects), highly effective pattern matching, and color blending completely disrupts the fish's natural outline, making it extremely challenging to distinguish from the dense marine background. The low contrast between the fish and its surroundings further enhances its concealment."
}