{
  "entity_type": "Organism",
  "camouflage_presence": "Camouflage",
  "object_category": "Fish",
  "object_name": "GhostPipefish",
  "background_description": "The background consists of an underwater seafloor composed of coarse sand, various sizes of small pebbles, gravel, and detritus, along with scattered shell fragments. The predominant colors are earthy tones including dark browns, greys, reddish-browns, and some lighter sandy patches and white elements. The texture of the seabed is rough and irregular.",
  "color_similarity": "high",
  "texture_similarity": "high",
  "contrast_difference": "low",
  "camouflage_score": 0.88,
  "confidence": 0.95,
  "camouflage_type": "Mimicry",
  "explanation": "The GhostPipefish demonstrates highly effective camouflage, primarily through mimicry. Its overall translucent, brownish-orange coloration closely matches the diverse earthy tones of the surrounding pebbles, sand, and detritus on the seafloor, resulting in high color similarity and low contrast difference. Crucially, the fish's highly irregular and fringed body shape, including its extended fins, mimics the appearance and texture of dead plant matter or seabed debris. This morphological adaptation, combined with its color and texture blending, effectively disrupts its outline and makes it extremely difficult to distinguish from the rough, varied background."
}