{
  "entity_type": "Organism",
  "camouflage_presence": "Camouflage",
  "object_category": "Fish",
  "object_name": "Pipefish",
  "background_description": "The background consists of a seabed covered with coarse sand, small pebbles, and numerous brown, spherical or cup-shaped sessile organisms (likely ascidians or sponges) that are covered in small dark spots and often have a green central aperture. There are also patches of darker detritus, algae, and encrusted rocks, creating a mottled and textured environment with varying shades of brown, green, and reddish-purple.",
  "color_similarity": "high",
  "texture_similarity": "high",
  "contrast_difference": "low",
  "camouflage_score": "0.85",
  "confidence": "0.95",
  "camouflage_type": "Color blending / Pattern matching / Shape disruption",
  "explanation": "The Pipefish exhibits excellent camouflage in this image. Its elongated, slender body shape is highly similar to the linear features and general detritus on the seafloor, effectively disrupting its outline and making it resemble a twig or a piece of seaweed. Its body coloration, a mottled brown-green with subtle patterns, closely matches the dominant hues of the surrounding substrate, including the sandy bottom, rocks, and various encrusting organisms. While its head shows distinct white and brown stripes, these blend well with areas of lighter and darker tones in the environment. The overall effect is a low contrast difference between the Pipefish and its background, making it very difficult to distinguish from the complex, textured seabed."
}