{
  "entity_type": "Organism",
  "camouflage_presence": "Camouflage",
  "object_category": "Insect",
  "object_name": "Grasshopper",
  "background_description": "The background consists of a dense layer of forest floor litter, predominantly composed of dry, decaying leaves in various shades of brown, tan, and muted orange. Interspersed are thin, dried twigs and branches, along with darker patches of soil or moist debris. The textures are rough, brittle, and irregular, with visible venation on some leaves and the fractured appearance of broken wood.",
  "color_similarity": "high",
  "texture_similarity": "high",
  "contrast_difference": "low",
  "camouflage_score": 0.9,
  "confidence": 0.95,
  "camouflage_type": "Mimicry",
  "explanation": "The organism, interpreted as a leaf-mimicking grasshopper (likely a katydid, which belongs to the same order Orthoptera), exhibits exceptional camouflage. Its body perfectly mimics the shape, color, and texture of a dry, decaying leaf found on the forest floor. The creature's brown, tan, and yellowish-orange coloration blends seamlessly with the surrounding leaf litter. Its flattened body, irregular edges, and pattern resembling leaf venation (and even holes in a decaying leaf) make it virtually indistinguishable from the inanimate background. This high degree of mimicry results in very low contrast and high similarity in both color and texture, making the 'Grasshopper' incredibly difficult to spot."
}