{
  "entity_type": "Organism",
  "camouflage_presence": "Camouflage",
  "object_category": "Fish",
  "object_name": "ScorpionFish",
  "background_description": "The background is a vibrant and diverse coral reef ecosystem. It features various types of corals, including cream-colored branching soft corals, yellow hard corals, and darker encrusting corals. There are also brown and dark grey sponge formations, rocky crevices, and areas of deeper blue water in the upper right with small schooling fish. The overall environment is rich in texture and color variations, providing ample hiding spots.",
  "color_similarity": "high",
  "texture_similarity": "high",
  "contrast_difference": "low",
  "camouflage_score": "0.95",
  "confidence": "1.0",
  "camouflage_type": "Color blending / Pattern matching / Shape disruption",
  "explanation": "The ScorpionFish exhibits outstanding camouflage by combining color blending, pattern matching, and shape disruption. Its mottled purple, reddish, and off-white coloration precisely matches the hues of the surrounding corals and rocky structures. The fish's highly textured skin, adorned with bumps, spines, and irregular fins, perfectly mimics the intricate and rough surfaces of the various corals and sponges in the reef. Furthermore, its irregular body shape and complex patterns effectively break up its outline, preventing a predator or prey from recognizing it as a distinct organism. This combination makes it incredibly difficult to spot against the busy and colorful reef background, allowing it to blend almost seamlessly."
}