{
  "entity_type": "Organism",
  "camouflage_presence": "Camouflage",
  "object_category": "Bird",
  "object_name": "Small bird",
  "background_description": "The background consists of heavily blurred, out-of-focus elements. The upper-left shows warm earthy brown and reddish-orange tones, possibly representing distant tree bark, soil, or dry foliage. The lower-right transitions into muted greenish tones, suggesting blurry distant leaves or vegetation. The bird is perched on a distinct, bright green metal chain link, which appears slightly worn or rusty in places.",
  "color_similarity": "medium",
  "texture_similarity": "low",
  "contrast_difference": "medium",
  "camouflage_score": 0.6,
  "confidence": 0.95,
  "camouflage_type": "Color blending",
  "explanation": "The small bird exhibits natural color blending as a form of camouflage. Its greyish-brown plumage provides medium color similarity with the blurry earthy brown and muted green tones of the natural background, which are typical elements of its habitat. This coloration is inherently designed to help it generally blend into environments containing branches, soil, and dry foliage. However, the bird is perched on a bright green metal chain, an artificial element, which creates a medium contrast difference and makes the bird more noticeable than it would be in a purely natural setting where its color blending would be more effective. Despite this local contrast, its overall drab coloration serves as an adaptive camouflage strategy."
}