{
  "entity_type": "Organism",
  "camouflage_presence": "Camouflage",
  "object_category": "Fish",
  "object_name": "GhostPipefish",
  "background_description": "The background consists primarily of a large, light cream to pale peach-colored feathery soft coral or gorgonian on the right and upper right, displaying numerous delicate, frond-like polyps. To the left and bottom, there is dark, rough reef substrate composed of rocks, darker encrusting organisms, and detritus, with a deep dark area in the mid-left suggesting shadow or open water.",
  "color_similarity": "high",
  "texture_similarity": "high",
  "contrast_difference": "low",
  "camouflage_score": 0.95,
  "confidence": 1.0,
  "camouflage_type": "Mimicry",
  "explanation": "The GhostPipefish exhibits exceptional camouflage in this image. Its pale, whitish-tan body with intricate reddish-brown patterns closely matches the color palette of the surrounding light-colored soft coral. More significantly, its highly elongated and ornate body shape, covered with numerous feathery and spiky appendages, perfectly mimics the texture and structure of the coral polyps and branches. This structural mimicry effectively disrupts the fish's outline and allows it to blend seamlessly into the complex, frond-like environment, making it incredibly difficult to distinguish from the coral itself. The overall low contrast between the fish and the coral further enhances its ability to disappear into the background."
}