{
  "entity_type": "Organism",
  "camouflage_presence": "Camouflage",
  "object_category": "Fish",
  "object_name": "Pipefish",
  "background_description": "The background consists of a dense arrangement of submerged aquatic vegetation, likely seagrass or similar plant blades. These blades are long, slender, and predominantly green, but many are covered with patchy epiphytic growth, appearing as whitish, pinkish, and reddish textures along their surfaces. The overall environment is murky underwater, with soft lighting and a greenish-brown cast.",
  "color_similarity": "high",
  "texture_similarity": "high",
  "contrast_difference": "low",
  "camouflage_score": "0.9",
  "confidence": "0.95",
  "camouflage_type": "Color blending / Pattern matching / Shape disruption",
  "explanation": "The Pipefish exhibits exceptional camouflage in this image. Its slender, elongated body perfectly mimics the shape and orientation of the surrounding aquatic plant blades, making it appear like just another piece of vegetation. Its coloration, a mottled green-brown with lighter speckles, closely matches the green of the plants and the irregular, encrusting marine growth (whitish-pinkish patches) on their surfaces. The texture of the fish's skin, with its subtle irregularities, further blends with the encrusted textures of the background. The low contrast and high similarity in color, texture, and shape make it incredibly difficult to distinguish the organism from its environment."
}