{
  "entity_type": "Organism",
  "camouflage_presence": "Camouflage",
  "object_category": "Fish",
  "object_name": "GhostPipefish",
  "background_description": "The background consists primarily of a green marine plant or algae with broad, irregular, leaf-like structures. Its surface shows textures, minor reddish-brown growths or epifauna along the edges and within the folds, and scattered small white specks. The area surrounding the plant is dark, suggesting a deep-water environment or a focused shot on the subject.",
  "color_similarity": "high",
  "texture_similarity": "high",
  "contrast_difference": "low",
  "camouflage_score": 0.9,
  "confidence": 1.0,
  "camouflage_type": "Mimicry",
  "explanation": "The GhostPipefish exhibits exceptional camouflage, primarily through mimicry. Its body color, a mottled green with lighter white/yellowish patches, almost perfectly matches the various shades of green, white specks, and lighter areas present on the surrounding marine plant. The fish's elongated, segmented, and irregular body shape, coupled with numerous small, frilly, reddish-brown appendages, precisely mimics the branching structure, textured surface, and small growths (such as hydroids or algae) found on the host plant. This mimicry effectively disrupts the fish's outline, making it extremely difficult to distinguish from the environment. The texture similarity, including the small red outgrowths on the fish mirroring similar red elements on the plant, further enhances its blending capabilities. The low contrast difference between the organism and its background contributes significantly to its near-perfect concealment."
}