{
  "entity_type": "Organism",
  "camouflage_presence": "Camouflage",
  "object_category": "Fish",
  "object_name": "Sailfin Tang",
  "background_description": "The background consists of an underwater coral reef environment. In the foreground and lower mid-ground, there are numerous light peach/cream-colored soft corals (likely anemones or polyps) with a highly textured, bumpy surface composed of many small, distinct polyps. Further in the background, the scene shows darker, more varied coral formations and rock structures with shades of deep blue, brown, and hints of green and orange.",
  "color_similarity": "medium",
  "texture_similarity": "low",
  "contrast_difference": "medium",
  "camouflage_score": 0.65,
  "confidence": 0.9,
  "camouflage_type": "Disruptive pattern",
  "explanation": "The Sailfin Tang displays a form of camouflage known as disruptive patterning. Its body is covered in prominent vertical stripes of contrasting light blue/yellow and dark brown/blue. While the fish's overall shape is discernible, these high-contrast stripes are designed to break up its silhouette, making it more difficult for predators to recognize its form, especially in the complex and varied visual environment of a coral reef with its multitude of vertical and irregular structures, shadows, and varying light conditions. Although the fish does not perfectly blend in with the immediate light-colored soft coral in the foreground, the stripes' colors do find some resemblance to the darker, more diverse colors of the corals further in the background, and the pattern's primary function is to distort the fish's outline rather than to achieve seamless color blending with a single background element."
}