{
  "entity_type": "Organism",
  "camouflage_presence": "Camouflage",
  "object_category": "Reptile",
  "object_name": "Lizard",
  "background_description": "The background consists primarily of the trunk of a Rainbow Eucalyptus tree, characterized by striking, irregular patches of various colors including deep purplish-blue, muted green, and areas of darker brown/grey where the bark has peeled. The bark has a relatively smooth but visibly flaking or peeling texture, creating vertical streaks and abstract patterns. Beyond the tree, the background is a blurry natural environment with bokeh lights, suggesting leaves and sunlight.",
  "color_similarity": "medium",
  "texture_similarity": "low",
  "contrast_difference": "medium",
  "camouflage_score": 0.5,
  "confidence": 0.9,
  "camouflage_type": "Color blending",
  "explanation": "The lizards exhibit a brownish-grey coloration with some speckling. While the Rainbow Eucalyptus bark features vibrant patches of blue and green that contrast with the lizards, there are also significant areas of darker, more muted purplish-brown and grey where the bark has peeled or is in shadow. The lizards' color allows them to blend moderately well with these darker, less vibrant sections of the bark. However, their smooth body texture does not match the peeling, stripy texture of the bark, and their distinct elongated shape is not disrupted by the background patterns. The contrast is medium, as they stand out against the brighter colored bark but merge somewhat with the darker tones. Overall, they achieve a moderate level of camouflage through color blending with parts of their complex environment, rather than a perfect, seamless blend."
}