{
  "entity_type": "Organism",
  "camouflage_presence": "Camouflage",
  "object_category": "Insect",
  "object_name": "Katydid",
  "background_description": "The background consists of a forest floor covered with an assortment of fallen organic matter, primarily dried leaves in various stages of decay, small twigs, and pine needles. The dominant colors are shades of brown, reddish-brown, and dark brown, with some areas appearing slightly damp or reflective, suggesting a moist environment. Textures vary from smooth leaf surfaces to ribbed veins and rough woody debris.",
  "color_similarity": "high",
  "texture_similarity": "high",
  "contrast_difference": "low",
  "camouflage_score": 0.9,
  "confidence": 1.0,
  "camouflage_type": "Mimicry",
  "explanation": "The Katydid exhibits outstanding camouflage through an exquisite form of mimicry, specifically resembling a dead leaf. Its dorsal wings are not only colored in deep browns and reddish-browns that perfectly match the surrounding fallen leaves but also feature intricate vein patterns and a overall shape that is virtually indistinguishable from the organic debris on the forest floor. The insect's body, though slightly lighter in tone on the underside, still blends seamlessly with the varied brown hues of the background. This combination of color blending, pattern matching, and highly accurate shape mimicry effectively disguises the Katydid, making it extremely difficult to spot against its environment due to the low contrast difference and high similarity in both color and texture."
}