{
  "entity_type": "Organism",
  "camouflage_presence": "Camouflage",
  "object_category": "Insect",
  "object_name": "Katydid",
  "background_description": "The background consists primarily of green leaves of varying shades and levels of focus. Some leaves are sharply defined with visible veins, while others are blurred, suggesting depth in the foliage. There are bright areas indicating sunlight catching the leaves, and some dappled light and shadow creating a natural, variable texture. The overall environment is lush and verdant.",
  "color_similarity": "high",
  "texture_similarity": "high",
  "contrast_difference": "low",
  "camouflage_score": 0.9,
  "confidence": 0.98,
  "camouflage_type": "Mimicry",
  "explanation": "The Katydid demonstrates exceptional camouflage through a combination of color blending, texture matching, and remarkable mimicry. Its body and wings are almost perfectly the same shade of green as the surrounding leaves, providing excellent color similarity. The texture of its wings, with visible veins and a slightly uneven surface, closely mimics the venation and surface texture of the foliage. Most significantly, the Katydid's overall shape, particularly its broad, flattened wings, is an excellent imitation of a leaf, a classic example of mimicry. This combination makes it very difficult to distinguish the organism from its leafy environment, as its form and features blend seamlessly with the background, resulting in a low contrast difference."
}