{
  "entity_type": "Organism",
  "camouflage_presence": "Camouflage",
  "object_category": "Fish",
  "object_name": "Pipefish",
  "background_description": "The background consists of a complex, uneven underwater reef environment. It features a variety of textures including encrusting corals, algae, and detritus, creating a mottled surface. Colors range from dark browns, reddish-browns, and muted greens to lighter tan and white patches. There are areas of dense growth and shadowy crevices, contributing to a highly irregular and visually busy texture.",
  "color_similarity": "high",
  "texture_similarity": "high",
  "contrast_difference": "low",
  "camouflage_score": 0.85,
  "confidence": 0.95,
  "camouflage_type": "Pattern matching",
  "explanation": "The Pipefish exhibits excellent camouflage in this image. Its elongated, slender body shape allows it to mimic a piece of debris or plant matter common in a reef environment. The fish's coloration, a light base with intricate patterns of darker brown and orange spots and lines, closely matches the diverse hues and textures of the surrounding coral, algae, and detritus. This high color and texture similarity makes it very difficult to distinguish the organism from the background. The low contrast difference between the Pipefish's body and the varied reef structure ensures its outline is not easily detected, allowing it to blend seamlessly into the complex environment through effective pattern matching."
}