{
  "entity_type": "Organism",
  "camouflage_presence": "Camouflage",
  "object_category": "Fish",
  "object_name": "ScorpionFish",
  "background_description": "The background consists of dense, stony coral formations, likely a type of brain coral, characterized by numerous irregular, rounded, and bumpy protrusions. The coral displays a muted palette of greens, greys, and brownish tones, with some darker recessed areas and lighter tips, creating a highly textured and complex underwater environment.",
  "color_similarity": "high",
  "texture_similarity": "high",
  "contrast_difference": "low",
  "camouflage_score": 0.9,
  "confidence": 0.95,
  "camouflage_type": "Pattern matching",
  "explanation": "The ScorpionFish exhibits exceptional camouflage in this image, making it incredibly difficult to spot. Its body coloration, a mottled mix of greens, greys, and subtle reddish-pinkish hues, perfectly matches the varied tones of the surrounding stony coral. Crucially, the fish's highly irregular shape, covered with numerous frilly appendages, spines, and bumps, precisely mimics the complex, textured, and convoluted surface of the coral. This combination of color blending, intricate pattern matching, and effective shape disruption makes its outline nearly indistinguishable from the background, allowing it to merge seamlessly into the environment. The low contrast difference between the fish and the coral further enhances its ability to disappear."
}