{
  "entity_type": "Organism",
  "camouflage_presence": "Camouflage",
  "object_category": "Fish",
  "object_name": "GhostPipefish",
  "background_description": "The background consists of a dense network of branching gorgonian coral or hydroid stems. These stems are primarily a brownish-orange color and are covered in numerous small, spike-like polyps or growths that are whitish to cream in color. The area behind the coral branches is dark, suggesting deep water or a shadowed environment.",
  "color_similarity": "high",
  "texture_similarity": "high",
  "contrast_difference": "low",
  "camouflage_score": 0.9,
  "confidence": 1.0,
  "camouflage_type": "Mimicry",
  "explanation": "The GhostPipefish demonstrates excellent camouflage by perfectly mimicking its environment, which appears to be a gorgonian coral or hydroid. Its elongated body is covered in frilly, leaf-like appendages and segmented structures that precisely replicate the texture and shape of the coral's branching stems and individual polyps. The fish's coloration, a complex pattern of white, reddish-orange, and darker specks, closely matches the brownish-orange stems and white polyps of the background, allowing for remarkable color blending and pattern matching. This combination of mimicry, shape disruption, and color/texture similarity makes the pipefish almost indistinguishable from its surroundings."
}