{
  "entity_type": "Organism",
  "camouflage_presence": "Camouflage",
  "object_category": "Fish",
  "object_name": "ScorpionFish",
  "background_description": "The background consists of an underwater rocky environment heavily covered with diverse marine flora and sessile invertebrates. Dominant features include various types of algae and possibly some corals, presenting a complex tapestry of textures and colors. The colors range from reddish-pink, brown, and dark green to hints of yellow and lighter sandy patches, creating a highly mottled and irregular surface.",
  "color_similarity": "high",
  "texture_similarity": "high",
  "contrast_difference": "low",
  "camouflage_score": 0.95,
  "confidence": 0.95,
  "camouflage_type": "Pattern matching",
  "explanation": "The ScorpionFish exhibits outstanding camouflage in this image. Its body is covered in mottled patterns featuring a combination of browns, reddish-pinks, yellows, and green-tinged hues that precisely match the diverse colors of the surrounding algae-covered rocks and corals. Furthermore, its skin possesses an extremely rough and irregular texture with numerous fleshy appendages and bumps, perfectly mimicking the intricate, lumpy, and branching textures of the marine growths. This combination of color blending, detailed pattern matching, and an irregular, shape-disrupting outline makes the ScorpionFish almost indistinguishable from its environment, providing highly effective concealment."
}