{
  "entity_type": "Organism",
  "camouflage_presence": "Camouflage",
  "object_category": "Bird",
  "object_name": "Robin",
  "background_description": "The bird is perched among a dense network of bare, leafless tree branches. These branches vary in thickness, with many thin twigs crisscrossing the scene, and some thicker, reddish-brown tree trunks visible. The background behind the branches appears to be a bright, diffused light source, possibly an overcast sky or a distant light-colored surface, creating high contrast with the darker branches and the bird.",
  "color_similarity": "low",
  "texture_similarity": "low",
  "contrast_difference": "medium",
  "camouflage_score": 0.6,
  "confidence": 0.9,
  "camouflage_type": "Disruptive pattern",
  "explanation": "The robin is camouflaged primarily through a 'disruptive pattern' created by the environment. The dense, intersecting network of bare tree branches visually breaks up the bird's silhouette, making its distinct shape harder to discern against the cluttered background. While the bird's own dark plumage offers some general blending with the shadows and darker branches, its lighter breast and the bright background create areas of medium contrast. The numerous branches act as visual noise, disrupting the perception of the bird's outline rather than the bird's inherent coloration perfectly blending with the background colors or textures."
}