{
  "entity_type": "Organism",
  "camouflage_presence": "Camouflage",
  "object_category": "Bird",
  "object_name": "Frogmouth",
  "background_description": "The background consists of a tree with several gnarled, greyish-brown branches, some appearing like deadwood with rough, textured bark. Thinner reddish-brown twigs and branches with sparse green and reddish leaves are also visible, creating a natural, somewhat dry, arboreal environment.",
  "color_similarity": "high",
  "texture_similarity": "high",
  "contrast_difference": "low",
  "camouflage_score": 0.95,
  "confidence": 1.0,
  "camouflage_type": "Color blending / Pattern matching / Shape disruption",
  "explanation": "The Frogmouth in the image exhibits exceptional camouflage. Its plumage is a mottled grey and brown, almost perfectly matching the color and tone of the dead tree branch it is perched on. The texture of its feathers closely mimics the rough, gnarled, and cracked bark of the branch, including visible striations that resemble wood grain. The bird's posture, with its body elongated and flattened against the branch, further enhances the illusion, making it appear like a broken stump or a natural protrusion of the wood. A second, smaller Frogmouth is also visible below the larger one, similarly camouflaged. The low contrast difference between the birds and their environment makes them incredibly difficult to distinguish, even upon close inspection, showcasing a highly effective combination of color blending, pattern matching, and shape disruption."
}