{
  "entity_type": "Organism",
  "camouflage_presence": "Camouflage",
  "object_category": "Insect",
  "object_name": "StickInsect",
  "background_description": "The background consists of a dense network of leafless, dry, and thin branches and twigs. These branches are primarily in shades of gray and brown, with some lighter areas catching sunlight. A few small, light-colored buds are visible on some branches. The deeper background is a blurred, dark green/brown suggesting foliage or distant trees, creating a soft, out-of-focus backdrop.",
  "color_similarity": "high",
  "texture_similarity": "high",
  "contrast_difference": "low",
  "camouflage_score": "0.9",
  "confidence": "1.0",
  "camouflage_type": "Mimicry",
  "explanation": "The StickInsect exhibits exceptional camouflage. Its body color, a dull grayish-brown, perfectly matches the dried, leafless branches and twigs it is perched upon. The texture of its exoskeleton also closely mimics the rough bark of the surrounding plant material. Most importantly, its elongated, slender body shape, including its legs held parallel to its body, makes it appear indistinguishable from a small twig or a broken branch segment. This form of mimicry, combined with its excellent color and texture blending and low contrast against the background, makes it incredibly difficult to spot, even upon close inspection. The organism is positioned to enhance this illusion, further blurring the line between itself and the environment."
}