{
  "entity_type": "Organism",
  "camouflage_presence": "Camouflage",
  "object_category": "Insect",
  "object_name": "Grasshopper",
  "background_description": "The background is a natural setting primarily composed of vibrant green plant leaves and stems, with some areas showing reddish-brown hues on stems or older leaves. The majority of the background is out of focus, creating a soft, blurred effect of various shades of green and yellowish-green, providing a lush, leafy environment for the grasshopper.",
  "color_similarity": "high",
  "texture_similarity": "medium",
  "contrast_difference": "low",
  "camouflage_score": 0.75,
  "confidence": 0.95,
  "camouflage_type": "Color blending",
  "explanation": "The grasshopper exhibits excellent camouflage primarily through color blending. Its entire body, including legs and antennae, is a vibrant green color that precisely matches the fresh green leaves and stems of its environment. This high color similarity significantly reduces the visual contrast between the organism and its background, making it difficult for predators to spot. While its distinct insect shape is discernible upon close inspection, the overwhelming color match allows it to blend seamlessly into the lush foliage. The blurred background further aids in obscuring its outline by reducing visual clutter, contributing to its effective camouflage."
}