{
  "entity_type": "Organism",
  "camouflage_presence": "Camouflage",
  "object_category": "Fish",
  "object_name": "Lionfish",
  "background_description": "The background consists of blurred deep blue to teal-green water, appearing relatively uniform and smooth, with some darker ambiguous shapes towards the right, suggesting a deep underwater environment or a tank.",
  "color_similarity": "low",
  "texture_similarity": "low",
  "contrast_difference": "high",
  "camouflage_score": 0.7,
  "confidence": 0.95,
  "camouflage_type": "Disruptive pattern",
  "explanation": "The image features a Lionfish, which inherently possesses camouflage characteristics. Its body and fins are adorned with striking alternating dark brown/black and yellow/white stripes and spots. This disruptive pattern is designed to break up the fish's outline, making it difficult for predators or prey to discern its shape against complex backgrounds like coral reefs, rocky crevices, or sea vegetation in its natural habitat. While the immediate background in this image is a relatively plain, blurred blue-green water, the fish's intricate patterning is a clear example of camouflage, specifically disruptive coloration. The high contrast of its stripes against its own body helps to obscure its form, even if the colors do not perfectly match the uniform background in this particular shot. The spiny fins also contribute to its irregular outline."
}