{
  "entity_type": "Organism",
  "camouflage_presence": "Camouflage",
  "object_category": "Insect",
  "object_name": "Hoverfly",
  "background_description": "The background consists of blurred green foliage, providing a soft, out-of-focus backdrop. In the foreground, the hoverfly is perched on a cluster of vibrant purple lavender flowers, which show some texture and small details.",
  "color_similarity": "low",
  "texture_similarity": "low",
  "contrast_difference": "high",
  "camouflage_score": 0.75,
  "confidence": 0.95,
  "camouflage_type": "Mimicry",
  "explanation": "The image features a hoverfly (Syrphidae family). While it does not blend into the purple lavender flowers or the green background in terms of color or texture, it employs a distinct form of camouflage known as Batesian mimicry. The hoverfly's yellow and black striped abdomen, along with its overall body shape, mimics the appearance of a stinging insect like a bee or wasp. This visual resemblance deters potential predators, who mistake the harmless hoverfly for a dangerous insect. Therefore, camouflage is present in the form of mimicry, even though the insect is clearly visible and exhibits high contrast against its immediate surroundings. The mimicry itself is quite effective, giving it a moderate-to-high camouflage score in this context."
}