{
  "entity_type": "Organism",
  "camouflage_presence": "Camouflage",
  "object_category": "Insect",
  "object_name": "StickInsect",
  "background_description": "The background consists of a dense network of dry, leafless branches and twigs, predominantly in shades of brown and grey, with some areas of faded green foliage. The distant background is out of focus, showing dried grasses and earth tones. Sunlight casts clear shadows, adding to the visual complexity of the branches and creating varying light and dark areas.",
  "color_similarity": "high",
  "texture_similarity": "high",
  "contrast_difference": "low",
  "camouflage_score": 0.9,
  "confidence": 1.0,
  "camouflage_type": "Mimicry",
  "explanation": "The StickInsect in this image exhibits excellent camouflage through mimicry. Its body coloration is a mottled mix of browns and greys, almost perfectly matching the dried twigs and branches it is resting upon and surrounded by. The texture of its exoskeleton also appears rough and bark-like, blending seamlessly with the coarse texture of the wood. Crucially, its slender, elongated body shape, along with its posture and extended limbs, meticulously imitates a broken or dead twig. This shape disruption and perfect visual resemblance make it incredibly difficult to distinguish the insect from the actual branches, rendering it almost invisible to the casual observer. The low contrast difference between the insect and its environment further enhances this illusion."
}