{
  "entity_type": "Organism",
  "camouflage_presence": "Camouflage",
  "object_category": "Insect",
  "object_name": "Katydid",
  "background_description": "The background consists primarily of the rough, textured bark of a tree trunk. The bark is predominantly dark brown to greenish-brown, with prominent ridges, crevices, and patches of what appears to be lichen or moss, giving it a bumpy and irregular surface. Towards the right and in the far background, there is blurred foliage and branches, indicating a natural, possibly forested, outdoor environment with bright highlights from sunlight.",
  "color_similarity": "high",
  "texture_similarity": "high",
  "contrast_difference": "low",
  "camouflage_score": 0.9,
  "confidence": 1.0,
  "camouflage_type": "Pattern matching",
  "explanation": "The Katydid demonstrates exceptional camouflage against the tree bark. Its body color, a mottled greenish-brown, perfectly matches the hues of the bark and the lichen patches growing on it. Crucially, its intricate and irregular texture, featuring numerous spiky protrusions and rough surfaces, precisely mimics the deeply fissured, bumpy, and irregular texture of the tree bark. This excellent pattern matching and color blending make its outline extremely difficult to discern, effectively disrupting its shape and allowing it to appear as an integrated part of the tree trunk rather than a separate organism. The low contrast difference between the Katydid and its immediate surroundings further enhances its concealment."
}