{
  "entity_type": "Organism",
  "camouflage_presence": "Camouflage",
  "object_category": "Fish",
  "object_name": "Pipefish",
  "background_description": "The background consists of a highly cluttered marine seabed, composed of various sized sand grains, small gravel, fragments of coral, shell pieces, and an abundance of detritus, algae, and organic growths. The colors are predominantly muted browns, grays, and whites, with significant patches of reddish-orange, green, and dark brown from different organic materials and sediments. The texture is uneven, granular, and rough.",
  "color_similarity": "high",
  "texture_similarity": "high",
  "contrast_difference": "low",
  "camouflage_score": 0.85,
  "confidence": 0.9,
  "camouflage_type": "Pattern matching",
  "explanation": "The Pipefish exhibits excellent camouflage against the cluttered seabed. Its body coloration, featuring reddish-browns and mottled patterns, closely matches the various shades of sand, coral fragments, and organic detritus in the background. Furthermore, its irregular surface, covered with what appears to be filamentous algae or detritus, mimics the textured and rough nature of the surrounding environment, making its outline difficult to discern. This combination of color blending and texture matching effectively allows it to disappear into the chaotic visual noise of the seabed, making it very difficult for predators to spot. The low contrast difference between the organism and its surroundings further enhances its ability to blend in."
}