{
  "entity_type": "Organism",
  "camouflage_presence": "Camouflage",
  "object_category": "Bird",
  "object_name": "Grouse",
  "background_description": "The background consists of a dense field of predominantly dried heather and grasses, displaying rich reddish-brown, purplish, and dark brown hues. The vegetation has an intricate, somewhat chaotic texture from the numerous twigs and plant structures. Both foreground and background are slightly out of focus, contributing to a soft, blended appearance of the natural patterns.",
  "color_similarity": "high",
  "texture_similarity": "high",
  "contrast_difference": "low",
  "camouflage_score": 0.9,
  "confidence": 0.95,
  "camouflage_type": "Color blending / Pattern matching / Shape disruption",
  "explanation": "The Grouse exhibits highly effective camouflage in this image. Its plumage, a mosaic of reddish-browns, dark browns, and black speckles, perfectly matches the dominant colors of the dried heather and grasses in which it is nestled. The intricate patterns on its feathers mimic the fine textures and broken light/shadow of the dense vegetation, effectively disrupting its outline. The bird's low-lying posture further contributes to shape disruption, making it blend seamlessly into the moorland environment. The low contrast difference, coupled with high color and texture similarity, makes the organism very difficult to spot at first glance, demonstrating excellent crypsis."
}