{
  "entity_type": "Organism",
  "camouflage_presence": "Camouflage",
  "object_category": "Bird",
  "object_name": "Bittern",
  "background_description": "The background consists of a dense array of dry, vertical reeds and stalks in various shades of golden-brown, light tan, and some darker brown tones. The lower part of the image shows shallow water reflecting the reeds, with some submerged and partially exposed dried vegetation and mud.",
  "color_similarity": "high",
  "texture_similarity": "high",
  "contrast_difference": "low",
  "camouflage_score": 0.9,
  "confidence": 1.0,
  "camouflage_type": "Pattern matching",
  "explanation": "The Bittern exhibits excellent camouflage in this image. Its plumage is a complex pattern of brown, black, and cream streaks that perfectly mimic the dry, vertical reeds it is standing amongst. The color palette of the bird matches the golden-brown and tan hues of the surrounding vegetation, providing strong color blending. Furthermore, the vertical streaky patterns on its feathers effectively break up its outline and mimic the linear textures of the dense reeds, making it difficult to distinguish from the background. The low contrast between the bird and its environment, combined with the strong pattern and color resemblance, allows it to blend almost seamlessly into the marshy reed bed, demonstrating highly effective crypsis."
}