{
  "entity_type": "Organism",
  "camouflage_presence": "Camouflage",
  "object_category": "Fish",
  "object_name": "GhostPipefish",
  "background_description": "The background consists of a sandy or silty seafloor, densely covered with coarse sand grains, small pebbles, shell fragments, and various organic detritus. The colors are muted, featuring shades of brown, tan, grey, and reddish-brown, creating a mottled and textured environment with heterogeneous elements.",
  "color_similarity": "high",
  "texture_similarity": "high",
  "contrast_difference": "low",
  "camouflage_score": 0.95,
  "confidence": 1.0,
  "camouflage_type": "Mimicry / Shape disruption / Color blending / Pattern matching",
  "explanation": "The GhostPipefish in this image exhibits exceptional camouflage. There are two individuals present, one dark reddish-brown and one translucent orange-brown. Both fish possess highly irregular, leaf-like appendages and body contours that allow them to perfectly mimic detritus, dead plant matter, or algae found on the seafloor. Their coloration, featuring mottled browns, oranges, and even white speckles on the darker individual, closely matches the varied hues and textures of the sandy, pebbly, and debris-strewn background. This combination of color blending, pattern matching, and especially shape disruption and mimicry makes them extremely difficult to distinguish from their environment, effectively hiding them from predators and prey."
}