{
  "entity_type": "Organism",
  "camouflage_presence": "Camouflage",
  "object_category": "Fish",
  "object_name": "Pipefish",
  "background_description": "The background consists of a complex underwater environment dominated by a rocky or coral substrate. It features numerous branching structures of varying sizes, some covered in a fine, fuzzy, whitish-grey algal growth, while others appear darker, smoother, and greenish-brown, likely due to different types of algae or dead coral. There are shadowy recesses and some lighter sandy patches visible. The overall texture is rough and irregular, with a muted color palette of greys, browns, and dark greens.",
  "color_similarity": "high",
  "texture_similarity": "high",
  "contrast_difference": "low",
  "camouflage_score": 0.85,
  "confidence": 0.95,
  "camouflage_type": "Mimicry",
  "explanation": "The Pipefish exhibits remarkable camouflage in this image. Its elongated, slender body, combined with its muted greenish-brown coloration and subtle mottling, perfectly blends with the surrounding branching coral fragments and algal growths. The segmented texture of its body mimics the irregular surfaces and forms of the background, particularly the darker, smoother algal strands. The Pipefish's shape is itself a form of mimicry, resembling a small branch or piece of algae. The low contrast between the organism and its immediate surroundings further enhances its concealment, making it extremely difficult to discern from the complex, textured environment."
}