{
  "entity_type": "Organism",
  "camouflage_presence": "Camouflage",
  "object_category": "Fish",
  "object_name": "Pipefish",
  "background_description": "The background consists primarily of dense, bright yellow, intricately branched marine flora (likely seaweed or kelp), which is somewhat out of focus in certain areas. There is also a dark blue/black area representing deeper water, and a lighter, rocky or sandy substrate at the bottom, partially obscured by the yellow flora and some green seagrass-like plants.",
  "color_similarity": "high",
  "texture_similarity": "high",
  "contrast_difference": "low",
  "camouflage_score": "0.95",
  "confidence": "1.0",
  "camouflage_type": "Mimicry",
  "explanation": "The Pipefish, specifically a Leafy Seadragon, demonstrates exceptional camouflage in this image. Its body is a vibrant yellow, perfectly matching the dominant color of the surrounding marine flora (seaweed/kelp), resulting in very high color similarity. Crucially, the fish's body is adorned with numerous elaborate, leaf-like appendages that not only match the color but also the intricate branching texture and overall shape of the surrounding plant life. This sophisticated form of mimicry, combined with color blending, effectively disrupts the fish's outline and makes it virtually indistinguishable from its environment, leading to a very low contrast difference and making it extremely difficult to detect."
}