{
  "entity_type": "Organism",
  "camouflage_presence": "Camouflage",
  "object_category": "Fish",
  "object_name": "Pipefish",
  "background_description": "The background consists of a cluttered underwater seabed, primarily composed of light-colored sand, gravel, and various pieces of coral rubble. The textures are rough and granular, with irregular shapes and a mix of muted beige, light brown, white, and subtle reddish-pink hues from coral fragments and detritus. The lighting suggests it's relatively shallow or well-lit, highlighting the grainy texture of the substrate.",
  "color_similarity": "high",
  "texture_similarity": "high",
  "contrast_difference": "low",
  "camouflage_score": 0.9,
  "confidence": 1.0,
  "camouflage_type": "Color blending / Pattern matching / Shape disruption",
  "explanation": "The Pipefish exhibits excellent camouflage in this image. Its long, slender body is colored with a pale, translucent beige base overlaid with small dark spots and faint lines, which perfectly mimic the speckled and granular appearance of the sandy and rubbly seabed. The irregular pattern on its body effectively breaks up its outline, and its muted coloration blends almost indistinguishably with the background's light browns, beiges, and subtle pinkish tones of the coral fragments. Furthermore, its elongated and somewhat bent posture allows it to seamlessly integrate with the irregular shapes and textures of the coral rubble and sand, making it incredibly difficult to distinguish from its environment. The overall contrast between the organism and its surroundings is very low, making it visually merge with the substrate."
}