{
  "entity_type": "Organism",
  "camouflage_presence": "Camouflage",
  "object_category": "Fish",
  "object_name": "Pipefish",
  "background_description": "The background consists of a sandy and rocky seafloor, characterized by fine grains of sand, small pebbles, and irregular, muted brown, gray, and reddish-brown rocky formations. The texture is rough and granular, with various shades creating a mottled appearance. Some parts show blurred detritus or algae growth.",
  "color_similarity": "high",
  "texture_similarity": "high",
  "contrast_difference": "low",
  "camouflage_score": 0.9,
  "confidence": 1.0,
  "camouflage_type": "Color blending / Pattern matching",
  "explanation": "The Pipefish in this image demonstrates excellent camouflage. Its body coloration, a mottled mix of browns, grays, and sandy tones with fine speckles and irregular darker markings, perfectly matches the granular texture and varied hues of the sandy and rocky seabed. The pipefish's surface appears rough and bumpy, mimicking the small stones and detritus of its environment. This high similarity in both color and texture, combined with a very low contrast difference between the organism and its surroundings, makes it extremely difficult to distinguish the pipefish from the background. Its elongated body also blends seamlessly with the irregular contours of the substrate, effectively obscuring its outline and allowing it to become an integral part of the environment."
}