{
  "entity_type": "Organism",
  "camouflage_presence": "Camouflage",
  "object_category": "Fish",
  "object_name": "Pipefish",
  "background_description": "The background consists of a dense underwater environment filled with numerous long, slender aquatic plant blades (likely seagrass or similar vegetation) varying in color from vibrant green to yellowish-brown. Behind the foliage, there is a darker, somewhat murky substrate or rock structure, with hints of reddish coloration and numerous small, bright particles suspended in the water, indicating an aquatic setting. The very bottom shows a lighter, sandy-colored substrate.",
  "color_similarity": "high",
  "texture_similarity": "high",
  "contrast_difference": "low",
  "camouflage_score": 0.9,
  "confidence": 1.0,
  "camouflage_type": "Mimicry",
  "explanation": "The Pipefish exhibits exceptional camouflage in this image. Its long, slender body perfectly mimics the shape and dimension of the surrounding aquatic plant blades, particularly the yellowish-brown ones. The coloration of the pipefish is a muted yellowish-brown, which blends seamlessly with many of the plant stems that share similar hues, appearing as part of the natural vegetation. The texture of the fish's body also appears smooth and linear, congruent with the plant blades. This combination of color blending, shape mimicry, and low contrast difference makes the Pipefish extremely difficult to distinguish from its environment, providing highly effective camouflage."
}