{
  "entity_type": "Organism",
  "camouflage_presence": "Camouflage",
  "object_category": "Mammal",
  "object_name": "Leopard",
  "background_description": "The background consists primarily of a large tree with deeply fissured, rough bark. The bark exhibits a complex texture with varying shades of dark gray, medium gray, and lighter, almost white patches, indicative of lichen or worn areas. There are deep cracks and crevices creating irregular patterns. A lighter, out-of-focus area, possibly sky or distant foliage, is visible behind the tree on the left side.",
  "color_similarity": "high",
  "texture_similarity": "high",
  "contrast_difference": "low",
  "camouflage_score": 0.8,
  "confidence": 0.9,
  "camouflage_type": "Pattern matching",
  "explanation": "The leopard demonstrates significant camouflage in this image. Even though the image is desaturated (grayscale), the leopard's spotted coat exhibits a remarkable similarity in tonal value and pattern complexity to the rough, fissured bark of the tree. The dark rosettes on the leopard's fur effectively mimic the deep shadows and darker crevices within the bark, while the lighter fur between the spots blends with the lighter, rougher areas of the tree trunk. This high degree of pattern matching and color (grayscale) similarity disrupts the leopard's outline and makes it challenging to distinguish from its immediate environment. The overall low contrast difference between the animal's features and the background further enhances its blending capabilities, making it an excellent example of camouflage through pattern and tonal congruence."
}