{
  "entity_type": "Organism",
  "camouflage_presence": "Camouflage",
  "object_category": "Insect",
  "object_name": "StickInsect",
  "background_description": "The background consists primarily of a large, broad green leaf that shows signs of age or wear, with lighter green mottled patches, possibly lichen or dry areas, and small holes. Below and to the right, there are darker green leaves and brown, textured branches. The upper left and other surrounding areas are deep black, suggesting a dark, possibly nocturnal, environment or deep shadow.",
  "color_similarity": "high",
  "texture_similarity": "high",
  "contrast_difference": "low",
  "camouflage_score": 0.95,
  "confidence": 1.0,
  "camouflage_type": "Mimicry",
  "explanation": "The StickInsect in this image exhibits exceptional camouflage. Its body color is a mottled green that perfectly matches the varied green tones of the large leaf it is resting on. The most striking feature contributing to its camouflage is its morphology: the insect's body and legs are covered in numerous thorny, spiky protrusions, mimicking the texture and appearance of a thorny stem or the irregular, jagged edge of a leaf. This 'thorny' texture blends seamlessly with the natural irregularities, vein patterns, and slight imperfections of the surrounding foliage. The overall shape disruption created by these spikes further helps to break up its outline, making it incredibly difficult to distinguish from the plant matter. The low contrast between the insect and its background, coupled with the high color and texture similarity, makes this an outstanding example of mimicry and crypsis, allowing it to blend almost perfectly with its environment."
}