{
  "entity_type": "Organism",
  "camouflage_presence": "Camouflage",
  "object_category": "Insect",
  "object_name": "Grasshopper",
  "background_description": "The background consists of multiple layers of vibrant green leaves. Some leaves show signs of wear and tear, with small holes and slightly irregular edges, suggesting they are part of a natural, dense plant canopy. The lighting highlights the various shades of green, ranging from brighter, glossy areas to darker, shadowed parts, providing a varied green backdrop.",
  "color_similarity": "high",
  "texture_similarity": "high",
  "contrast_difference": "low",
  "camouflage_score": "0.85",
  "confidence": "0.95",
  "camouflage_type": "Color blending",
  "explanation": "The grasshoppers exhibit excellent camouflage primarily through color blending. Their bodies are a vivid green, almost perfectly matching the various shades of green present in the surrounding leaves. This high color similarity significantly reduces their visibility against the foliage, making them very difficult to spot at a glance despite being in plain sight. The elongated, streamlined shape of the grasshoppers also subtly contributes to their blending, as they can be mistaken for stems or leaf structures within the dense vegetation. The texture of their bodies is also smooth and uniform, much like the surface of many leaves, further aiding in visual integration. While their outlines are discernible upon close inspection, the overall low contrast difference between the organisms and their environment makes for highly effective camouflage. A minor reddish patch on the upper grasshopper's abdomen is the only element that slightly breaks the perfect blend, but it's small and overshadowed by the dominant green."
}