{
  "entity_type": "Organism",
  "camouflage_presence": "Camouflage",
  "object_category": "Bird",
  "object_name": "Bird",
  "background_description": "The background consists of snow-covered ground with sparse patches of dry, brown vegetation/grass poking through. The lighting is soft, likely dawn or dusk, casting a subtle pink and purple hue across the snow and sky, creating a gentle, diffused environment. The far background is an indistinct, light purple-pink sky or distant snow-covered terrain.",
  "color_similarity": "high",
  "texture_similarity": "medium",
  "contrast_difference": "low",
  "camouflage_score": 0.85,
  "confidence": 1.0,
  "camouflage_type": "Color blending",
  "explanation": "The Bird, a Snowy Owl, exhibits excellent camouflage. Its predominantly white plumage blends seamlessly with the snow-covered environment, especially under the soft, diffused lighting that casts a pinkish-purple tint on both the owl and the snow. The color similarity is high, significantly reducing its visibility. While the owl's yellow eyes and scattered dark flecks provide some contrast, the overall effect is one of strong color blending, making it difficult for predators or prey to spot it against the snowy backdrop. The soft textures of its feathers also harmonize well with the powdery snow, further aiding its concealment."
}