{
  "entity_type": "Organism",
  "camouflage_presence": "Camouflage",
  "object_category": "Insect",
  "object_name": "StickInsect",
  "background_description": "The background consists of a dark, blurry texture that appears to be dense foliage, tree bark, or a shaded forest floor, with muted greens and browns. In the foreground and around the organism, there are several thin, vertical dark brown woody stems or twigs, as well as some lighter, dried-out plant material.",
  "color_similarity": "medium",
  "texture_similarity": "medium",
  "contrast_difference": "medium",
  "camouflage_score": 0.85,
  "confidence": 0.95,
  "camouflage_type": "Mimicry",
  "explanation": "The StickInsect in this image exhibits excellent camouflage primarily through mimicry and shape disruption. Its elongated, slender body and angular, extended legs perfectly mimic the appearance of the surrounding twigs and plant stems. The organism is positioned amongst actual plant material, enhancing this effect. While its bright green coloration provides only a medium color similarity against the predominantly dark and brown immediate environment, and creates a medium contrast, its incredible structural resemblance to a twig makes it very difficult to distinguish from the background elements. The precise way its legs are angled and its body shape break up its outline, leading the viewer's eye to perceive it as merely another part of the botanical clutter rather than a living creature."
}