{
  "entity_type": "Organism",
  "camouflage_presence": "Camouflage",
  "object_category": "Fish",
  "object_name": "ScorpionFish",
  "background_description": "The background consists of an underwater environment featuring a seafloor composed of coarse sand and various rock formations. These rocks are heavily encrusted with diverse marine life, including textured coral structures (some resembling brain coral), patches of reddish and greenish algae, and possibly sponges. The overall color palette is dominated by earthy tones: browns, beiges, greens, and muted reds, with highly irregular and rough textures.",
  "color_similarity": "high",
  "texture_similarity": "high",
  "contrast_difference": "low",
  "camouflage_score": 0.95,
  "confidence": 1.0,
  "camouflage_type": "Color blending / Pattern matching / Shape disruption",
  "explanation": "The ScorpionFish demonstrates exceptional camouflage in this image. Its body coloration, a mottled tapestry of browns, beiges, and reddish-browns, precisely matches the sandy substrate, the encrusted rocks, and the various marine growths (such as algae and coral) in its immediate surroundings. The fish's highly textured skin, adorned with numerous frilly appendages, spines, and irregular protuberances, perfectly mimics the rough, uneven, and organic surfaces of the surrounding environment. This creates a remarkable texture similarity and effectively disrupts its outline, making it incredibly difficult to distinguish from the background. The overall contrast between the fish and its environment is very low, allowing it to blend seamlessly and become nearly imperceptible. This combination of color blending, pattern matching, and shape disruption provides highly effective concealment."
}