{
  "entity_type": "Organism",
  "camouflage_presence": "Camouflage",
  "object_category": "Fish",
  "object_name": "Stonefish",
  "background_description": "The background consists of an underwater seabed with irregular patches of light-colored sand and extensive areas covered in dark green and brown algae, small rocks, and what appear to be encrusting corals or sponges. The overall lighting is dim, giving the scene a muted, greenish hue.",
  "color_similarity": "high",
  "texture_similarity": "high",
  "contrast_difference": "low",
  "camouflage_score": "0.85",
  "confidence": "0.9",
  "camouflage_type": "Disruptive pattern",
  "explanation": "The central organism, identified as a camouflaged marine fish (likely a stonefish based on its typical camouflage strategy), exhibits highly effective camouflage. Its body coloration closely matches the muted green and brown tones of the surrounding algae-covered seabed, resulting in high color similarity. The textured, intricate, and somewhat geometric pattern on its surface mimics the rough and irregular textures of the rocks and marine growth in the background. This pattern serves as a disruptive pattern, breaking up the fish's outline and making it extremely difficult to distinguish from the environment. The combination of color blending and disruptive patterning ensures a low contrast difference with the background, allowing the organism to blend seamlessly into the underwater environment."
}