{
  "entity_type": "Organism",
  "camouflage_presence": "Camouflage",
  "object_category": "Mammal",
  "object_name": "Sciuridae",
  "background_description": "The background consists primarily of the rough, textured bark of a tree trunk. The bark exhibits various shades of brown and gray, with deep crevices and irregular patterns. A cluster of vibrant green, heart-shaped leaves is visible in the lower-left section, growing on a vine near the base of the trunk. The upper right background is slightly blurred and lighter, suggesting a distant, illuminated area.",
  "color_similarity": "high",
  "texture_similarity": "medium",
  "contrast_difference": "low",
  "camouflage_score": "0.75",
  "confidence": "0.9",
  "camouflage_type": "Pattern matching",
  "explanation": "The Sciuridae (squirrel) demonstrates effective camouflage against the tree bark. Its fur colors, a mix of grays, browns, and cream-colored stripes, closely match the predominant earthy tones of the tree trunk, resulting in high color similarity. While the squirrel's fur texture is soft compared to the rough bark, the varied, 'busy' appearance of its striped pattern, combined with the irregular texture of the bark, helps to create a medium texture similarity by avoiding a smooth, contrasting surface. The distinct dark and light stripes on the squirrel's back serve as disruptive coloration, breaking up its outline and making it harder to discern its complete form against the complex patterns of the bark. This reduces the contrast difference between the organism and its environment. Although not perfectly invisible, the combination of matching colors and disruptive patterns allows the squirrel to blend well with its arboreal habitat, making it less conspicuous to predators and prey."
}