{
  "entity_type": "Organism",
  "camouflage_presence": "Camouflage",
  "object_category": "Insect",
  "object_name": "Ant",
  "background_description": "The background consists of a rough, weathered tree trunk with deep vertical grooves, splinters, and varied textures. The colors range from dark grey and brown to lighter, almost silvery-white patches, with subtle hints of orange-brown within deeper cracks. The right side of the image is out of focus, showing blurred vertical lines of the bark.",
  "color_similarity": "medium",
  "texture_similarity": "low",
  "contrast_difference": "medium",
  "camouflage_score": 0.6,
  "confidence": 0.9,
  "camouflage_type": "Shadow hiding",
  "explanation": "The organism, identified as an Ant, exhibits a degree of camouflage primarily through shadow hiding. It is positioned within a deep, dark crevice in the tree trunk. The dark coloration of the Ant's body, especially its main segments and large eyes, blends well with the deep shadows and dark interior of the hole, reducing its overall visibility. While some lighter, yellowish-brown hairs on its head provide a slight contrast, the strategic placement within the dark recess and its dark tones significantly contribute to its concealment, making it less conspicuous than if it were on the exposed surface of the bark."
}