{
  "entity_type": "Organism",
  "camouflage_presence": "Camouflage",
  "object_category": "Mammal",
  "object_name": "Mountain goat",
  "background_description": "The background depicts a high-altitude alpine environment with dry, yellowish-brown grassy slopes in the foreground, interspersed with small rocks and sparse wildflowers. Further back, dark, rugged mountain slopes with sparse vegetation and patches of snow are visible under a bright sky, suggesting a typical habitat for mountain goats.",
  "color_similarity": "low",
  "texture_similarity": "low",
  "contrast_difference": "high",
  "camouflage_score": 0.3,
  "confidence": 0.95,
  "camouflage_type": "Color blending",
  "explanation": "The mountain goat's thick, white fur is a well-known natural adaptation for camouflage, designed to help it blend into snowy and icy alpine environments. Therefore, camouflage is inherently present as a characteristic of the animal. However, in this specific image, the goat is resting on a patch of dry, yellowish-brown grass, which creates a high contrast with its bright white coat. While snow patches are visible in the distant background, its immediate surroundings do not provide effective color or texture blending, causing it to stand out. The camouflage type is 'Color blending', intended for snow and light rock, which is why its effectiveness is diminished in this grassy setting."
}