{
  "entity_type": "Organism",
  "camouflage_presence": "Camouflage",
  "object_category": "Fish",
  "object_name": "Pipefish",
  "background_description": "The background consists of a cluttered underwater seabed, characterized by coarse sand, sediment, and a rich variety of marine detritus. There are patches of algae, small encrusting organisms, and branching hydroids or plant-like structures. The environment presents a highly textured and mottled appearance with dominant muted colors including yellowish-browns, olive greens, and some darker brown and reddish-orange specks.",
  "color_similarity": "high",
  "texture_similarity": "high",
  "contrast_difference": "low",
  "camouflage_score": 0.9,
  "confidence": 1.0,
  "camouflage_type": "Mimicry",
  "explanation": "The Pipefish exhibits exceptional camouflage in this image. Its elongated, slender body and greenish-yellow coloration perfectly mimic the various plant-like structures, algae, and detritus present on the seabed. The pipefish's form blends seamlessly with the linear and irregular textures of the background, making it appear as just another piece of marine debris or plant stem rather than a living organism. Both its color and texture match the immediate surroundings very closely, and there is a low contrast difference, ensuring it does not stand out visually against the complex background. This combination of color blending and shape mimicry makes it very difficult to detect."
}