{
  "entity_type": "Organism",
  "camouflage_presence": "Camouflage",
  "object_category": "Fish",
  "object_name": "ScorpionFish",
  "background_description": "The background consists of a vibrant and diverse coral reef ecosystem. Prominently featured are various corals, including a deep reddish-pink branching gorgonian (sea whip) on the left, a textured brownish-tan hard coral with small circular polyps on the far left, and a lighter, frilly green and white branching coral structure on the right. The foreground/bottom features a large, smooth, light brown or tan coral formation. The overall environment is rich in complex textures, irregular shapes, and mottled coloration, characteristic of an underwater reef habitat.",
  "color_similarity": "high",
  "texture_similarity": "high",
  "contrast_difference": "low",
  "camouflage_score": 0.9,
  "confidence": 0.95,
  "camouflage_type": "Color blending / Pattern matching / Shape disruption",
  "explanation": "The ScorpionFish exhibits exceptional camouflage by masterfully blending with its intricate coral reef environment. Its mottled coloration, featuring shades of brown, green, and reddish tones, closely matches the various corals and rocks surrounding it, resulting in high color similarity. The fish's highly irregular and frilly body shape, with appendages that mimic the texture of coral branches and rocky outcrops, creates a high texture similarity with the environment. This morphological adaptation effectively disrupts its outline, making it extremely difficult to distinguish the fish as a separate entity from the background. The combination of color blending, pattern matching, and particularly shape disruption leads to a very low contrast difference against the complex background, allowing the ScorpionFish to remain virtually imperceptible to predators and prey alike."
}