{
  "entity_type": "Organism",
  "camouflage_presence": "Camouflage",
  "object_category": "Insect",
  "object_name": "Caterpillar",
  "background_description": "The background consists of several tree branches and twigs of varying thicknesses and textures. The primary perch for the caterpillar is a medium-thick, rough-barked branch with patches of lighter and darker grey-brown. Behind and above, a larger, darker, heavily textured branch is visible. The lighting creates areas of strong shadow and bright sunlight, highlighting the rough textures of the wood. The overall environment is arboreal, with natural woody elements.",
  "color_similarity": "high",
  "texture_similarity": "high",
  "contrast_difference": "low",
  "camouflage_score": 0.9,
  "confidence": 1.0,
  "camouflage_type": "Color blending / Pattern matching / Shape disruption",
  "explanation": "The caterpillar exhibits exceptional camouflage in this image. Its body color, a mottled grayish-brown, perfectly matches the hue of the tree branch it is resting on. Furthermore, its rough, textured skin closely mimics the bumpy, bark-like surface of the branch, creating high texture similarity. The overall contrast between the caterpillar and the background is very low, making it incredibly difficult to spot. Its posture, arched like a twig, also contributes to the camouflage, resembling a natural part of the branch rather than a living organism. This combination of color blending, pattern matching, and shape disruption makes it blend seamlessly with its environment."
}