{
  "entity_type": "Organism",
  "camouflage_presence": "Camouflage",
  "object_category": "Insect",
  "object_name": "Katydid",
  "background_description": "The background consists of a log or branch heavily covered in various shades of vibrant green moss, intermingled with some darker brown and reddish hues from decaying plant matter. The moss has a dense, irregular, and textured appearance with numerous small, upright plant structures. In the far background, there's a dark, out-of-focus area with blurry lighter patches, suggesting distant foliage or dappled light.",
  "color_similarity": "high",
  "texture_similarity": "high",
  "contrast_difference": "low",
  "camouflage_score": 0.9,
  "confidence": 0.95,
  "camouflage_type": "Mimicry",
  "explanation": "The Katydid demonstrates excellent camouflage through a combination of color blending, pattern matching, and mimicry. Its body is mottled with various shades of green and brown that perfectly match the vibrant and decaying moss on the log. The irregular, spiky, and bumpy textures on its exoskeleton intricately mimic the clumpy and textured surface of the surrounding moss and small plant growths. This high degree of color and textural similarity, along with its irregular shape disrupting its outline, makes it incredibly difficult to distinguish from its environment. It effectively mimics a clump of moss or lichen, allowing it to blend seamlessly."
}