{
  "entity_type": "Organism",
  "camouflage_presence": "Camouflage",
  "object_category": "Insect",
  "object_name": "Butterfly",
  "background_description": "The background consists of a prominent brown woody branch with a rough texture, adorned with sharp, purplish-brown thorns. Behind this main branch, there are blurred green leaves and other foliage, creating a soft, out-of-focus natural backdrop with varying shades of green and some dappled light.",
  "color_similarity": "low",
  "texture_similarity": "low",
  "contrast_difference": "medium",
  "camouflage_score": "0.7",
  "confidence": "1.0",
  "camouflage_type": "Mimicry",
  "explanation": "The organism, identified as a Butterfly (as per instruction, though visually it is an insect known as a Treehopper), exhibits effective camouflage through mimicry. Its distinct body shape, especially the extended pronotum, is remarkably similar to a thorn or a woody outgrowth on the plant stem. It is strategically positioned right next to an actual thorn, which greatly enhances the illusion that it is an inanimate part of the branch itself rather than a living creature. While its black and yellow coloration does not perfectly match the purplish-brown of the surrounding thorns or the brown bark, its structural resemblance and precise placement are highly effective in disrupting its outline and making it blend in with the irregular textures and features of the branch. This form of mimicry makes it challenging for predators to distinguish the insect from its environment, despite some color mismatch."
}