{
  "entity_type": "Organism",
  "camouflage_presence": "Camouflage",
  "object_category": "Fish",
  "object_name": "Pipefish",
  "background_description": "The background depicts an underwater environment dominated by a coral reef. Various sponges and corals are visible, including dark, finger-like structures and lighter, encrusting coral formations. The substrate is highly textured, covered with what appears to be detritus, small algae, or fine sediment, giving it a mottled and irregular appearance. The water in the mid-ground and background is a clear blue.",
  "color_similarity": "high",
  "texture_similarity": "high",
  "contrast_difference": "low",
  "camouflage_score": 0.85,
  "confidence": 0.95,
  "camouflage_type": "Pattern matching",
  "explanation": "The Pipefish exhibits excellent camouflage in this image. Its slender, elongated body is pale, almost translucent, with fine, dark, irregular stripes. This coloration and pattern allow it to blend seamlessly with the complex, textured, and mottled surface of the coral and sponge environment. The stripes on its body effectively mimic the irregular detritus, algae, and small growths on the reef, achieving high texture similarity. The overall light tone of the fish also matches the lighter areas of the substrate, contributing to high color similarity and a low contrast difference with its immediate surroundings. This combination of pattern matching and color blending effectively disrupts the fish's outline, making it extremely difficult for a predator or observer to distinguish it from the background."
}