{
  "entity_type": "Organism",
  "camouflage_presence": "Camouflage",
  "object_category": "Amphibian",
  "object_name": "Toad",
  "background_description": "The background consists of dry, sandy soil, a variety of fallen leaves, twigs, and small pieces of dried plant debris. There are also sparse patches of green vegetation, and a large log or branch is visible in the upper part of the image, providing shade. The overall scene is earthy, with dominant tones of brown, tan, and olive green, featuring a rough and varied texture.",
  "color_similarity": "high",
  "texture_similarity": "high",
  "contrast_difference": "low",
  "camouflage_score": 0.9,
  "confidence": 0.95,
  "camouflage_type": "Disruptive pattern",
  "explanation": "The toad exhibits excellent camouflage through a combination of color blending and disruptive patterning. Its mottled skin, featuring shades of brown, green, and gray, closely matches the colors of the dry soil, dead leaves, twigs, and sparse green plants in its immediate surroundings. The bumpy, textured skin further mimics the rough, varied textures of the ground debris. The irregular patterns on its back effectively break up its body outline, making it extremely difficult to distinguish the toad from the heterogeneous background. This high similarity in color and texture, combined with low contrast, allows the toad to blend seamlessly into its environment."
}