{
  "entity_type": "Organism",
  "camouflage_presence": "Camouflage",
  "object_category": "Insect",
  "object_name": "Katydid",
  "background_description": "The background consists primarily of vibrant green foliage, with several leaves prominently in the foreground and midground, some in sharp focus revealing detailed venation and textures, while others are softly blurred. Behind the green foliage, there is a warm, out-of-focus reddish-brown area, suggesting a distant surface like wood, soil, or dried plant material.",
  "color_similarity": "high",
  "texture_similarity": "high",
  "contrast_difference": "low",
  "camouflage_score": "0.88",
  "confidence": "1.0",
  "camouflage_type": "Mimicry",
  "explanation": "The Katydid exhibits excellent camouflage by mimicking its leafy environment. Its body, particularly the wings, is a vibrant green that perfectly matches the color of the surrounding foliage, resulting in high color similarity. Furthermore, the texture and shape of its wings strongly resemble individual leaves, with visible 'veins' that mimic the venation patterns found on the real leaves. This pattern matching, combined with the overall leaf-like form, allows the Katydid to blend seamlessly, making it difficult to distinguish from the plant itself. The low contrast difference between the insect and its surroundings further enhances this camouflage, reducing its visual prominence. This strategy is a strong example of mimicry, where the organism's appearance imitates a natural object in its habitat."
}