{
  "entity_type": "Organism",
  "camouflage_presence": "Camouflage",
  "object_category": "Fish",
  "object_name": "GhostPipefish",
  "background_description": "The background consists of a dense and complex underwater reef environment. It features various types of coral, sponges, and marine growth, predominantly in shades of dark reddish-brown, vibrant orange, greenish-brown, and some lighter cream/white patches. The textures are highly irregular, rough, and feathery, with branched structures visible, particularly a prominent orange, frilly-looking growth on the right side of the image.",
  "color_similarity": "high",
  "texture_similarity": "high",
  "contrast_difference": "low",
  "camouflage_score": 0.9,
  "confidence": 0.95,
  "camouflage_type": "Mimicry",
  "explanation": "The GhostPipefish exhibits excellent camouflage in this image. Its body coloration, which includes yellows, whites, and reddish-brown patterns, closely matches the diverse color palette of the surrounding reef. More critically, its highly irregular, frilly, and segmented body shape, along with numerous appendages, perfectly mimics the texture and form of various sessile marine invertebrates such as hydroids, feather corals, or algae that are abundant in its environment. This high degree of morphological mimicry, combined with effective color and pattern matching, allows it to blend seamlessly and disrupt its own outline, making it extremely difficult to distinguish from the background. The overall contrast difference between the fish and its surroundings is low, further aiding its concealment."
}