{
  "entity_type": "Organism",
  "camouflage_presence": "Camouflage",
  "object_category": "Fish",
  "object_name": "GhostPipefish",
  "background_description": "The background consists primarily of a dense cluster of long, thin, dark, needle-like structures, which are the spines of a sea urchin or a similar spiky marine organism. Behind these immediate dark spines, the water is murky, revealing blurry greenish and yellowish-brown forms, indicative of distant coral or underwater vegetation.",
  "color_similarity": "high",
  "texture_similarity": "high",
  "contrast_difference": "low",
  "camouflage_score": 0.88,
  "confidence": 0.95,
  "camouflage_type": "Mimicry",
  "explanation": "The GhostPipefish exhibits excellent camouflage through mimicry. Its elongated, dark body, covered with numerous small, spiky projections, very closely resembles the dark, needle-like spines of the sea urchin it is nestled among. The predominant dark coloration of the fish perfectly matches the dark spines, resulting in high color and texture similarity. While the bright white and orange spots on the fish create some localized contrast, these spots likely serve to further disrupt its outline or mimic particulate matter or other elements within the spiky environment. Overall, the fish's shape, texture, and dominant color allow it to blend seamlessly with the sea urchin spines, making it extremely difficult to distinguish from its surroundings."
}