{
  "entity_type": "Organism",
  "camouflage_presence": "Camouflage",
  "object_category": "Bird",
  "object_name": "Killdeer",
  "background_description": "The background consists of out-of-focus dry ground cover, primarily light brown and tan dried leaves, grass, and sparse soil. There are some indistinct hints of muted greenish-yellow vegetation.",
  "color_similarity": "medium",
  "texture_similarity": "medium",
  "contrast_difference": "high",
  "camouflage_score": 0.75,
  "confidence": 0.98,
  "camouflage_type": "Disruptive pattern",
  "explanation": "The Killdeer displays effective camouflage primarily through disruptive patterns and a degree of color blending. Its brown upperparts and head coloration offer medium color similarity with the dry, earthy background, helping it blend into its natural habitat. The most prominent feature of its camouflage, however, is the bold black and white banding on its chest and head. These high-contrast markings serve as a disruptive pattern, breaking up the bird's overall silhouette and making it difficult for predators to recognize its form against the varied textures and colors of the ground. While the black and white themselves are high contrast, their strategic placement makes the bird's shape harder to discern."
}